User handle,Date of tweet,Tweet Data
j_edwards_photo,06-04-2017,The latest Photography and Entertainment News! http://paper.li/j_edwards_photo/1361177756?edition_id=9ced1550-1ab7-11e7-91e8-0cc47a0d15fd … #training
eugene_gaughan,06-04-2017,Continuous entertainment unlike the continuous torture we're currently experiencing at the Soulless Bowl https://twitter.com/davidgold/status/849993884100947975 …
blingzmagazine,06-04-2017,Yemi Alade Finally Confess Dating Her Manager, Taye Aliyu  #entertainment #love #nigeria… https://www.instagram.com/p/BSjErqIgeaq/ 
going5rounds,06-04-2017,#ThursdayThoughts with guest @Kontrahdiction #5rounds #poetry #hiphop #entertainment #podsincolorhttps://soundcloud.com/going5rounds/its-a-kontra-diction-round-59 …
drfeljo,06-04-2017,Matheson's entertainment blog cd review - http://docfellmusic.com/home/blog/matheson-s-entertainment-blog-cd-review …
miamiravellc,06-04-2017,http://MiamiRave.com  | High Quality Entertainment for your viewing pleasure
MCRcars,06-04-2017,Everything you need as a visitor to #Manchester is a click away #Accommodation #Entertainment #Shopping #Food #Drink http://www.visitmanchester.com pic.twitter.com/0DGJpAWm3Z
marac00per,06-04-2017,SleepWake - Video Alarm Clock Lifestyle Entertainment | iPhone... https://goo.gl/fb/Zxniez  #iphone #lifestyle #entertainment
theultsrc,06-04-2017,Bella Hadid shares a steamy shot of her herself relaxing in a nude swimsuit as https://is.gd/4MZfVx  #celebrities #celebs #entertainment
incrediblebee_,06-04-2017,I'm tired of y'all using animals for entertainment and not knowing how to care for them and chunking them.
MichaelSheehyJr,06-04-2017,The star of the attraction is the queue. It's great entertainment in the AC
SmartTVBoxie,06-04-2017,After #Census2016, turns out everyone is eligible for the next-generation home entertainment device! Learn more: https://www.smarttvbox.ie/smarttvbox-ie/this-is-smart-tv-box.html …pic.twitter.com/BPEpKIdWAU
flopback,06-04-2017,Cryptozoic Walking Dead Season 2 - Shadowbox Card SB05 by Cryptozoic Entertainment https://www.bittopper.com/item/cryptozoic-walking-dead-season-2-shadowbox-card-sb05-by/ …
93skedoo,06-04-2017,They ceased being news sources a long time ago. All cable news is entertainment and ratings driven. Sadly most use it as only source.
TheTwoEssences,06-04-2017,Check out Pledge to support THE TWO ESSENCES TV Sitcom Pilot by Jade Films and Entertainment on @Kickstarterhttp://kck.st/2nAj2hj 
RetroNuss,06-04-2017,http://goo.gl/k3iJJY  Nintendo Entertainment System NES Classic Edition Mini US FREE QUICK SHIPPING http://dlvr.it/NqCB0s pic.twitter.com/4IJyB8Jb9X
madroneartbar,06-04-2017,Tonight at Madrone Art Bar: MACY BLACKMAN & PORRETA FORRO NIGHT Happy Hour Entertainment 6-9 with Macy Blackman... http://fb.me/29XoBRmX1 
RetroNuss,06-04-2017,http://goo.gl/k3iJJY  Nintendo Entertainment System: NES Mini Classic Edition Console with 30 Games http://dlvr.it/NqC9fc pic.twitter.com/7VHkbeVPWb
SourcewithKenta,06-04-2017,Found over $42.52 in potential profit from Amazon/Books/Humor & Entertainment to sell on Amazon! http://www.kentaarbitrage.com/sourcing  #OA
ManTschannen,06-04-2017,Subscribe to UKURBANSFINEST YOUTUBE CHANNEL BEST IN MUSIC & ENTERTAINMENT https://www.youtube.com/channel/UCTio9A3S43ZVdMw9KFgh0aQ?EJCfI …
jeonoasis,06-04-2017,43. Fav entertainment?
TheBeatles1v,06-04-2017,#Entertainment #Buzz: 45 Rock Lot #Beatles Rolling Stones Deep Purple Byrds Lemonade Charade Jade Warri http://dlvr.it/NqC97l pic.twitter.com/oTTGxZTFit
RiversofGrue,06-04-2017,.Unmissable deep space terror. READ REVIEW LIFE http://wp.me/p3b799-kqW  #lifemovie #horror #scifi #film #entertainment @LifeMovie
bollywoodnow11,06-04-2017,Raveena Tandon: It Is Challenging & Hard To Survive In The Entertainment Industry If You… http://www.bollywoodnow.org/raveena-tandon-it-is-challenging-hard-to-survive-in-the-entertainment-industry-if-you-are-honest/ …pic.twitter.com/A7HDmzcshw
Vision_ae,06-04-2017,Superhero stories are more than entertainment. Do you agree? @MEFCC @MiniB622http://vision.ae/art-life/culture/comic-con-2017-comic-books-give-us-the-power-to-understand-real-life-villai?utm_source=twitter&utm_medium=social&utm_campaign=comic%20con%202017 …
joepine,06-04-2017,Michael Counts: immersive entertainment "has reached a tipping point; we are seeing the beginning of an entertainment experience economy." https://twitter.com/CharlieFink/status/849276358710763520 …
fepohix,06-04-2017,san antonio adult massages and entertainment http://bit.ly/2oN9NLl 
SMalhotraFC,06-04-2017,It goes on the floors in May. Presented by Reliance Entertainment and Plan C Studios," #Aiyaary
cherokee_autumn,06-04-2017,Don't expect to change your mind. Just enjoy the entertainment.
chatterboxx_net,06-04-2017,Mel B's husband denies 'outrageous' abuse claims https://goo.gl/fb/kEl71j  #entertainment
filmandtvpro,06-04-2017,Head of Entertainment Marketing, London #marketingmanager #jobs #filmhttp://www.filmandtvpro.com/uk/job/402526/newjob/?utm_medium=twitter&utm_source=jobalert&utm_campaign=j402526d2017-04-06 …
EnticingENT,06-04-2017,Enticing Entertainment embraced the chaos at the International Live Events Association - MSP #MNStarAwards! The...http://fb.me/8zGG0cDKG 
gamebestsellers,06-04-2017,Nintendo Entertainment System NES Classic Edition White Console http://ift.tt/2p2TGJ0  #nintendo #gaming $140.00 End Date: Friday May-5-…pic.twitter.com/gO0qLIBnpT
vloyacom,06-04-2017,Check out this Amazon deal: God Gave Us Easter by Lisa Tawn Bergren http://amzn.to/2p5wmKA  #Books #Entertainment #Humor
BiziTalking,06-04-2017,Steelasophical Musical Entertainment •::: http://STEELBAND.CO.UK  :::• At Steela… http://ift.tt/2mXZO8z  @Steelasophicalpic.twitter.com/KCJ6GBleFh
jainusha30,06-04-2017,Baby. #Reliance #Entertainment
Twilight_en,06-04-2017,I have to be at my best when she arrives with the delegates from Saddle Arabia. I can't believe she's trusting /me/ with the entertainment.
untiItoday,06-04-2017,Alright we're done maney thanks for the entertainment. It was fun https://twitter.com/bhyunist/status/849997422272983041 …
Directors_UK,06-04-2017,Entertainment Weekly meets up with 'the original mansplainer' from Annie Hall. http://ew.com/movies/2017/04/05/annie-hall-ticket-line-untold-story/ …
vloyacom,06-04-2017,Check out this Amazon deal: Pete the Cat: Big Easter Adventure by James Dean http://amzn.to/2nHKmsM  #Books #Entertainment #Humor
_lindsayp,06-04-2017,It was for an entertainment segment.
jswmediagroup,06-04-2017,The latest JSW Pulse...Entertainment & More! http://paper.li/jswmediagroup/1315579897?edition_id=894afaa0-1ad8-11e7-a2b4-002590a5ba2d … #socialmedia #marketing
Ash1898,06-04-2017,entertainment allowance maximum RM100k
vloyacom,06-04-2017,Check out this Amazon deal: The (unofficial) Hogwarts Haggadah by Moshe Rosenberg http://amzn.to/2nHB5kM  #Books #Entertainment #Humor
IoTBlogs,06-04-2017,Parks Associates: 55% of U.S. broadband households find it appealing to control entertainment and smart home devices through voice commands…
fomaramteke,06-04-2017,There is a reason why Jos Buttler has been sent up the order and he is doing his job it quite well! Pure entertainment! #IPL #RPSvMI
KateMossStore,06-04-2017,#Entertainment #Buzz DEATH NYC - #KateMoss LV BLK/RED - Signed & #AP/100 - NEW - like SHEPARD #Forsale #onsale… http://dlvr.it/NqC6Cs pic.twitter.com/6FWxNLGqhR
thncom,06-04-2017,Home Entertainment: Allied Blu-Ray review http://www.thehollywoodnews.com/2017/04/06/home-entertainment-allied-blu-ray-review/ …pic.twitter.com/qt7we3MsIF
booksandthebear,06-04-2017,Funny and perceptive...PRIVATE CLUBS IN AMERICA AND AROUND THE WORLD @ClivetheClubGuy http://amzn.to/1QcnU6y  #humor #entertainment
HerrejonPedro,06-04-2017,Don't Just Subsidise Art, Start Taxing Junk Entertainment http://www.abc.net.au/religion/articles/2017/03/23/4641455.htm … via @abcreligion
thelookinglist,06-04-2017,Its rainy and wet in the NY/NJ area. It does not dampen our enthusiasm to help everyone in Entertainment!! http://Www.thelookinglist.com  #artists
richlandcollege,06-04-2017,#RichlandCollege will host a day of family fun with free food, entertainment, and children’s activities! For more: http://bit.ly/2oInyhd pic.twitter.com/WkQZFnwXTr
EstokOllo,06-04-2017,No. Keep the damn politics out of entertainment.
incognitoartist,06-04-2017,Looking for #wedding #entertainment ideas? Get in touch for your bespoke entertainment package >>> http://www.incognitoartists.com/contact-us/  #meltheartspic.twitter.com/MUHrPIr3Zf
powis_sharmain,06-04-2017,@LarchwoodPS cam has learnt how to be a Trooper Krew member.He's on stage tonight with them doing end of kids entertainment dance :) pic.twitter.com/7LgTYru1Q6
JoinfoEng,06-04-2017,Christian Bale, Steve Carell And Amy Adams Up For Adam McKay’s New Film https://goo.gl/fb/CgtxYn  #entertainment
NathanielStampr,06-04-2017,“Contemporary worship is all about entertainment!” says the traditional church that raucously applauds its musicians in worship.
everiting,06-04-2017,Trans-Siberian Orchestra Founder Paul O'Neill Dies at 61 http://zpr.io/P9WeJ  #music #entertainment
everiting,06-04-2017,Kodak Black Accused of Assaulting an Employee at a Miami Strip Club http://zpr.io/P9Wei  #music #entertainment
FoghornBLeghorn,06-04-2017,<cut to commercial> "When we return will Roy get the entertainment space he covets or will Sally get the MIL room she wants"
news_bob,06-04-2017,Latest Oregon news, sports, business and entertainment http://fb.me/8RB7REUKi 
INCLUDAS,06-04-2017,TY #CSUN & @NickiKatz for putting together such a great event last night on "The Business Side of Entertainment"! @IdVEgopic.twitter.com/IG5n5mYe9o
WiseFortunes,06-04-2017,This app is great for entertainment, marketing, making , motivation, and to keep up with current events. Don't let it genuinely bother you
bestsellersvip,06-04-2017,Nintendo Entertainment System NES Classic Edition White Console http://ift.tt/2p2TGJ0  #nintendo #gaming $140.00 End Date: Friday May-5-…pic.twitter.com/41f9MEaVCS
jobzeljobs,06-04-2017,Publicity Coordinator - Global Eagle Entertainment http://bit.ly/2o1gnhh  #usa #america #hiring #tweetmyjobs #hr #jobopening #JobListing …
MoviesRopel,06-04-2017,#entertainment Scott Disick Admits He Still Gets Turned on by "Love of My Life" Kourtney Kardashian: "I… http://dlvr.it/NqC4GJ  #hollywoodpic.twitter.com/NfvipfXzHG
ControversialMJ,06-04-2017,#GossipKourtney Kardashian & Scott Disick: BACK TOGETHER in Hawaii! http://dlvr.it/NqC467  #Entertainment pic.twitter.com/SxSGDhAE0v
iJaiDeep_,06-04-2017,What an outstanding six by butler !! told yaa this ipl will give us more entertainment !! Chauke chakke hi lagne wale hain.. #MIvRPS
nekrophonics,06-04-2017,Xbone will never be anything but a Home entertainment system till they get their exclusives up, stop pawning this shit as a gaming console!!
vloyacom,06-04-2017,Check out this Amazon deal: The Subtle Art of Not Giving a F*ck: A Counte... by Mark Manson http://amzn.to/2oN4tYF  #Books #Entertainment
MissAmyRed,06-04-2017,That would be daaaaaaays of entertainment for the price of one car wash. pic.twitter.com/i9UXZyByrS
1800Vacations,06-04-2017,FLASH Entertainment Concludes Event Management and Production of Successful Mother of the Nation Festival 2017 http://prn.to/2nHLFIx  #Tr…
TeamTriviaMO,06-04-2017,7 shows on THURSDAY NIGHT! Edison's Entertainment Complex in Edwardsville, IL at 7 PM with Matt Mikey's Pour... http://fb.me/116TJwtF1 
sunshinerewards,06-04-2017,Entertainment Book Digital Membership only $20 plus Free $10 Amazon Gift Card with Coupon http://ow.ly/Ihk950aGdvy 
Nico_MoGwap,06-04-2017,Lol! There's nothing controversial if WE ALL know that our Entertainment officer was removed before the line up was posted. https://twitter.com/themba_mnisi12/status/849993023207460864 …
MakeupTrends24,06-04-2017,9 Women-Run #Podcasts You Should Be Listening To #culture #entertainment #cherylstrayed #elizabethgilbert #lenadunham #newpodcasts
DavidStonis,06-04-2017,Subscribe to UKURBANSFINEST YOUTUBE CHANNEL BEST IN MUSIC & ENTERTAINMENT https://www.youtube.com/channel/UCTio9A3S43ZVdMw9KFgh0aQ?QC1E …
411SportsDFW,06-04-2017,[ #411Sports] #Entertainment Nick Lachey says a new 98 degrees project is 'in the works' http://ift.tt/2oMZ6Z8 
MarkKassMBJ,06-04-2017,Register today to attend: @packers' Mark Murphy & @Summerfest's Don Smiley to be part of Biz of Entertainment, 5/16 http://www.bizjournals.com/milwaukee/news/2017/04/03/packers-president-murphy-summerfests-smiley-to-be.html …
TradersRule,06-04-2017,Sweet Emotion smith “I’m and entertainment Lawyer in Beverly Thrills” https://www.youtube.com/watch?v=82cJgPXU-ik …
InanceSkincare,06-04-2017,Mama June on Entertainment Tonight wearing items from the Inance Casual wear collection. Look cute and trendy and... http://fb.me/4XY93Ifv5 
KatyATRL,06-04-2017,New Katy News: Demi Lovato Belts Out Adele, Katy Perry, and More in Epic Diva Riff ... - Entertainment Tonight http://ift.tt/2odQH39 
DavidStonis,06-04-2017,Subscribe to UKURBANSFINEST YOUTUBE CHANNEL BEST IN MUSIC & ENTERTAINMENT https://www.youtube.com/channel/UCTio9A3S43ZVdMw9KFgh0aQ?i5pHz …
MoviesRopel,06-04-2017,#entertainment Lena Dunham Gets Naked For Jimmy Kimmel's Golden GIRLS Spoof — See What The Wrinkly… http://dlvr.it/NqC2q6  #hollywoodpic.twitter.com/NIzonJx9pt
MoviesRopel,06-04-2017,#entertainment Late Night Goes After Pepsi's Tone-Deaf Kendall Jenner Ad! http://dlvr.it/NqC2p4  #hollywood
MoviesRopel,06-04-2017,#entertainment Mel B’s Sister Comes For Stephen Belafonte With Scathing Post: 'Rot In Hell' http://dlvr.it/NqC2hF  #hollywoodpic.twitter.com/esEFiE2RJC
ghost_a_boo,06-04-2017,[Entertainment] - Whitewash: Ghost in the Shell fail shows why Hollywood should discover diversity | Sydney Mornin… http://ift.tt/2oNae8z pic.twitter.com/USHQBBjcaa
GaryKilburn,06-04-2017,@VillansHo be good for a kids match on pitch - some half time entertainment (hint hint)
NewOrleansWill,06-04-2017,. @FQFestNOLA starts tomorrow! This festival brings entertainment, jobs, and money into our city. #NolaNOWpic.twitter.com/1BhWSsQGGT
MKEBizJournal,06-04-2017,Register today to attend: @packers' Mark Murphy & @Summerfest's Don Smiley to be part of Biz of Entertainment, 5/16 http://www.bizjournals.com/milwaukee/news/2017/04/03/packers-president-murphy-summerfests-smiley-to-be.html …
backallybts_twt,06-04-2017,For white people entertainment don't no body else watch that shit
librarydurham,06-04-2017,From Aintree to Sheff Wedz we've got this weekend's sporting entertainment covered ! #livesport #AintreeFestival #grandnational2017 #nufcpic.twitter.com/Bc0NjAGRCH
HEARTBEATZent,06-04-2017,Free food Free drinks Free entertainment Free TATOOS Free fun jumps (bring ya kids) AUTOGRAPH SIGNING BY A VERY... http://fb.me/7BrNjVVzL 
alehouse2013,06-04-2017,Here is April's Line-Up for Entertainment...No Cover! Come in and enjoy ... great food, excellent service,... http://fb.me/1bhfQuXft 
yasminmitri,06-04-2017,#Entertainment Is SYLVESTER STALLONE Playing This Classic GUARDIANS OF THE GALAXY Member? Potential… http://dlvr.it/NqC1yd  #YasminMitri
Gabriel_MM_,06-04-2017,Damon, Sean and Jon - Lucas Entertainment - 3/10 https://tmblr.co/Zwy2Fx2KK-V8T 
Vlife__,06-04-2017,bruh, why u depending on an entertainment magazine to talk about world news https://twitter.com/uptownjavi/status/849315360922886144 …
YoungQuan4912,06-04-2017,Lil Clint "My Brotha" video otw...Directed by A KENXL film EST 4912 Entertainment #Mobbb #LLM #Gangster @est4912LilClintpic.twitter.com/dk311Cwxyx
vloyacom,06-04-2017,Check out this Amazon deal: A Man Called Ove: A Novel by Fredrik Backman http://amzn.to/2oN8LPy  #Books #Entertainment #Humor
everiting,06-04-2017,Chris Stapleton reveals ‘From A Room’ is getting a second volume http://zpr.io/P9WJa  #news #entertainment
nvision_360,06-04-2017,The Latest Fashion Ideas For Curvy Women - http://www.viralgoo.com/the-latest-fashion-ideas-for-curvy-women/ …, , #ENTERTAINMENT pic.twitter.com/ISr4JorR7f
myGOSSland,06-04-2017,Madonna’s Waited Almost 30 Years To Drag Pepsi. This Is Her... http://www.huffingtonpost.com/2017/04/06/madonnas-waited-almost-30-years-to-drag-pepsi-this-is-her-moment_n_15847976.html?utm_hp_ref=celebrity&ir=Celebrity … #tv #entertainment #gossippic.twitter.com/o40t9t5bEm
vloyacom,06-04-2017,Check out this Amazon deal: The 5 Love Languages: The Secret to Love that.. by Gary Chapman http://amzn.to/2oN9EaT  #Books #Entertainment
UCWNews,06-04-2017,Box-Office Preview: 'Smurfs 3,' 'Going in Style' No Match for 'Boss Baby,' 'Beauty' http://dlvr.it/NqC0Jr  #Film #Entertainment pic.twitter.com/CdJoJzcmOd
kaya_lah,06-04-2017,we let black entertainment praise & re-enforce the stripper culture for 10 years plus...
SophieK_18,06-04-2017,I could always send you ridiculous Snapchat videos for your entertainment. You know I'm good for it
vloyacom,06-04-2017,Check out this Amazon deal:The Wonderful Things You Will Be by Emily Winfield Martin http://amzn.to/2oNgcGH  #Books #Entertainment #Humor
iamsoundgoodent,06-04-2017,New post (KING BELVY FOREVER FREESTYLE FRIDAYZ) has been published on Soundgood Entertainment - http://soundgoodent.net/king-belvy-forever-freestyle-fridayz/ …
skepticpedi,06-04-2017,Meanwhile, children of color have had extremely limited options when it comes to toys, entertainment, role models, etc.
missceliespants,06-04-2017,Wonder how this would read for entertainment industry.... How Women Over 50 Can Keep Their Careers on Track https://nyti.ms/2nHRCXo 
tvNolly,06-04-2017,The amazing nollywood super-star @mercyjohnsonokojie on her inauguration as the SSA to the Kogi state govt. on Entertainment.... pic.twitter.com/g2VdBmF3UQ
NinaDobrevFans8,06-04-2017,#NinaDobrev Vintage Havana Stripe Pocket Tank ASO Nina Dobrev in Gray Navy M NWT #Entertainment #Buzz http://dlvr.it/NqByXx 
isd544,06-04-2017,Some great, FREE entertainment is in store for you this evening! Join us! http://fb.me/8wt5WvG4m 
BransomBobcats,06-04-2017,Tonight's the Night!! "SWAMPED" is set up and ready for YOU. Join us in the Centennial HS auditorium at 6:00 for some amazing entertainment.
ChristaNicole94,06-04-2017,What does one do for entertainment when the power goes out?
RKITECH,06-04-2017,I chuckle on the inside when people say certain things regarding this business of entertainment. See it's easy to... http://fb.me/6nA4tEUJJ 
TopTrendWatch3,06-04-2017,#Entertainment #Buzz: #DrewBarrymore Instyle Magazine 9/00 HEATHER LOCKLEAR http://dlvr.it/NqBxf5 pic.twitter.com/fv0Uq1M6TV
JournalistWAB,06-04-2017,Who's ready for @c2e2? Learn how you can get your questions answered for select Entertainment Guests at #C2E2!http://wp.me/p6i9mE-Qo 
HeyNowHLF,06-04-2017,Guess what today is? It's the last day $HLF fraud isn't visible in our favorite form to consume info: entertainment. https://itun.es/us/jH-jib 
PWInsidercom,06-04-2017,QUACKENBUSH NAMED TRAINER FOR TORO ROAD ENTERTAINMENT'S INTERNATIONAL Elite: http://bit.ly/2oEXHqY , Free: http://bit.ly/2nOoFbp 
irranatashaa,06-04-2017,The only entertainment to myself #fast5pic.twitter.com/SxDkxcwj22
neucogroup,06-04-2017,"Mixed reality entertainment still ‘future gazing’ but tech advancing rapidly" http://buff.ly/2nenAgY 
davidgold,06-04-2017,Charity open day Sunday 9th April forecast sun 22degs parking free. Continuous entertainment. 11.00-4.30 dg more at http://davidgold.co.uk pic.twitter.com/DK2Vx4yOSU
ToadSuckDaze,06-04-2017,We will announce the 2017 #ToadSuckDaze entertainment in about 20 minutes! #ToadSuck
vloyacom,06-04-2017,Check out this Amazon deal: You Are a Badass: How to Stop Doubting Your G... by Jen Sincero http://amzn.to/2oNdeSu  #Books #Entertainment
Special_DealsUK,06-04-2017,TravelZoo Entertainment: £129 -- Cumbria Getaway w/Dinner & Wine, Save 55% http://dlvr.it/NqBxCw pic.twitter.com/Y53AGpRWR9
Special_DealsUK,06-04-2017,TravelZoo Entertainment: £3299pp -- Maldives: 5-Star All-Inclusive Beach Villa Escape http://dlvr.it/NqBxCn 
Special_DealsUK,06-04-2017,TravelZoo Entertainment: £669pp -- 5-Star Luxury Phuket Escape with Flights http://dlvr.it/NqBxCc 
iqof163,06-04-2017,@Fox Entertainment . Com
Special_DealsUK,06-04-2017,TravelZoo Entertainment: £599pp -- Thailand: Deluxe 8-Nt Khao Lak Escape inc Flights http://dlvr.it/NqBx9J 
Special_DealsUK,06-04-2017,TravelZoo Entertainment: £299pp -- Halkidiki 5-Star Holiday w/Flights, Suite & Meals http://dlvr.it/NqBx8J 
Special_DealsUK,06-04-2017,TravelZoo Entertainment: £456pp -- N Cyprus: 7-Nt Luxury Holiday w/Flights & Upgrades http://dlvr.it/NqBx68 
subhanat76,06-04-2017,Thats cool , that Mic interaction with Commentators, and MS Dhoni Reply, Awesome Entertainment, btw Mumbai Indians Jersy is Shiny Cool?it
vloyacom,06-04-2017,Check out this Amazon deal: Giraffes Can't Dance by Giles Andreae http://amzn.to/2oMZNSw  #Books #Entertainment #Humor
OlivaEsq,06-04-2017,Client Carole Pope on the front page of the entertainment section of @TorontoStar today! Read… https://www.instagram.com/p/BSjDCuKDrka/ 
NaijaNewsPapers,06-04-2017,[Entertainment] Film Review: Okafor’s Law http://ift.tt/2p5ocSt  | Visit http://jobwaka.com.ng  for Job Updates
BargainsAtoZ,06-04-2017,#Entertainment #Kendall Jenner 'Devastated' by Pepsi Ad Controversy http://dlvr.it/NqBwGQ  Via Celebrity Gossip
vloyacom,06-04-2017,Check out this Amazon deal: The Going-To-Bed Book by Sandra Boynton http://amzn.to/2o6Uxe7  #Books #Entertainment #Humor
TheArcticSloth,06-04-2017,I've seen your entertainment center. This Shy Guy is wrong.
FuegoTaughtMe,06-04-2017,Food, wine, entertainment, and networking. If you're interested in the hospitality, event & entertainment industries you should come. $25-40 pic.twitter.com/3A2vb2fEI3
smarkus,06-04-2017,'rebalancing whilst in bed' does offer the prospect of post-watershed entertainment :-)
thegoosehsv,06-04-2017,Happy Thursday! The weekend is almost here, entertainment district is open today and our doors… https://www.instagram.com/p/BSjC7DCFvvp/ 
EltonJohn1v,06-04-2017,#Entertainment #Buzz Goodbye Yellow Brick Road [LP] by #EltonJohn (Vinyl, Sep-2008, Mercury)http://dlvr.it/NqBvkt 
msqrd2,06-04-2017,TabletHookz allow you to create your own hands-free in-flight entertainment - perfect for the summer holidays ! https://www.kickstarter.com/projects/tablethookz/tablethookz?ref=5vz4g5 …
ImpressionsPast,06-04-2017,TabletHookz allow you to create your own hands-free in-flight entertainment - perfect for the summer holidays ! https://www.kickstarter.com/projects/tablethookz/tablethookz?ref=5vz4g5 …
NigerianCurrent,06-04-2017,Big Brother Naija: 2Face, Tiwa Savage, Runtown to perform at finale https://goo.gl/fb/upAf5K  #entertainment
Kristen_Fans1,06-04-2017,#Buzz #Entertainment ROBERT PATTINSON #KristenStewart TWILIGHT Film Fantasy 2010 TAYLOR LAUTNER… http://dlvr.it/NqBvHr  #Forsale #onsalepic.twitter.com/VK07I5Yr0w
J_Goldsborough,06-04-2017,Forgot my headphones for my train journey, I'm just gonna have to look at people and make stories up about them In my head for entertainment
ProSpecPS,06-04-2017,Congratulations to all our friends at Gateway Casinos and Entertainment on the opening of the newest property.... http://fb.me/8MEvbWkqw 
CinephileInU,06-04-2017,To know latest cinema news , reviews , ratings , trailers and more entertainment stuff download our android app... http://fb.me/7DbH2o5GL 
freebies4acause,06-04-2017,Purchase a 2017 Entertainment Book Digital Membership for $19.99 & Score a $10 Amazon Gift Card http://freebiesforacause.com/purchase-2017-entertainment-book-digital-membership-19-99-score-10-amazon-gift-card/ …
HollywoodSBlog,06-04-2017,'The Assignment' is a ludicrous mix of gender-bending sludge http://ift.tt/2o1dZHn  #entertainment #news
shevyblaze,06-04-2017,Imagine a movement called WLM or a channel called WET (White Entertainment Television) the uproar.
rubybelson,06-04-2017,The only horrific thing about this is the persistent abuse/exploitation of animals for entertainment, n the audacity to vilify the animals. https://twitter.com/mailonline/status/848802548530249728 …
adithya_iq,06-04-2017,@Goldberg i will be always your fan.thank you for the entertainment for these years. pic.twitter.com/WbiGVrTawa
JohnMooreMusic,06-04-2017,Please join me for an evening of light entertainment on the 27th of April. https://www.facebook.com/events/348878748841149/ …
yurrieee,06-04-2017,A bull is being tortured then killed for human entertainment don't feel bad for this man at all https://twitter.com/mailonline/status/848802548530249728 …
JamieWright27,06-04-2017,Magician, Casino, Poker, Dealer, Entertainment, Business Card: Magician, Casino, Poker, Dealer,… http://dlvr.it/NqBsgx  #poker
CITYWOMENMAG,06-04-2017,Retweeted IE entertainment ( @ieEntertainment): Growing as a human being is as important as growing in my career,... http://fb.me/tmf4HqSh 
allafrica,06-04-2017,Liberian Entertainment Entrepreneur Gives Birth to Triplets: http://allafrica.com/stories/201704060622.html?utm_campaign=allafrica%3Aeditor&utm_medium=social&utm_source=twitter&utm_content=promote%3Aaans%3Aabfzqa … #Liberiapic.twitter.com/HpYZcdg9Pm
tymindia,06-04-2017,I only wanted the janjaal of school to get over: Irrfan Khan #Bollywood #Entertainment pic.twitter.com/kTlOhUQMCR
tymindia,06-04-2017,Playboy has not lost its relevance: Cooper Hefner #Entertainment #Televisionpic.twitter.com/bMWzF68X4C
bibblex10,06-04-2017,HE THOUGHT I WAS A LESBIAN! (STORYTIME) #oops #youtube #share #subscribe #comedy #entertainment #lgbt #gamergirl <3https://youtu.be/f8KpEUvPxFk 
BloodyCanTastic,06-04-2017,It's to be treated like stand up comedy tbh. People tweet him with the expectation of getting insulted and he obliges. Cheap entertainment.
SyberXenon,06-04-2017,Sorry I'm on a plane, wont get much entertainment from me, but I'll try!
