User handle,Date of tweet,Tweet Data
BruceWillisFans,06-04-2017,#Entertainment #DVD - Action - Sin City - #BruceWillis - Jessica Alba - Frank Miller #eBay #Auctionhttp://dlvr.it/Nq8Ts9 
everiting,06-04-2017,Little Big Town, Nashville Royalty With an Outlaw Streak, Wants to Heal America http://zpr.io/P9Bdk  #music #entertainment
JeniseEmbleton,06-04-2017,#entertainment news The Girls of Girls Star in a Golden Girls Parody: HBO's Girls will end after six seasons on… http://dlvr.it/Nq8Tnl 
JohnnyDeppFans7,06-04-2017,#Entertainment Yoga Hosers (DVD 2016) #JohnnyDepp, Justin Long, Kevin Smith #Auction #BestBuy… http://dlvr.it/Nq8TgD pic.twitter.com/UYxcBCBd1F
WarariJK,06-04-2017,If I'm paying for it's education/health/food/entertainment I damn well have the right to roast it
Idythforgod,06-04-2017,This show is all about entertainment. Vote who entertained you the most. Vote Bisola. Sms vote Bisola to 32052 it is just N30. #BBNAIJA
zennie62,06-04-2017,BRIEF-Corus Entertainment Q2 earnings per share C$0.12 – Reuters http://ift.tt/2oHsxPt  #PopCulture
zennie62,06-04-2017,Canada’s Corus Entertainment posts 86 percent rise in revenue – Reuters http://ift.tt/2p4Uih7  #PopCulture
NinaDobrevFans8,06-04-2017,#NinaDobrev Vintage Havana Stripe Pocket Tank ASO Nina Dobrev in Gray Navy M NWT #Entertainment #Buzz http://dlvr.it/Nq8Tb6 
TopTravelStuff,06-04-2017,Saudi Arabia has bold plans to introduce more fun... Read more here: http://ow.ly/dYas30a9fAv  #travel #news #SaudiArabia #entertainment pic.twitter.com/90XYrULWvh
Mark_Carey,06-04-2017,#Autonomous Driving Could Change the Outlook for the In-Car Entertainment Experience http://ow.ly/VCIH30auwOS 
therealkidsexy,06-04-2017,ROX ENTERTAINMENT FEAT. KID SEXY ON YOUTUBE #metal #rock #MTVHits #WTFU #wtf PLEASE SUBSCRIBE https://www.youtube.com/user/therealkidsexy1 … pic.twitter.com/dvVUBIDluH
flashnewsportal,06-04-2017,Trending Worldwide What This Guy Made With An Entertainment Center Is Something All Cat Parents Need http://fractt.com/what-this-guy-made-with-an-entertainment-center-is-something-all-cat-parents-need/ …
myGOSSland,06-04-2017,Demi Lovato Destroys James Corden In A Divine Diva Song Cha... http://www.huffingtonpost.com/2017/04/06/demi-lovato-james-corden-divas-riff-off_n_15846854.html?utm_hp_ref=celebrity&ir=Celebrity … #tv #entertainment #gossippic.twitter.com/kWdsTlxFPX
LunchLadiesBC,06-04-2017,Project Entertainment Network Store - Find #books by the #podcast #hosts http://buff.ly/2oqsg08  via @ProjectEntNetpic.twitter.com/mgvndIsamO
casanostraCPT,06-04-2017,#OpenMic Thirsty Thursdays #CasaWoodstock Shooter Specials, Double Specials and Entertainment that could change... http://fb.me/1g4nrbmSR 
tony_trimmz,06-04-2017,@blackcard_hq - Blackcard Empire entertainment and Cielo lounge presents. No limit Friday… https://www.instagram.com/p/BSi1sDHFSPO/ 
jablan,06-04-2017,People without minds require mindless entertainment.
everiting,06-04-2017,Dwayne Johnson, Jimmy Fallon photobomb fans with mascot suits http://zpr.io/P9Bdt  #news #entertainment
BargainsAtoZ,06-04-2017,#Entertainment #'Devastated' Gemma Collins discusses fertility battle http://dlvr.it/Nq8SDd  - Via DailyMail
No1soundltd,06-04-2017,Visit http://www.no1vibes.com  for latest news on entertainment,and also the latest hits in the… https://www.instagram.com/p/BSi1ol9g0jX/ 
Stephaniiexo33,06-04-2017,lmfaooooo tinder has provided me with so much entertainment the last few years pic.twitter.com/36LCIQDiIw
CastCrunch,06-04-2017,#8 - B Mc-C (Founder of Nice Guy Entertainment) - Subversion #podernfamily #podcast #podmosphere #podecho #trypodhttp://castcrun.ch/jier 
MayorHodges,06-04-2017,And what a risk it can be in the entertainment industry, especially.
timbd,06-04-2017,Well that's the last time I watch the @AFLFootyShow this year. Way to make light entertainment weightless
boyband_alex,06-04-2017,Kung ganito talaga TANG INA!! TANG INA!! I won't spend 2.5k just for a photo, PINOY ENTERTAINMENT really don't know what's WORTH IT!!! https://twitter.com/joaonatics/status/849959481383374848 …
Local_Lora,06-04-2017,Create content your audience will love! Top things audiences engage with are: Entertainment,… https://www.instagram.com/p/BSi1dGOD2gR/ 
DjJWattsLive,06-04-2017,#NEWMixtapeOTW KAP Entertainment Presents Richie Rich Carolina Baby Coming May 2017 http://ow.ly/xGOL309V59N pic.twitter.com/78SrIVaC4Z
Blackcard_HQ,06-04-2017,Blackcard Empire entertainment and Cielo lounge presents. No limit Friday night. (comedy, night… https://www.instagram.com/p/BSi1XBYAXC-/ 
mwas_mpuzi,06-04-2017,@ADIUCHE @Mbusii @liondeh @RadioJamboKenya #MbusiiNaLionTekeTeke Hakunaaa mbrrrr entertainment
toyhypeusacom,06-04-2017,Entertainment Earth – #XMen #MarvelLegends Wave 2, #Batman, #StarWars & More http://www.toyhypeusa.com/2017/04/06/entertainment-earth-x-men-marvel-legends-wave-2-batman-star-wars-more/ … #ICollectatEE #toys #DCBombshellspic.twitter.com/byC9KiSSi9
vuyokay,06-04-2017,My 15min live entertainment break. Danki Toyota #ToyotaLivehttps://twitter.com/ToyotaSA/status/849962393530540033 …
HollywoodSBlog,06-04-2017,Let's go on a Photowalk in the Barataria Preserve http://ift.tt/2o0TWJp  #HollywoodSouth #entertainment
bngmint,06-04-2017,•She got into Dream Tea Entertainment because the principal of her vocal training school founded the company.
soodelighted,06-04-2017,IS THIS A LEGIT ONE GUYS? HUH? SM ENTERTAINMENT! IS THIS TRUE? pic.twitter.com/l1P0pYi0Px
SocialInSeattle,06-04-2017,Event? Festival Organization Cause Music Entertainment? http://socialnworldwide.com/event-special/  Social N has a SPECIAL Even Better than Our Calendar!!
PraiseCleveland,06-04-2017,ENTERTAINMENT: Brenda Jones Of The Jones Girls Dead At 62 http://bit.ly/2nNYf9P  #fb
hightownluton,06-04-2017,Mark the date on your calendars now!First entertainment announcement coming tonight! Hit attending to find out first https://www.facebook.com/events/1867976946763999/ …pic.twitter.com/E0MJGSsdQ4
BronzeMagazine,06-04-2017,Kendrick Lamar Drops Two New Singles! https://goo.gl/fb/RYmC8R  #entertainment #music #hiphop #kendricklamar
m_aaddison,06-04-2017,And this, kids, is why we don't abuse animals for our own entertainment https://twitter.com/mailonline/status/848802548530249728 …
notoriousBREEiG,06-04-2017,Y'all arguing with celebrities via twitter lol for our entertainment? Thanks
DTMRECORDS_,06-04-2017,Dedicated To Money Entertainment Media TV Presents - Tone And O.G Speaki... https://www.youtube.com/watch?v=BwMb11AkJhM&feature=share …
OoredooQatar,06-04-2017,To celebrate our amazing Endless Internet Packs, we've launched a family friendly entertainment booth in City Centre Mall! 1/2
BEAMByEyeClick,06-04-2017,Lead with entertainment! Should be the mantra of all #FamilyEntertainmentCenters #FEChttps://www.loyalty360.org/content-gallery/daily-news/amusement-plays-major-role-in-brand-loyalty-at-dav?utm_campaign=coschedule&utm_source=twitter&utm_medium=BEAMByEyeClick …
DTMRECORDS_,06-04-2017,dedicated2money entertainment @twerkfetish twerking dancing promotional ... https://www.youtube.com/watch?v=uDgigpbf0uM&feature=share …
cal__nc,06-04-2017,Carlys life entertainment strikes back up as her debit card was stolen and people used it at the same bars she went to. Can't explain to BOA
SoundMonitorinG,06-04-2017,Morgan Heritage trio to grace Monday #Reggae AT Club Asylum - SDE Entertainment News (satire) (press release)… http://dlvr.it/Nq8MJc  #G
simonmatafai,06-04-2017,WORLD LEADERS IN DELIVERING PACIFIC EVENTS, ENTERTAINMENT & COMMUNITY INITIATIVES. 20+… https://www.instagram.com/p/BSi1FZHlIpU/ 
Waltdisney_bot,06-04-2017,I never called my work an 'art' It's part of show business, the business of building entertainment.
gamerlaw,06-04-2017,The fun continues. Now with our friends at QMUL for the Not Just A Game interactive entertainment law conference - https://www.morethanjustagame.london/programme/ 
DTMRECORDS_,06-04-2017,dedicated2money entertainment @tr380thefuture on Instagram the young amb... https://www.youtube.com/watch?v=QtiNI5OiTZs&feature=share …
alicesttu,06-04-2017,Celebs & Entertainment # #KendallJenner #KendallJenner...https://goo.gl/fb/LwgsBt 
MTurnerFilms,06-04-2017,This is really disappointing. Produced Entertainment isn't quantified by just Like/Dislike. This system hurts YouTube and now @netflix.
theeJAISTER,06-04-2017,I'm pretty sure Apple had to hit up Parkwood Entertainment to get the receipts for that. Y'all wanna make EVERYTHING a "discussion". REST!
Kessler3Kessler,06-04-2017,The Carey Link only has 18 tickets left to sellout on the Eclectic Evening of Entertainment. 1/$30 or 2/$50 Free dinner! Friday April 21 6pm pic.twitter.com/Nj9ppsHNuW
TOPIQ_LIMAHBABY,06-04-2017,Check out WE'RE ALL DREAMERS ENTERTAINMENT newly released single "The Sake Of My Son" by TOP I.Q. aka Mr. #Lezzfuckingoooooo pic.twitter.com/5KoPrXeeCe
VirtuaMe,06-04-2017,Xbox are masters of comedy & entertainment. I wouldn't miss this for the world. Their console launches define car crash TV. Now in 4K.
sjp2camattapan,06-04-2017,It is always an awesome show! Great music, talented students and a gifted music teacher. Come to an evening of free family entertainment.
CharlesettaDown,06-04-2017,Subscribe to UKURBANSFINEST YOUTUBE CHANNEL BEST IN MUSIC & ENTERTAINMENT https://www.youtube.com/channel/UCTio9A3S43ZVdMw9KFgh0aQ?IvLr …
ImCoCoCHANEL,06-04-2017,This is the entertainment I needed this morning. If you don't listen to the breakfast club in the AM you should!
TrustArtsEd,06-04-2017,The Trust Education Department was excited to welcome Canon Mcmillan High School Sports and Entertainment... http://fb.me/8rW477lj9 
erabasovik,06-04-2017,Lmao watching ppl get defensive and cry over a tweet is such entertainment for me
confcalltran,06-04-2017,Majesco Entertainment Company director just picked up 20,000 shares http://www.conferencecalltranscripts.org/4/summary/?id=3669691 … $COOL
NotQuirky,06-04-2017,This is during entertainment in the auto!
PattieCurran,06-04-2017,If you live in Winston-Salem, or come to Winston to shop, go to Doctors or entertainment events, please sign... http://fb.me/2JkFwT5qh 
katiee_oween,06-04-2017,Lily and joe give me so much entertainment
vinitamathur,06-04-2017,During @IPL What @LalitKModi aimed at was ONLY entertainment of audience!Wow summer! He dint let us blink n gave another bombshell of fun!
Steelasophical,06-04-2017,'We bring the Caribbean to you' Steelasophical Musical entertainment At Steelasophical Steel Band Hire UK ‘We bring the Caribbean to you' … pic.twitter.com/yOhvTTlPU9
MoviesRopel,06-04-2017,#entertainment Demi Lovato and James Corden Battle for R-E-S-P-E-C-T With a Divas Sing-Off http://dlvr.it/Nq8HdL  #hollywoodpic.twitter.com/wjkrBxDDKa
jungjinhyeong97,06-04-2017,170305 "Recording. Big rookie feeling #recording #sunday #music #sfr #entertainment #recordingstudio #singer #producing" is it #Jinhyeong ?pic.twitter.com/bEAkhkSzio
yumenonaka_band,06-04-2017,?1?????????????????????????????? 4/28(?)???hotshot? ????????…??????? ????????????? ????????????ARROW ENTERTAINMENT????????????????????
ArielDumas,06-04-2017,There are so many celebs named Emma that there should be an entertainment mag called "OOPS! ALL EMMAS"
mohitjo,06-04-2017,This @Olacabs cab is quite sleek with an entertainment screen. #Kudospic.twitter.com/R4zwkSnxcK
bwagonpromotion,06-04-2017,Come out TONIGHT @stonefishgrillmd Sound Theory Thursdays!!! Live Entertainment & Open Mic Fusion!! DOORS Open at 10pm @trill4liferadio – at Stonefish Grill
SeiyefaEgein,06-04-2017,You have an issue with others choosing THEIR OWN entertainment; while Your TL is a pot of European league football. Disgruntled hypocrite. https://twitter.com/techiekoko/status/849918209163755520 …
Brent_Cote,06-04-2017,For the Cote Entertainment news and updates on all things I'm working on, please check out https://www.facebook.com/coteentertainment/ …!pic.twitter.com/ILDNga3otI
Synergy1Radio,06-04-2017,#Ad: Visit http://Asha.com  & sign up for Your International Entertainment Industry connection http://www.asha.com  @bigeoppa pic.twitter.com/Y0joNfJWUp
thePearlGuideUg,06-04-2017,Minister of Entertainment @kellamckenzie did a fantastic job last night! @MonsterEnergy #UnleashTheBeast Official Energy of #Intimania17pic.twitter.com/qOVnfjjgLb
DTMRECORDS_,06-04-2017,Dedicated To Money Entertainment Media TV Presents - SHOUTS GOES OUT TO ... https://www.youtube.com/watch?v=Z_B2kQNBPhQ&feature=share …
DTMRECORDS_,06-04-2017,Dedicated To Money Entertainment Media TV Presents SUPPORTING THE MOVE... https://www.youtube.com/watch?v=TPc09ns6YDw&feature=share …
tjhinny,06-04-2017,I follow the Intercept for pure entertainment value
steaksause16,06-04-2017,not one single thing about pepsi. maybe you should stop getting your news from Entertainment Tonight, that might fix your problem. pic.twitter.com/Jk3qJ8dweq
hon_tubo,06-04-2017,Whats beter than sleeping all day in a dark room,with enough junkfood nd entertainment,wit no responsibilities or comitments other dan salat
slamminevents,06-04-2017,How Music Festivals Are Changing [Interview w/Evan Harrison of Huka Entertainment] https://drumup.io/s/WXHme7  #iheartradio #live @nufunk
DTMRECORDS_,06-04-2017,Dedicated To Money Entertainment Media TV Presents - Mr.Cooper and Ruka ... https://www.youtube.com/watch?v=BYu3t3HFFnA&feature=share …
virginiakimba,06-04-2017,SleepWake - Video Alarm Clock Lifestyle Entertainment | iPhone... https://goo.gl/fb/TJfk5P  #iphone #lifestyle
CoffeewithMike,06-04-2017,Entertainment News Update: Morgan Freeman turns to comedy with revised 'Going in Style' http://ow.ly/KipJ50aG3tV 
chuckbolster,06-04-2017,Enter the Sprint Amazing Sweeps & you could win a Samsung home entertainment package valued at $6,300! NPN See rules http://bit.ly/2mWg6eg 
likethatsungjin,06-04-2017,[INSTAGRAM] 170406 DAY6 on JYP Entertainment update. https://www.instagram.com/p/BSiysMblbzt/ pic.twitter.com/S207JJR3KD
MoviesRopel,06-04-2017,#entertainment Madonna Reignites Her Feud With Pepsi By Shading Their Kendall Jenner Ad Controversy! http://dlvr.it/Nq8DxH  #hollywoodpic.twitter.com/2rzv9RG4mF
twent_3,06-04-2017,#TwenT3 Latest News Green Screen Party Entertainment – Get 3D Green Screen http://ow.ly/igBp50aG33D 
bazaanaa,06-04-2017,Entertainment around the world http://fb.me/23eMj8SjT 
ToluLagos,06-04-2017,AZ Entertainment artist is Dope !! Checkout @iamikonx4uout now!!! hottest right now http://youtu.be/mvqDWiYs9Hw pic.twitter.com/unZNB2ouzt
042MP3_COM,06-04-2017,AZ Entertainment artist is Dope !! Checkout @iamikonx4uout now!!! hottest right now http://youtu.be/mvqDWiYs9Hw pic.twitter.com/VUrN0VqLWB
russellaevans,06-04-2017,15 Mind-Blowing Stats About Media And Entertainment Marketing http://buff.ly/2ntQkP3 
Wearethefuture,06-04-2017,To live, only to be subjected to torture for entertainment. No matter what happened this was always going to be a bad day for this animal. https://twitter.com/mailonline/status/848802548530249728 …
NinaDobrevFans8,06-04-2017,#Entertainment #Buzz Stylestalker Goldfinger Sequin Tee ASO Nina Dobrev 4 NWT #NinaDobrev pic.twitter.com/oCGBWCODX5 http://dlvr.it/Nq8Cvr 
hiindia,06-04-2017,http://hiindia.com  | Music is important for environment too: Ayaan,… http://dlvr.it/Nq8CK0  #ENTERTAINMENT http://hiindia.com pic.twitter.com/AmzdfijFlg
PaulMcCartney1v,06-04-2017,#Hot #Memorabilia #PaulMcCartney Off The Ground 1993 Cassette tape Collectibles OOP #Beatles http://dlvr.it/Nq8CPS  #Entertainment #Sale
TheBeatles1v,06-04-2017,#Entertainment #Buzz: #Beatles"Rubber Soul"Lp Japan Import-Obi-Audiophile Japanese Vinyl White/Abbey http://dlvr.it/Nq8CL7 pic.twitter.com/t6idmcd47R
brandonpromo,06-04-2017,House Intel Committee Republicans Boycotted A Briefing By A Double Agent Who… http://dlvr.it/Nq8CDv  #realstories #news #entertainment pic.twitter.com/xpyexMaa8H
ICONvoice,06-04-2017,21 Pairs of Pointy Flats to Wear All Spring Long http://stylecaster.com/pointy-flats-trend-2017/ … #music #entertainment #buzz
JorgensonDusty,06-04-2017,Mega Man 2 - (Nintendo Entertainment System, NES) http://dlvr.it/Nq8BwR pic.twitter.com/PWCboMQFUl
djexcelftl,06-04-2017,Excelarated Creative Group Is South Floridas Premier Event Entertainment Experts! Energetic DJs & MC's, State of... http://fb.me/569fxkbod 
btagency,06-04-2017,#BerryTalented sharing the latest #news in #entertainment from #JustJared Sarah Michelle Gellar Dishes On Hangi...http://ow.ly/qoOB50aG2xr 
stubruNoa,06-04-2017,Father John Misty - Total Entertainment Forever https://open.spotify.com/track/2EDu3Xi4LORS0HRJ7kt0hF … #stubru
SleekMoneycom,06-04-2017,World Wrestling Entertainment $WWE Given Daily News Sentiment Rating of 0.31http://ift.tt/2nHk1v7 
newstalk1490,06-04-2017,ENTERTAINMENT: Brenda Jones Of The Jones Girls Dead At 62 http://bit.ly/2nO5XRg  #fb
ShoreNewsNJ,06-04-2017,Barry Manilow opens up about his decision to keep his decades-long relationship a secret http://www.shorenewsnetwork.com/2017/04/barry-manilow-opens-up-about-his-decision-to-keep-his-decades-long-relationship-a-secret-from-fans/ … #njnews #Entertainment
toughbreak78,06-04-2017,Waaaaaa guess what watch his ratings go up. no such thing as bad publicity in entertainment. All the complainers don't watch him anyway
CricFilmy,06-04-2017,Arunabh Kumar and now him, looks like things are the worst in entertainment indusry is the worst of all for women to work in.
NationalParrot,06-04-2017,#MUSIC: Dremo – Next Single https://goo.gl/fb/rtFaEF  #NationalParrot_Com #entertainment
niteshpal96,06-04-2017,Ready to be entertainment ! LISTEN THIS song by @DJBravo47 and @ShivranjaniS #TripWithBravo http://bit.ly/TripAbhiBaakiHai …
TheTurkishLife,06-04-2017,Great piece on Kurdish singers keeping denbej music -- part "news bulletin, history lesson & entertainment" -- alive http://n.pr/2nRRXZB 
Angel_Riimz,06-04-2017,if you looking for some entertainment, chilled drinks plus live music today @PuchiesBlock is where you should be!!!pic.twitter.com/bR3Z3Iqsxz
iPadTribe,06-04-2017,GUN MOD FOR MINECRAFT PC GUIDE EDITION - Black Software LLC: GUN MOD… https://goo.gl/fb/rL0sRf  #iPad #Entertainment
ArnitaSpacek,06-04-2017,Subscribe to UKURBANSFINEST YOUTUBE CHANNEL BEST IN MUSIC & ENTERTAINMENT https://www.youtube.com/channel/UCTio9A3S43ZVdMw9KFgh0aQ?GCN …
bishopafcClub,06-04-2017,Open from 1.30 Saturday in function room vs @dunstonutsfc Club merchandise Awards evening tickets £10 inc food/entertainment/disco #supportpic.twitter.com/JtaU2OySpF
AN_Minhyun93,06-04-2017,class plot ( modelling class ) AN Entertainment building current time slice of life 3rd POV ??????????????? Waktu audah -
eepyeeps,06-04-2017,nothing worse than seeing parents that just shove a tablet/iphone in their kids face for entertainment
SykesFanClub,06-04-2017,Corus Entertainment, Inc.B 2017 Q2 - Results - Earnings Call Slides http://dlvr.it/Nq89zw pic.twitter.com/u9MXumbDoC
VermilionSchool,06-04-2017,Join us for some great Friday night entertainment! http://fb.me/3vzSn5R9q 
Penray97,06-04-2017,Great hospitality & entertainment now for some horse racing #GrandNational
OhD_Productions,06-04-2017,#OhDProductions is striving to produce the highest quality entertainment needs for your project. DM inquiries! #OhD #DMV #DC #Maryland #VA
downtownboca,06-04-2017,Meet the Bunny, a scavenger hunt, live entertainment, face painting, balloon artists and art & crafts! Sunday, April 9 at @MiznerParkAmphipic.twitter.com/mLBrObTsh8
nazrulklgassam,06-04-2017,#Entertainment Famous Spanish People – Penelope Cruz http://dlvr.it/Nq892h  #Lfnin
MercerCoNJ,06-04-2017,U.S. women's #soccer reaches new labor contract http://dlvr.it/Nq88gd  #Entertainment
PasticheEurope,06-04-2017,Looking for entertainment for easter weekend? We are fully booked for Easter Sunday but are taking last minute bookings for the rest of the…
TheReddPepper,06-04-2017,End a beautiful day with the fab #thenightlyshow 10pm @ITV with @BradleyWalsh @TheReddPepper Top guests. Top entertainment @thebakingagent
AjMusicGroup1,06-04-2017,Have you heard ‘Plays - Paperboa Dash’ by Aj Entertainment on #SoundCloud? #nphttps://soundcloud.com/user-286466215/plays-paperboa-dash?utm_source=soundcloud&utm_campaign=share&utm_medium=twitter …
Gr8PipeGuapo,06-04-2017,If you ask me this can be a form of entertainment https://twitter.com/Rallo_331/status/849960593834508289 …
JeanineMoll37,06-04-2017,This is the best holiday ever! Lots of entertainment. .nice swimming. .abd LOTS OF SHOPPING MALLS @shellybeach #placestogo @stmichaelsonsea
agent_dby,06-04-2017,Entertainment can be found in office too.
SourcewithKenta,06-04-2017,Found over $23.51 in potential profit from Amazon/Books/Humor & Entertainment to sell on Amazon! http://www.kentaarbitrage.com/sourcing  #OA
HYDRO_PHONICS,06-04-2017,Aside from getting married today we also got our building and will soon be opening a 3 story entertainment... http://fb.me/RInWPQj4 
SukhESidhu2,06-04-2017,#SplendidHKNKJ creating an aura of Patriotism across the globe......everyone trapped in endless healthy entertainment of HKNKJ
setiarsa2,06-04-2017,(with Widhi at Park23 Entertainment Center) [pic] — https://path.com/p/2bzSnj 
SukhESidhu2,06-04-2017,#SplendidHKNKJ creating DHOOM!! worldwide by conveying EXTRAORDINARY!! PATRIOTIC!! Messages and it's Endless entertainment
deaaoktavia,06-04-2017,Moodlifted malam ini sebelum revisian adalah nctlife 'entertainment retreat eps3' which is fun and always exhausting watching them eating
Skipanne,06-04-2017,I guess I'll never understand how humans can lock up wild animals for our entertainment
ThomasinaBoaz,06-04-2017,Subscribe to UKURBANSFINEST YOUTUBE CHANNEL BEST IN MUSIC & ENTERTAINMENT https://www.youtube.com/channel/UCTio9A3S43ZVdMw9KFgh0aQ?7No …
RobonzoDrummer,06-04-2017,And the entertainment landscape continues its rapid change. https://twitter.com/daveyalba/status/849668013670400002 …
ShoreNewsNJ,06-04-2017,Retired Yankees slugger Alex Rodriugez, Jennifer Lopez talk marriage? http://www.shorenewsnetwork.com/2017/04/retired-yankees-slugger-alex-rodriugez-jennifer-lopez-talk-marriage/ … #njnews #Entertainment
FairTax4America,06-04-2017,Corus Entertainment, Inc.B 2017 Q2 - Results - Earnings Call Slides http://ift.tt/2nfUhKX  #Markets #Finance #TCOT
NationalParrot,06-04-2017,#BBNaija: They are now comparing Efe and Tboss’ families? https://goo.gl/fb/41NvKP  #NationalParrot_Com #entertainment
Quixotitron_1,06-04-2017,Biscayan was in this idea I was an entertainment and wondrous deeds of the subject.
Leila_Mejia,06-04-2017,No se pierdan el cortometraje MENSAJE OCULTO de lafilms_entertainment exclusivo para LENZ TV en… https://www.instagram.com/p/BSizoj2jZgm/ 
mvmurphy,06-04-2017,Corporate Event Checklist infographic – Entertainment https://thetzars.com/corporate-event-checklist/ … via @admin
THEBEAT999FM,06-04-2017,ENTERTAINMENT: @selenagomez Gomez To Host WE Day With @ddlovato And @aliciakeys http://www.thebeat99.com/selena-gomez-host-we-day-demi-lovato-and-alicia-keys-06-04-2017 …pic.twitter.com/gf6LK812aZ
Special_DealsUK,06-04-2017,TravelZoo Entertainment: £509pp -- Italy: 4-Star All-Inc Week w/Sea View, £330 Off http://dlvr.it/Nq868M 
KatyPerry_Watch,06-04-2017,#Entertainment #Buzz Meow! by Katy Perry Eau De #Parfum Spray New in Sealed Packaging #KatyPerry #Auction… http://dlvr.it/Nq85tY pic.twitter.com/G60MOJWL4O
BruceWillisFans,06-04-2017,#Entertainment Moonlighting - Seasons 1 & 2 ( #DVD, 1995, 6-Disc Set) Rare OOP #BruceWillis http://dlvr.it/Nq85MR  #eBay #Auctionpic.twitter.com/139L1VI10l
jtitsworth,06-04-2017,Corus Entertainment, Inc.B 2017 Q2 - Results - Earnings Call Slides http://ift.tt/2nfUhKX 
thePalashPatel,06-04-2017,The Awful and Awesome Entertainment Wrap – Episode 38 | Newslaundry https://goo.gl/Oad8yA pic.twitter.com/qlHsz7XOqU
SC_Corsets,06-04-2017,More Project Entertainment Network swag added to Patreon! http://buff.ly/2opx2Om  @projectentnet #podcasts #PodernFamilypic.twitter.com/h91DsG30WH
OpineSOCIAL,06-04-2017,@OpineSOCIAL » FLASH Entertainment Concludes Event Management and Production of Successful Mother of the Nation Festival 2017 http://zpr
RatingsNetwork,06-04-2017,Lions Gate Entertainment Corp.'s buy rating reiterated at Rosenblatt Securities. http://ift.tt/2oHsXFi  $LGF #LGF
sportparadise,06-04-2017,#Movies #BluRay GREAT SMOKY MOUNTAINS CROWN JEWEL OF THE APPALACHIANS New Blu-ray http://ebay.to/2nNQroJ  #Dvds #Entertainment pic.twitter.com/dd5Y2ALhj0
vervesys,06-04-2017,Virtual Reality – take a look at how it will impact the live entertainment industry! https://goo.gl/fMKp0A 
TerryHigginz,06-04-2017,Call to change #planning laws to protect live music venues http://www.walesonline.co.uk/whats-on/music-nightlife-news/politicians-call-welsh-government-change-12845119#ICID=sharebar_twitter … #licensing #music #entertainment #pubuk
TheJeffersonInn,06-04-2017,Tonight's Entertainment at the #JeffersonInn 8PM: Frankie & Jeff #LiveMusic #SouthernPines http://fb.me/1ohowTmTy 
SukhESidhu2,06-04-2017,Influence of #SplendidHKNKJ can be felt even after ending its climax .It's fabulous entertainment made you to watch it repeatedly .
TheJeffersonInn,06-04-2017,Tonight's Entertainment at the #JeffersonInn 8PM: Frankie & Jeff #LiveMusic #SouthernPines pic.twitter.com/PeF2JK4tdc
gadgetsmusthave,06-04-2017,LeEco Super4 X-Series UHD TVs Get Software Update With Bug Fixes, Enhanced… http://dlvr.it/Nq83Hn  #Home_Entertainment #GMH #gadgets #techpic.twitter.com/M0UEb15xHT
jonjohnrobinson,06-04-2017,You attract your environment. Change what you digest (Food, People, Entertainment, etc)
salakosmart,06-04-2017,Before na 'Tboss no dey entertain'. Now 'she know sabi National Anthem'. Is national anthem entertainment also? #BBNajia
akmalmitmit,06-04-2017,god bless people who dont put password on their lappy.. sis takde entertainment
