User handle,Date of tweet,Tweet Data
Tembusu2,17-04-2017,It's not entertainment but the truth ppl seek
EW,17-04-2017,Necessary. #TheOfficepic.twitter.com/VFsh6tdhWt
EW,17-04-2017,Lady Gaga's 90-minute #Coachella set seriously rocked—our recap: http://share.ew.com/of76zOU pic.twitter.com/6cf1art29Y
sevenwordspoem,17-04-2017,“I do not exist for your entertainment.”
bapimagens,17-04-2017,The Evolution of B.A.P (????) - Tribute to K-POP LEGENDS (K-Ville Entertainment) https://youtu.be/dE70ePxJFXY pic.twitter.com/ZGZ2wa8gAH
iBehindMe,17-04-2017,Thank you RCB for the entertainment pic.twitter.com/6fxZC7Yd0H
NTRfanTillDeath,17-04-2017,RCB Is Most Consistent MINNOW Team Since 2008 They Will Choke And Give Us Entertainment #RCBvRPS
shrivasshalini,16-04-2017,Of course if we watch dis show without blockin our minds.. we can find humor & entertainment.. other actors r doing a real gr8 effort!! #TKSS
NTRfanTillDeath,16-04-2017,R C B Against #MI Last Five Overs, No Boundary Today Boundary After 39 Balls Still They Will Saw Entertainment Raaw #RCBvRPS
CeeRichiee_,16-04-2017,Twitter my ONLY entertainment
EW,16-04-2017,Lady Gaga debuts a new single, 'The Cure,' at #Coachella—our recap: http://share.ew.com/1cXZDDB pic.twitter.com/2f0eUnUptq
EW,16-04-2017,#PrisonBreak star Wentworth Miller discusses the future of the Fox revival: http://share.ew.com/RW99p9g pic.twitter.com/wwNfG8AQ5j
BrokenCricket,16-04-2017,Crowd cheered for Dhoni six.. Crowd cheered for Kohli six.. Crowd cheered for ABD six.. IPL serves the dish called "Entertainment"
Koreaboo,16-04-2017,Pledis Entertainment staff stops “fan” from showing traumatizing sketchbook to Kyulkyung ? Read more: http://aegyo.me/5KC6 pic.twitter.com/K46tCcJJcb
EW,16-04-2017,Harry Styles practically stole the show with those performances on #SNL—our recap: http://share.ew.com/VATZb58 pic.twitter.com/QHetepILSp
G3org1102,16-04-2017,Alonso team radio is pure entertainment #BahrainGP
e_entertainment,16-04-2017,Cheers to the @BellaTwins and @TotalDivas! pic.twitter.com/zx3HPn3enO
Marvel,16-04-2017,ICYMI: Artist @RenieDraws pencils and colors a special Spidey-themed commission in a new #MarvelQuickdraw! pic.twitter.com/Ftmu6kkKJj
soompi,16-04-2017,WATCH: Cube Entertainment's New #TripleH Unit Drops Fun And Laid Back Concept Teaser Video https://www.soompi.com/2017/04/11/cube-entertainments-new-triple-h-unit-drops-first-concept-photo/ …pic.twitter.com/k6dnTSNM5J
KakituMusik,16-04-2017,Get the awesome entertainment by @timelessnoel1 #GospofestConcert
UJICREAM,16-04-2017,lose a life if youre from brand new music entertainment. lee daehwi, you are.
cubeunited,16-04-2017,Triple H - Concept Preview 2017.05.01 12:00(KST) #TRIPLE_H #HYUNA #HUI #EDAWN https://www.youtube.com/watch?v=FhXg8M0ldCs …
e_entertainment,16-04-2017,Nothing can break Kim and Kanye's relationship--new @KUWTK episode tonight 9/8c!pic.twitter.com/AN4NkW42Dk
IBigHitEnt,16-04-2017,#BTS have a total of 4 BILLIONS views on youtube making them the most viewed kpop group in youtube historypic.twitter.com/aCRLTQrQIi
EW,16-04-2017,. @WalkingDead_AMC star Andrew Lincoln on season 8: "I can't wait" http://share.ew.com/P3X5NB2  #TWD #TheWalkingDeadpic.twitter.com/u1l3cyjOaE
ieEntertainment,16-04-2017,. @ikamalhaasan ’s classic hits to be re-release on the big screen http://indianexpress.com/article/entertainment/tamil/kamal-haasan-classic-hits-to-be-re-release-on-the-big-screen-4615632/ …pic.twitter.com/buVbWC3OvM
IBigHitEnt,16-04-2017,Forever my hope, J-Hopepic.twitter.com/fu2fFlcoDL
EW,16-04-2017,Everything you need to know about Johnny Depp's #FantasticBeasts character: http://share.ew.com/AxoPDjZ pic.twitter.com/yONxg2LLjY
TurkishAirlines,16-04-2017,With Planet, our in-flight entertainment platform full of fresh content, you wish your long-haul flights would never end. pic.twitter.com/n21XeSBikD
stillbbh,16-04-2017,EXO: is a South Korean group formed by SM Entertainment. They ruined my life, but I love them.
eOneHomeVideo,16-04-2017,Canada ! Are you ready for a #BunnyTakover? Follow & RT to be entered for a chance to win Max & Ruby Bunny Season, now on DVD at Amazon.ca!pic.twitter.com/bZDvH7BmJA
candleyoongie,16-04-2017,Eng subs for Entertainment Relay will be out in ~1 hour (encoding)! It has been a tough struggle for 6 hours.. lol.. technology why so mean
QueenIvyHewlett,16-04-2017,Spending Easter Day with the Barkers! Good food, good wine , good company and assured entertainment!
MphoMaboi,16-04-2017,Don't believe the hype of social media. The same is true of people in the entertainment industry as a whole. All that glitters isn't gold!
_EnvyAfrika,16-04-2017,DOORS OPEN 4PM! : INSIDE ON THE GREENS : HOUSE OF AFRIKA MUSIC - ENTERTAINMENT - FASHION OUR HOUSE OF JOY pic.twitter.com/emU0f0fpHR
jsandbb,16-04-2017,#BamBam talk about the competition in entertainment industry "when i was a trainee I think it high competition(1) pic.twitter.com/rio5Y0BDsm
fyluhan,16-04-2017,[ENG][720P] 170414 Fighter of the Destiny ????? - Youku Entertainment Interview with #LuHan: https://youtu.be/w5eC2qCzry4 pic.twitter.com/jVWdz2JHRE
tegoxshi,16-04-2017,Johnnys Entertainment, please make an international fanclub so we can join and support the boys too ;;
Koreaboo,16-04-2017,The Reason Why SM Entertainment Chose Yoona As The Center Of Girl’s Generations ? Read more: http://aegyo.me/5KC3  pic.twitter.com/BNvfnLw1qU
RzZeid,16-04-2017,kbs's entertainment weekly played a Clip of #leejongsuk during yesterday's ep (1) Via DCpic.twitter.com/Jl1ibtHHPT
IBigHitEnt,16-04-2017,"I really think that the coolest person is Suga hyung" - V #????? #? #??pic.twitter.com/HnbkKr9E2d
ieEntertainment,16-04-2017,Actor @iamsrk to do Rush Hour sequel with @BrettRatner? Hollywood director is already making plans http://indianexpress.com/article/entertainment/bollywood/shah-rukh-khan-to-do-rush-hour-sequel-with-brett-ratner-hollywood-director-is-already-making-plans-4615119/ …pic.twitter.com/jIIpHQxTrP
Koreaboo,16-04-2017,[ ?HEADLINE] “Weightlifting Fairy Kim Bok Joo” actress Jo Hye Jung has signed with Jellyfish Entertainment pic.twitter.com/8eM90LHehW
ieEntertainment,16-04-2017,. @BeingSalmanKhan rehearses for much-awaited Da-Bangg tour, see pics and videos #DaBangHK http://indianexpress.com/article/entertainment/bollywood/salman-khan-rehearses-for-much-awaited-da-bangg-tour-see-pics-and-videos-4615068/ …pic.twitter.com/g3bTqKjq1d
1DGPSOfficial,16-04-2017,This hopeful 16 year old from Holmes Chapel just made entertainment history with a performance that will be watched for years to come #PROUDpic.twitter.com/KeSQITvdk5
eunkipics,16-04-2017,hong eunki from gon entertainment pic.twitter.com/mBLp217uHS
miaajtf,16-04-2017,Nobody in the entire entertainment business could pull that whole thing off other than Jimmy Fallon. #FallonStylesSNL
anja_rosales,16-04-2017,It was a successful night for Spurs Sports & Entertainment... @spurs win game 1 and @SanAntonioFC had a 4-0 victory! #ourcity pic.twitter.com/09BNw3cMGJ
ieEntertainment,16-04-2017,. @iamsrk leaves San Francisco in awe, promises free hugs to fans. Watch adorable videos, pics http://indianexpress.com/article/entertainment/bollywood/shah-rukh-khan-brett-ratner-san-francisco-free-hugs-lungi-dance-jackie-chan-acid-attack-victims-4614294/ …pic.twitter.com/XryDuzKUMt
EW,16-04-2017,Vin Diesel’s wildest action scenes, ranked: http://share.ew.com/Y1SppF1  #FateOfTheFuriouspic.twitter.com/ImwicEkFn2
HayesTSN,16-04-2017,7+ periods of non-stop entertainment. Same as it ever was with the Leafs this season.
2D_ENTPVTLTD,16-04-2017,#Kadugu completes 25 days! Thank you all for this support and love! Director @vijaymilton nailed it with a beautiful story! #Kadugu25Dayspic.twitter.com/XiwGKMMXCC
mashentertain,16-04-2017,Tonight's #DoctorWho premiere is perfect for beginners: http://on.mash.to/2p5CHtA pic.twitter.com/97zhWWZ7gY
EW,16-04-2017,The Twelfth Doctor welcomes his latest companion—our #DoctorWho premiere recap: http://share.ew.com/zSxvfIW pic.twitter.com/kXph6yi3uk
bluebaby28,16-04-2017,#GOT7 FLIGHT LOG: ARRIVAL has exceeded 310,000 copies on April 14th, according to JYP Entertainment. http://m.entertain.naver.com/read?oid=108&aid=0002607160 …
giselleknowIes,16-04-2017,Is the fourth studio album by American singer Beyoncé, released on June 24, 2011, by Parkwood Entertainment and Columbia Records... https://twitter.com/nickiminaj/status/853425509471887360 …
BuntingLevi,16-04-2017,FULL VID ON PINNED & BIO! Go watch for some good entertainment, it's worth it pic.twitter.com/eF7ZvZAsuj
MaiaMitchell,16-04-2017,Sitting next 2 a wedding ceremony enjoying their entertainment aka violinist covering pop songs from 2011.
bpbroome,16-04-2017,"A bus and three automobiles burned while Big Ben stood stoic watch." http://www.amazon.com/World-Gone-Gray-B-P-Broome-ebook/dp/B00GSIBV5G … Reasonably-priced apocalyptic entertainment. pic.twitter.com/ha89yugfGu
EW,16-04-2017,Mark Hamill gives an emotional tribute to Carrie Fisher at the #StarWars Celebration: http://share.ew.com/0o2MtGn pic.twitter.com/Uucc9rTEDh
Showbiz_Polls,16-04-2017,Because you are brighter than sunshine. You are Sinag.
DepCom_AD_ACF,16-04-2017,Nothing like the black bear to end a fantastic nights entertainment. Each and every cadet should be extremely proud of that performance pic.twitter.com/2iFjOeDcLP
LimaCharlieNews,16-04-2017,New Episode! Lima Charlie Entertainment - Ep.03 https://soundcloud.com/limacharlienews/lima-charlie-entertainment-ep03 … on #SoundCloud
kdmorrow19,16-04-2017,So thankful for clean entertainment like @WCTH_TV by @hallmarkchannel ! It's so nice seeing good values and no violence! #Hearties
GagaChapel,16-04-2017,Beyoncé's biggest accomplishment this decade is quitting Coachella so Lady Gaga could take her place and serve real entertainment.
AliaNAlly,16-04-2017,AstrA - Turn Me On Fuego ft. Kevin Lyttle & Costi | Cortes Entertainment https://youtu.be/ZK1MZQoZ8Qs  via @YouTube
DGilliesSource,16-04-2017,Daniel talking about 'The Red Door' [Facebook live Q&A with Entertainment Tonight 14/04/2017] | @danieljgilliespic.twitter.com/CmcuOKBXGW
wwwPGAtoday,16-04-2017,[Blockchain] Quaestor and branded entertainment https://angel.co/quaestor  #BlockChain #BitCoin #Crypto #FinTech #Money #Future #Innovation #HRpic.twitter.com/wDV6mvwK3Y
OmgSasaKe,16-04-2017,Follow us for entertainment #gainwithxtiandela #MzansiFolloTrain #MzanziFolloTrain @Crazy254n @harrie_shosh @finnyLaura @Manu_maosa
EW,16-04-2017,#BeautyAndTheBeast has crossed the $1 billion mark, making it the top live-action musical of all time: http://share.ew.com/SigDXlX pic.twitter.com/vJak8wjLi4
IBigHitEnt,16-04-2017,Shall we play a game? Tap on the gif to see who your BULLIES are #BTSpic.twitter.com/jpMylumoFp
ChristyDollcute,15-04-2017,#PaPaandi Best directional debut respectable debut @dhanushkraja Pakka entertainment &centiment bw father &son @Prasanna_actor done well.
RajInsa56549142,15-04-2017,fans are enjoying patriotic dose of entertainment to the fullest! #BuzzOfHKNKJ
BTS_ITALIA,15-04-2017,[VIDEO] I #BTS sono apparsi su MBC Entertainment Today per la loro nomina ai 2017 Billboard Music Awards Via: bangtanitl pic.twitter.com/W3ryqE1wbW
crownprincesone,15-04-2017,[TRANS/NETIZENS] YoonA at KBS Entertainment Weekly http://voltz03.tumblr.com/post/159605879130/transnetizens-yoona-at-kbs-entertainment-weekly …pic.twitter.com/VI2IXJBzRK
BTOBSTORYY,15-04-2017,[PIC] 170415 Kiss Entertainment's ig update with #BTOB : https://www.instagram.com/p/BS6RyL-gz64/ pic.twitter.com/8Y0cTPdqK4
IBigHitEnt,15-04-2017,"J-Hope hyung only LOOKS cheerful" #Jhopemyhopepic.twitter.com/Rx9HjQjTOO
ieEntertainment,15-04-2017,#IPL2017: @yamigautam ’s charm added to her killer moves at Delhi opening ceremony. See pics http://indianexpress.com/article/entertainment/bollywood/ipl-2017-yami-gautams-charm-added-to-her-killer-moves-at-delhi-opening-ceremony-guru-randhawa-see-pics-video-4614524/ …pic.twitter.com/NgOR3BFOat
VisitGraceland,15-04-2017,Experience #Graceland and our new entertainment/exhibit complex, and stay at @GHGraceland, with this package: http://bit.ly/2oyJfj4 pic.twitter.com/OXtaKEOysN
EW,15-04-2017,Here are all the times #GameOfThrones stars @Maisie_Williams and @SophieT gave us friendship goals, in honor of Maisie's 20th birthday! pic.twitter.com/2ACuWptI7W
Showbiz_Polls,15-04-2017,JUST IN: After AlDub's hit telebabad series, they will soon start shooting in June 2017 for their second movie.
TheSoneSource,15-04-2017,170415 Yoona - KBS ??? ?? Entertainment Weekly Interview, Opening Cut pic.twitter.com/03mjUT5f37
Maggie_Dickman,15-04-2017,Friends: I'm looking for a full-time writing position—music/entertainment, PR, social media, etc. Any leads would be much appreciated!
Monika369Saini,15-04-2017,HKNKJ have fully entertainment with patriotic messages.. #BuzzOfHKNKJ
_EnvyAfrika,15-04-2017,HOUSE OF AFRIKA | THIS SUN 16 APRIL | ON THE GREENS WITH LEVI & MORE MUSIC - ENTERTAINMENT - FASHION pic.twitter.com/TgX8NrZJsX
mystarmyangel,15-04-2017,170415 YoonA Entertainment Relay interview cr sun.agroot.geun (taken 170404 Crocs event) https://ig-s-a-a.akamaihd.net/hphotos-ak-xat1/t51.2885-15/e35/17495261_1021892674611424_5563217953928773632_n.jpg … https://ig-s-d-a.akamaihd.net/hphotos-ak-xat1/t51.2885-15/e35/17932558_1275238015845315_5299077984915816448_n.jpg …pic.twitter.com/NrwXGNQSzX
_firstsnow,15-04-2017,kbs <entertainment relay> interview w/ yoona https://www.instagram.com/p/BS5zGqIAjIG/ pic.twitter.com/TJVYosTQJF
ieEntertainment,15-04-2017,Actor @iamsrk leaves San Francisco in awe, promises free hugs to fans. Watch adorable videos, pics http://indianexpress.com/article/entertainment/bollywood/shah-rukh-khan-brett-ratner-san-francisco-free-hugs-lungi-dance-jackie-chan-acid-attack-victims-4614294/ …pic.twitter.com/x5IrJ6jYzA
htshowbiz,15-04-2017,. @iamsrk is Jackie Chan, The Rock, Tom Hanks, Tom Cruise, all in one: X-Men director http://read.ht/BWqo pic.twitter.com/80Ln6rwd4z
PaytmTickets,15-04-2017,#SPYderFirstLook starring @urstrulyMahesh @Rakulpreet & #SJSurya looks absolutely stunning. RT & like if you agree!pic.twitter.com/to04tRCHKd
ieEntertainment,15-04-2017,#TigerZindaHai: @BeingSalmanKhan #KatrinaKaif look as fresh as the snow in Austria. But why aren't they together? http://indianexpress.com/article/entertainment/bollywood/tiger-zinda-hai-salman-khan-katrina-kaif-look-as-fresh-as-the-snow-in-austria-but-why-are-not-they-together-see-pics-4613977/ …pic.twitter.com/SoC2vUEwqC
ks_veer,15-04-2017,RT #BuzzOfHKNKJ contain all constant of UNLIMITED!! entertainment and joy being liked by all age people worldwide pic.twitter.com/67eFWH0VVP
aleakimbautista,15-04-2017,4/13: Privacy is not for anyone's entertainment. Learn the value of discretion and privacy.
RamCinemas,15-04-2017,Thank you everyone for the wishes guys, will try to give better quality of Entertainment in the upcoming days. Thanks a lot
simenona,15-04-2017,I suppose it's normal in that world to allow and find entertainment in a prostitute to disrespecting a woman you supposedly loved. Its abuse
simenona,15-04-2017,There are NO hard feelings & I wish him all the best. I say this because I am not interested in dating anyone in the entertainment business.
BergerPaintsInd,15-04-2017,When it comes to ENTERTAINMENT, what has evolved over the years? Tweet using #T20ofPainting & stand a chance to win big. #ContestAlertpic.twitter.com/9kC0ynzDeI
2D_ENTPVTLTD,15-04-2017,Thank you all for showering your love upon us! This would not have been possible without you! #MagalirMattum #3MillionViewsAndCountingpic.twitter.com/oT5JQbaz4r
LolaPlusG,15-04-2017,Like maybe it ends some people and hurts others. Maybe it is not "entertainment". Maybe.
BTS_National,15-04-2017,[PRESS] 170415 LIVE EN Entertainment News: BTS arrival in Incheon Airport #?????pic.twitter.com/iOBQPxNqGM
TARSEMCHANANA,15-04-2017,Dr @Gurmeetramrahim fans are ENJOYING!! Healthy entertainment with great FERVOUR!! all aroun #BuzzOfHKNKJ creating new history
TARSEMCHANANA,15-04-2017,#BuzzOfHKNKJ vibrating all over the world HKNKJ is perfect blend of endless healthy entertainment along with powerful Patriotic messages
hugeboyplus,15-04-2017,• YG ENTERTAINMENT DANCE VIDEOS: THE THREAD pic.twitter.com/p1DW9mz4Zu
MVPIndia,15-04-2017,Wishing the fabulous @EmmaWatson a very Happy Birthday. Watch her in #TheCircle on May 19, 2017pic.twitter.com/UCijRuNvHB
realwmtrainee,15-04-2017,Dance dream tree -CYCW- . Choreography: kyle hanagami (performance WM Trainee) . #wm Entertainment #wmentertainment #wm_ggumnamupic.twitter.com/P1G2FP1OCD
neiryhisham,15-04-2017,Wow @AirAsia is moving beyond on recruitment now. Talented FA you have Mr. Fernandez. In flight entertainment #talentedFA #AirCrew #AirAsiapic.twitter.com/pye9WidGCA
EW,15-04-2017,Maureen McCormick shares Easter-themed #FlashbackFriday photo: http://share.ew.com/vrV7GPt  #BradyBunchpic.twitter.com/OLYTkGzWSN
Dirksenn1830,15-04-2017,Guysss! Look What I've Found @TheTide is featured in Entertainment Newspaper Philippines pic.twitter.com/E1RX1H0O5r
Showbiz_Polls,15-04-2017,Expect to hear these phrases today: - Breaking Box-Office Records - Super Mega Blockbuster Movie of 2017 Truth?!? PADDING!
ohmybusan_,15-04-2017,Minhyun's roommates are Kim Yong Guk (Chun Entertainment), Yoon Yong Bin (Banana Entertainment) and Hong Eun Ki (GON) pic.twitter.com/Iy36QbwSum
TENbyiaam,15-04-2017,Vanessa Hudgens's Coachella style is on its own level. Nobody does it better than her! #Coachella2017pic.twitter.com/JXsra6hcCW
NAILSGAMING,15-04-2017,FIFA point, RONALDO, 500k GIVEAWAY. RT AND SUB TO MY CHANNEL TO ENTER https://youtu.be/EUmbwPFWpXQ  @YTRetweets @ShoutGamers @FameRTs @DarkRTs1pic.twitter.com/jJsqLQKhs2
joylmh,15-04-2017,#Minoz [ Wish ] & [ Hope ] See TEXT : Details @ActorLeeMinHo #ActorLeeMinHo #LeeMinHo_??? #??? #??? #Actor cc: #MYM_Entertainment #LMH_Minozpic.twitter.com/kIiyMIn41i
sammy_ryde,15-04-2017,4 celebrity teams , Drug Abuse Prevention Sensitization, music and general entertainment #PowerballNG2017
Troma_Team,15-04-2017,Don't think we didn't notice.pic.twitter.com/00JIPNkwgF
EDUARDOXINIGUEZ,15-04-2017,*watches own Snapchat story various times for personal entertainment*
EW,15-04-2017,Liam Neeson was originally asked to do Alan Rickman's part in #LoveActually: http://share.ew.com/kNlI9YA pic.twitter.com/zuMOZo9AIG
_DigOutYourSoul,15-04-2017,The incarceration of aquatic mammals is profiteering & entertainment at their expense #NationalDolphinDay FreeFinsEUpic.twitter.com/Kn9ipgiBuI
EPEntertainment,15-04-2017,You guys are going to love the #Stay video.... COMING SOON #AlessiaCara x #Zeddpic.twitter.com/6vGE4cBPNx
kville_ent,15-04-2017,[HAPPY BIRTHDAY] to Boys Republic's Minsu ? #HappyMinsuDaypic.twitter.com/ymBWZWjR5Y
EW,15-04-2017,The name of the planet in #TheLastJedi trailer has been revealed! http://share.ew.com/nknMH5E pic.twitter.com/hubjRrwl1p
DaveKaval,15-04-2017,I would put our subway entertainment up with anywhere in the world #newyork #london #Shanghai #RootedInOakland @Athletics #bartpic.twitter.com/JtDcmBEbVp
MiSsss_World,15-04-2017,I am not using tweeter for gaining Follower .. Its not a race ... I am using tweeter just for Time pass or entertainment ..
MLB_E,14-04-2017,Country musician @joshturnermusic talks @Braves and @SunTrustPark with MLB Entertainment http://m.mlb.com/video/topic/25715598/v1284126783/josh-turner-reflects-on-his-love-of-the-braves …pic.twitter.com/DkTkXnB9lq
MommytaMaldita,14-04-2017,Don't pretend that you care about the girl. You only care about the entertainment that she brings. That's fine, but be honest with yourself.
Marvel,14-04-2017,. @AgentsofSHIELD: #Slingshot has been nominated for a Webby! Vote by April 20th: http://vote.webbyawards.com pic.twitter.com/daveUGDLgk
APEntertainment,14-04-2017,#LadyGaga ( @ladygaga) to make history at @coachella this weekend http://apne.ws/2p3rZnm pic.twitter.com/vrKZhI3KE6
ak_inshan,14-04-2017,Dr Gurmeetramrahim WWWOOOW!! ENTHUSIASTIC!! fanatics are REJUVINATING!! Endless entertainment of HKNKJ #BuzzOfHKNKJ worldwide
peta,14-04-2017,Animals are NOT entertainment! More than 30 tigers have died as a result of this company's activities. http://peta.vg/trucktigers pic.twitter.com/ONwEurNdIb
EW,14-04-2017,#GameOfThrones alum Michelle Fairley talks @WhitePrincess and powerful women: http://share.ew.com/XRUGYvj  #TheWhitePrincesspic.twitter.com/OWHKjhhRx6
EW,14-04-2017,We got a glimpse of #CarrieFisher in the new #TheLastJedi trailer: http://share.ew.com/iAJgiWP  #StarWarspic.twitter.com/fGIP5tYrba
EW,14-04-2017,The long-awaited #TheLastJedi trailer is FINALLY here: http://share.ew.com/gp12ljK  #StarWarspic.twitter.com/seMy6gxl1C
IshantSunaria,14-04-2017,Mesmerising zeal & #BuzzOfHKNKJ among @MSGsFans High fever of its entertainment & social messages on @MSGfanspunjab & @MSGFansClub
EW,14-04-2017,The new #TheLastJedi trailer just dropped! Watch it here: http://share.ew.com/M6PMjvC  #StarWarspic.twitter.com/9gxm5WNL6l
Marvel,14-04-2017,In 3 weeks, they’re back! Get tickets to see Marvel Studios' #GotGVol2: http://bit.ly/2oHdwMP pic.twitter.com/wCWPK73VfQ
LoveShowbiz_,14-04-2017,Here's @TheRossKing speaking with @GaryBarlow and @thegirlsmusical from this morning. Check it out here. #Lorrainepic.twitter.com/rPAEsCzhcW
EW,14-04-2017,A new #TheLastJedi poster was just revealed! http://share.ew.com/xIiEAgZ  #StarWarspic.twitter.com/2EFzXLsjQv
B2STera,14-04-2017,[OFFICIAL] 170414 Around US Entertainment Instagram Update http://instagram.com/ent_aroundus pic.twitter.com/v70yJhUM4o
TooK_JYH,14-04-2017,?Official? 170408 MBC Entertainment - Music Core #CNBLUE #Between_Us #???? #???? #Minhyuk https://youtu.be/UrOc-QuiMUg pic.twitter.com/OYKn2EZiQo
JWeelyams,14-04-2017,The current fight against corruption comes across as a circus show, staged for the entertainment of the public and nothing more.
vioslatte,14-04-2017,"bts.. they make entertainment reporters happy while interviewing"  https://youtu.be/1idTu3xChPc pic.twitter.com/RTY2Yt4OP6
CNNent,14-04-2017,. @kendricklamar's new album sets fire to the Internet. http://cnn.it/2pgSti0 pic.twitter.com/UQWwYhSssj
winjila,14-04-2017,#GospoSwitchEasterEdition napenda hizo hitz tu sana. Many youth tend to flood place kuna artists for entertainment more than prayer.
rubyvicky_i,14-04-2017,HKNKJ receiving magnificent response across the globe! Everyone is enjoying the spell of entertainment #BuzzOfHKNKJpic.twitter.com/LCCPZcZrFz
ksushma140,14-04-2017,#BuzzOfHKNKJ vibrating all over the world HKNKJ is perfect blend of endless healthy entertainment along with powerful Patriotic messages
ksushma140,14-04-2017,#BuzzOfHKNKJ contain all constant of UNLIMITED!! entertainment and joy being liked by all age people worldwide pic.twitter.com/zLkzDXe7VP
jasonosamede,14-04-2017,I heavily dislike the assumption that consumption of black entertainment has the consequence of neglecting 'intellectual engagement'
rubyvicky_i,14-04-2017,fans are enjoying patriotic dose of entertainment to the fullest #BuzzOfHKNKJ
ksushma140,14-04-2017,Dr Gurmeetramrahim WWWOOOW!! ENTHUSIASTIC!! fanatics are REJUVINATING!! Endless entertainment of HKNKJ #BuzzOfHKNKJ worldwide
KBSWorldTV,14-04-2017,WATCH 'K-RUSH' #LIVE RIGHT NOW ONLY ON KBS WORLD YOUTUBE!! >> https://www.youtube.com/watch?v=WA2aO9gAxwg … #youtube #krush #kpop #entertainment #showpic.twitter.com/ThY9JvihQp
rashmise77,14-04-2017,HKNKJ is still running everywhere even in Abroad , all because of healthy entertainment by Dr. @Gurmeetramrahim ji . #BuzzOfHKNKJ
LoxleyLove11,14-04-2017,Enjoy a great evening of entertainment on 22nd April with @KarlLoxley & special guests! Ticket info: http://balsallcom.com/2017/03/karl-l …pic.twitter.com/ZHt6XU9ykC
RupikaSharma6,14-04-2017,After seeing the #BuzzOfHKNKJ I can relate the fact that Entertainment Without Vulgarity rocks in MSG-Series!!
sparshinsan,14-04-2017,All Are so Influenced by The Surgical Strike in Cinemas .. Healthy Entertainment is getting loved by all #BuzzOfHKNKJ
miss_sheetal,14-04-2017,No Words in My Dictionary in praise Of Healthy Entertainment Of #BuzzOfHKNKJ
miss_sheetal,14-04-2017,Heart touching Music & Healthy Entertainment producing Everlasting bliss & Joy ! #BuzzOfHKNKJ
preety799,14-04-2017,#BuzzOfHKNKJ filled with Action,thriller,romance,entertainment,patriotism & perfect storyline.
theseoulstory,14-04-2017,Rapper Swings introduced 'School Rapper' Choi Ha Min aka Osshun Gum as new member of Just Music Entertainment http://entertain.naver.com/now/read?oid=382&aid=0000557309 …pic.twitter.com/S5eyCQ6X1E
KoreanTimes_PH,14-04-2017,Cube Entertainment Solo Singer No Jihoon is in the Philippines too! We Welcome you to Philippines @nojihoon pic.twitter.com/md4Jz6tpCe
htshowbiz,14-04-2017,How adorable are they @kritisanon & @itsSSR in #RaabtaFirstLook http://read.ht/BWlT pic.twitter.com/j1OZtnQtGc
Cweezyy5,14-04-2017,I can't wait until I make it. Doing what I do best--- & that's interviewing. entertainment, sports, all that.
SlenderSwab,14-04-2017,1961:military industrial cmplx(MIC) 2003:military industrial entertainment cmplx(MIEC) 2017:Brian Williams jacks off on a missile(MSNBC)
kville_ent,14-04-2017,EVOLUTION OF #BAP! Congrats to their fans for winning this video for them! Watch it here  https://www.youtube.com/watch?v=dE70ePxJFXY …pic.twitter.com/gWjKmQf4VJ
EW,14-04-2017,Never has a fictional TV town been more in need of the emotional byproducts of a night out. Our #Riverdale recap: http://share.ew.com/xt4fkLK pic.twitter.com/BWxF0xfcq8
maomao_army,14-04-2017,#Jessica on coridel_entertainment IG https://www.instagram.com/p/BS2VTPfhDOR/  https://scontent-icn1-1.cdninstagram.com/t51.2885-15/sh0.08/e35/17933856_142456532955046_7108353161881976832_n.jpg …pic.twitter.com/xscTf04zfK
marcusIee,14-04-2017,my top 11 for pd101 1. kim samuel 2. samuel kim 3. the ex-pledis trainee 4. punch 5. brave entertainment trainee 6. ex-member of 1punch
