User handle,Date of tweet,Tweet Data
ReadTheDamnNews,02-04-2017,"I completed the manuscript for “Nickel and Dimed” in a time of seemingly boundless prosperity. Technology... http://fb.me/1gtKzX3EK 
maxsided,02-04-2017,SubPac S2 Seatback Physical Sound System http://wp.me/p8lT1e-aC  #tech #technology #news
oneunited,02-04-2017,The tech industry is booming now more than ever. Are you ready to break into it? #BlackOwnedBusiness #Technology https://blavity.com/breaking-into-the-high-tech-industry …
linkedincareers,02-04-2017,Technology enabling the democratisation of education. A powerful current of change. https://lnkd.in/e3NY7s3 
ComstorAfrica,02-04-2017,Collaboration technology helps simplify and streamline real-time communications & erases physical boundaries among teams pic.twitter.com/nxytchsqMt
KopiWrites,02-04-2017,#technology now allows us to live virtual lives with expanded realities that affect our everyday existence #VirtualReality #socialmedia #ai
ikelib,02-04-2017,Over spring break learn how to use technology to make your own music. Register at... http://fb.me/47StZ0Mfp 
pbquilez,02-04-2017,#Diversity in Technology https://lnkd.in/daestHQ 
bnleez,02-04-2017,UNSW turns to former student Adam Brimo for online learning technology in $100 million makeover http://bit.ly/2owLSj4 
NetSuite,02-04-2017,Check how #Alterview Kanban uses drag-and-drop technology to trigger automated record updates in NetSuite. http://bit.ly/2mYpm3U 
BPMsupreme,02-04-2017,Does the technology make the DJ? RT and share your thoughts!! pic.twitter.com/mNCv6amNaM
defibshop,02-04-2017,Ready for a history lesson? Let’s take a look at how we’ve advanced in medical technology in the past 100 years: http://bit.ly/2aQTo2i pic.twitter.com/Y41Q9dZhlp
ciscomiddleeast,02-04-2017,Cisco are pleased to announce @Intel as our official Technology Sponsor at #CiscoConnectUAE http://cs.co/60198w2bW 
StanfordBiz,02-04-2017,Technology is not eliminating jobs. It’s changing them. http://stanford.io/2nrH4e7 
BrJCancer,02-04-2017,Vogelstein: new technology will completely change cancer research in next 50 years #AACR17
Kashish_Shine1,02-04-2017,Same here! I felt till now Shoika slayed with dance and technology too...
maximeae,02-04-2017,How grandmothers help fight depression in Zimbabwe http://dlvr.it/NnNCbZ  - #HN #Technology pic.twitter.com/iTfFeRKTBO
maximeae,02-04-2017,Men Without Work http://dlvr.it/NnNCYn  - #HN #Technology
smarthouseaz,02-04-2017,#smart locking technology #smarthouseaz #smarthome #schlage #zwave @Schlage_Locks #iotdevice #designthinking #designhttps://youtu.be/yvg4uvkSDM4 
knownAsJimin,02-04-2017,|. Yoongi turns me on with his tongue technology all the time. Even his breathing turns me on
FacebookNews3,02-04-2017,COBIT Extended: g510-5072-information-technology-infrastructure-library #cobitextended #FreeDownload #Free #Giveaway http://buff.ly/2ofg9CU  pic.twitter.com/qX3xCwqCH0
pivottwistdev,02-04-2017,It's improving health outcomes, but with Blockchain technology!
LorinInnoVision,02-04-2017,Finance, Hospitality, Communications, Technology, etc. lots of stories
environmentguru,02-04-2017,The Government of Canada invests $2.5m in clean technology for developing countries: The… https://goo.gl/fb/1VYavo 
tweetparts07,02-04-2017,new app on #appStore at http://ift.tt/2ooPMxr  'VoiceCha - Shenzhen Soho Dreamworks Information Technology Co., Ltd.' pic.twitter.com/u1I023U88s
AgeingBetter,02-04-2017,Vital to help #olderpeople #online for #information, #support, #services, #saving money, reducing #isolation...& fun too! #technology https://twitter.com/goodthingsfdn/status/843829909445361667 …
swiftinvestor,02-04-2017,Gallery: An intimate look at two Syrian refugee families #technology http://bit.ly/2kEeZy2 
CreativeWolf,02-04-2017,It’s the technology, stupid http://m.thehindubusinessline.com/blink/cover/11-reasons-why-aadhaar-is-not-just-nonsmart-but-also-insecure/article9608225.ece … by @sunil_abraham
italiamate311,02-04-2017,With all the new car technology you would think soqeon: could invent a side mirror that could show where an object actually appears.
ezpatent,02-04-2017,The latest IDP Daily - Patents & Technology! http://paper.li/ezpatent/1411091822?edition_id=04865620-17bd-11e7-be7c-0cc47a0d1609 … #technology
WeichertCP,02-04-2017,IKEA Entering into the World of Smart Home Technology http://bit.ly/2nr0fVz 
Electronics_Acc,02-04-2017,#9: BAXIA TECHNOLOGY 38-in-1 Accessories for GoPro HERO 5 Session 4 3+ 3 2 1 Cameras - Black Silver… https://goo.gl/fb/XyRe1o  #Electronics
Jrumpler,02-04-2017,I just checked in at National College of Business and Technology - Nashville with #mPLUSPlaces Download today! http://bit.ly/gomplaces 
DarkoAzure,02-04-2017,Want a practical, affordable JDM car with off road ability and serious perf ... #horology #america #technology pic.twitter.com/BuTtmWA8F8
BettyAnnX11,02-04-2017,9 Important Strategies for Raising Children in a World of Technology http://www.becomingminimalist.com/ikids/  #bewaredistraction #usetocreate
PlayfulLeeds,02-04-2017,This is such an awesome application of arts / technology and community art #steam (think you'd love the Morecamb connection @anitamorris)https://twitter.com/shrimpingit/status/848510375037423621 …
xyzwonpil,02-04-2017,yeah! i demand more creativity in aliens!! we have technology now for rad and realistic effects https://twitter.com/twcmomoxyz/status/848564240579313664 …
New2TheAppStore,02-04-2017,New to the App Store:VR Prado Car Parking : Multi-Story Top Kids Game - Jolta Technology http://ift.tt/2opQFq2 
DecoDays,02-04-2017,Please RT #interiordesign #decoration #architecture #home In the interface between technology and design... http://bit.ly/2oNqNR9 pic.twitter.com/fNQ8OE1Cx9
MonsantoCo,02-04-2017,Today’s technology can support on-farm decision-making. http://monsanto.info/2n1ia8W 
dgwbirch,02-04-2017,What does this mean @angela_walch "A SIGNATURE THAT IS SECURED THROUGH BLOCKCHAIN TECHNOLOGY IS CONSIDERED TO BE IN AN ELECTRONIC FORM"
iAMHIPHOP_23,02-04-2017,I'd like to see technology flourish in helping clean up the air. There are great inventions waiting to be produced, that would help.
itsjat32,02-04-2017,Single Screens should either upgrade to latest technology (I would say IMAX) or leave market. https://twitter.com/kamaalrkhan/status/848563080422445057 …
chuckandblair90,02-04-2017,Yes! Lol sry. I'm fairly out of most sm technology
jatescher,02-04-2017,Interesting perspective on what AI and technology are https://stratechery.com/2017/the-arrival-of-artificial-intelligence/ …
Synced_Global,02-04-2017,China’s National Engineering Laboratory of Deep Learning Technology was Established |Synced| http://syncedreview.com/2017/04/02/chinas-national-engineering-laboratory-of-deep-learning-technology-was-established-at-baidu-campus-we-are-the-national-team-of-deep-learning …pic.twitter.com/Mu3b97ur7h
GJ_Recruitment,02-04-2017,Trainee Recruitment Consultant-Oho Group-IT and Technology Recruitment-London (Central), London (Greater)-OHO GROUP https://jobs.theguardian.com/job/6480145/trainee-recruitment-consultant-oho-group-it-and-technology-recruitment/?TrackID=12 …
arrayit,02-04-2017,Arrayit microarray technology customers at the National Cancer Institute NCI publish melanoma cancer cell discovery http://onlinelibrary.wiley.com/doi/10.1111/febs.13989/full …pic.twitter.com/533Betky0L
GreatWaveTech,02-04-2017,Will Technology Replace Good, Old-Fashioned Exercise? | http://ow.ly/xwES30au7fk  | #Technology #Fitnesspic.twitter.com/qwKEmUjyTB
JohnBunka,02-04-2017,The Best Technology Tools for Content Marketing via @Entrepreneur http://buff.ly/2ooXdom pic.twitter.com/ZVUCLtwqRS
Contactually,02-04-2017,Need to revamp your real estate technology closet? Here are the top 10 tools for real estate blogs: http://contactual.ly/2okveqk pic.twitter.com/8TdkBCy4OZ
JasvindersSINGH,02-04-2017,3D technology, printing of 3 dimension object is going to be a huge base pillar This is era of 'Internet of Things'. http://www.narendramodi.in/category/quotes pic.twitter.com/AI5YMdqhtr
8bitpda,02-04-2017,Trends I have noticed In video games: games with realistic art styles age badly because as technology improves our standards do (1)
UptownFarms,02-04-2017,There are many legit conversations to be had about how we use technology in farming but his was not one of them.
HeidiSongs,02-04-2017,YES! It's all about a healthy balance! #play #kids #technology #screentime http://ift.tt/2ntGjjP pic.twitter.com/K9JyPOq02l
ThankGod4_JP,02-04-2017,Technology advances have made us ,as humans ,reach levels that mabe a 100 years ago seem impossible but have also hindered us as well
DianaBell_,02-04-2017,More #wayhaught, more Nicole, more awesome sister bonding, doc plus technology, more character development, slightly less action.
JulieM_273,02-04-2017,Fish Farms = #sustainability in #fishing Land-based fish farms = #safety #Technology and #biotech for the win
MerceCardus,02-04-2017,TUESDAY LINKS ~ Reads http://bit.ly/2nOgyxW  #culture #entertainment #gender #health #motivation #relationships #socialmedia #technology
emshore,02-04-2017,"The Pentagon Still Doesn’t Encrypt Its Emails" via @Digg http://ift.tt/2oHeVQn  #tech #news #technology #trending
SRESMusic,02-04-2017,Kids react to technology: The Walkman! "Would you prefer this or modern technology?" https://www.youtube.com/watch?v=Uk_vV-JRZ6E …
FrankEves,02-04-2017,‘It was amazing’: New technology allows paralyzed man to move arm by thinking about it >> https://www.washingtonpost.com/news/morning-mix/wp/2017/03/29/it-was-amazing-new-technology-allows-paralyzed-man-to-move-arm-by-thinking-about-it/ …
BioPortfolio,02-04-2017,Global Genetic Testing Market By Type, By Disease, By Technology and by Region Industry Analysis, Size, Share,... http://ow.ly/j7rH100CVsK 
Espirits1,02-04-2017,When do you take the time to create your life or on you constantly engaged in some form of technology? pic.twitter.com/zYcycDZ9sU
TotalTrax,02-04-2017,#Forklift batteries are a big investment, but monitoring technology helps maximize battery health & lifespan. http://hubs.ly/H06VQvk0 
IdRiskTheFall,02-04-2017,This is why I hate social media &technology. People do the dumbest shit for fame/ followers. 'Going viral' is fuckin toxic &needs to stop
gedion_t,02-04-2017,The problem gets worse when you consider Iranian exchange students are stealing US research technology for Iran https://www.washingtonpost.com/blogs/right-turn/wp/2017/03/29/iran-provides-a-rare-moment-of-bipartisanship/?tid=hybrid_content_2_na …
Joanne1225,02-04-2017,Good question. They are working on technology to put bombs in anything, i.e. baby bottles, & now can screen in advance. @POTUS
PresHumzaRizwan,02-04-2017,Another recording of Metro1News program 'Khabar Ki Khabar' organized by Institute of Business & Technology, lead... http://fb.me/8bIvSKCcL 
technews_google,02-04-2017,Here's Why Facebook Creeping Is No Longer Anonymous - Complex http://dlvr.it/NnN4K9  #Technology
SmithTonyD,02-04-2017,Pollution, congestion and changing auto technology is also a challenge for Germany but will the UK react quicker? https://www.theguardian.com/world/2017/apr/01/stuttgart-reaches-crossroads-congested-polluted-car-industry-jobs?CMP=Share_iOSApp_Other …
ScoopSquid,02-04-2017,http://ift.tt/2nwzZc8  Why do developers who could work anywhere flock to the world’s most expensive cities? #technology
AURES_uk,02-04-2017,See our full range of essential peripherals, from the basic cash-drawer to the latest multi-technology reader, here http://bit.ly/2lzQciM pic.twitter.com/pIVUrHdKsf
danielaaxinte,02-04-2017,Technology companies ask "what can we disrupt" and the government asks "what can we control". Which one makes progress? @nntalebhttps://twitter.com/nntaleb/status/848559054939181056 …
MeetingExp,02-04-2017,#TeamME welcomes 5000 @Oracle users and partners to COLLABORATE 17: Technology & Apps Forum for the #Oracle Community #C17LV @MandalayBaypic.twitter.com/tnch25AeYy
Face4Job,02-04-2017,Azienda: WINMEDICAL Srl Divisione: Technology/IT Funzione: SW Developer #lavoro con #f4j #Face4Job a #Pisahttp://buff.ly/2oxp7vM 
1031fund,02-04-2017,Silicon Valley is living in a bubble of technology #tech #siliconvalley http://ow.ly/3nTf30arHRJ pic.twitter.com/bsr4O2cCdz
Fisher85M,02-04-2017,#technology #mobile #blackberry Expect to see BlackBerry's name (and tech) on more deviceshttp://engt.co/2otutYD 
LarsonSeeley,02-04-2017,Smart #B2B messaging can drive #sales and #marketing forward, https://www.emotivebrand.com/b2b-messaging/#.WOEdbnwbVQE.twitter … #enterprise #software #technology #CPO #CMO
CitlyApp,02-04-2017,We got 5 Star reviews on the AppStore! https://itunes.apple.com/app/id1061425438 … #apps #technology pic.twitter.com/a5HHRfGS4A
Kacheling,02-04-2017,How technology will destroy low-wage and middle class jobs the world over #UBIhttp://www.hindustantimes.com/columns/how-technology-will-destroy-low-wage-and-middle-class-jobs-the-world-over/story-zwCv6RgBnttZ14gHVGr3NO.html …
iSushilPandey,02-04-2017,3D technology, printing of 3 dimension object is going to be a huge base pillar. This is an era of 'Internet of Things'. via NMApp pic.twitter.com/nP59TcaK78
techy_leaks,02-04-2017,Starting the Twitter page of Instagram page "Technology Leaks"......... Link :- https://www.instagram.com/technology.leaks/ …
researchbib,02-04-2017,5 th International Conference on Applied Computing & Information Technology (ACIT 2017) http://dlvr.it/NnN3PK  ReseachBib
eduforumpk,02-04-2017,University Of Engineering & Technology Lahore: Admision Starts In Ph.D In Different Faculties. Last Date To Apply 10 May. "Nawaiwaqt" AD: pic.twitter.com/bxVsGCidbx
AspirationaI,02-04-2017,Hopefully that technology never comes https://twitter.com/hamronii/status/848562430628245504 …
TweetingOtusOwl,02-04-2017,http://bit.ly/2n1oi0P  #Technology Facebook's stories feature proves Mark Zuckerberg is the Pritam of Silicon Valley - Firstpost pic.twitter.com/swJ7epBC98
puledo,02-04-2017,Why do developers who could work anywhere flock to the world’s most expensive cities? http://ift.tt/2oN1Ogs  #Technology #technews #puled…
BigSim50,02-04-2017,*AHEM* “So that’s who runs the @memgrizz account.” “GrizzNation spreads to Montana apparently.” “Bear Necessities of Technology.” https://twitter.com/OddNewsUPI/status/847871903188492288 …
Tinolle1955,02-04-2017,Advanced #Threats,Intelligence #Technology, #Cyber #Security * #weekend , #update *02.04.2017. * | Scoop.it http://www.scoop.it/t/advanced-threats-intelligence-technology …
rashidfdavis,02-04-2017,http://www.times-news.com/news/education/school-system-offers-early-college-technology-program/article_641c06c9-9b5c-5d89-8d23-d1fac33ca3f5.html … | School system offers early college technology program #earlycollegeweek #ptech #sunchat #thisweek #hacklearning
sanlaxman,02-04-2017,Please don't tell anyone that you studied from Indian Institute of "Technology" https://twitter.com/ArvindKejriwal/status/847995592047550465 …
richardmills18,02-04-2017,A direct link to the @UniofBath #autism and #technology course #CAAR #Erasmus. Please sharehttps://www.futurelearn.com/courses/supporting-autism?utm_campaign=fl_april_2017&utm_content=world&utm_medium=futurelearn_organic_blog&utm_source=blog …
48Growth,02-04-2017,#Blockchain Technology and the Law Are Allies, Not Enemies http://dld.bz/fkYrY  #Ethereum #cryptopic.twitter.com/vsv3dG1xvg
pod_onnell,02-04-2017,Live look from the outside of this united express plane! Technology is amazing!! pic.twitter.com/abuuM3RQyR
USTICSSC,02-04-2017,Let's welcome IICS Week with the most awaited parade entitled "Marquee 2017: Technology Amidst Diversity" April 3 | 7AM - 8AM #Marquee2017 pic.twitter.com/U1FIn0RaWm
Ekklesia_co_uk,02-04-2017,A rational, humane and more equal economy utilising digital technology well would head in this direction. Odd that you cannot see this. https://twitter.com/damiangreenmp/status/848553395212488708 …
NormanLinnell,02-04-2017,The technology does NOT exist to produce cost-effective & reliable 24/7 solar or wind power.Only hydro is cheap, "green", & reliable https://twitter.com/edincali/status/848559327145205761 …
danielgullo,02-04-2017,Source of American economic sclerosis - without good institutions, an economy can’t translate technology into weal… https://bloom.bg/2oxdC7n 
Lynch39083,02-04-2017,How to create a collaborative learning environment with technology https://is.gd/aAIFar  #edtech #steampic.twitter.com/zQs9jR7OZC
3dheals,02-04-2017,see how #VR/AR will #empower #3dprinting #technology in bettering the real world #healthcare #3DHEALS2017 http://buff.ly/2o6aamY pic.twitter.com/dYZaYKnHGk
SharePointSwiss,02-04-2017,Exposed files on Microsoft's document-sharing site https://goo.gl/tWJzYi  #office365 #technology pic.twitter.com/5HqhHNtRdo
thedeannapaul,02-04-2017,Do our advances in technology inhibit us as humans?
appellatech,02-04-2017,The Future of the Professions: How Technology Will Transform the Work of Huma... https://www.amazon.com/dp/0198799071/ref=cm_sw_r_tw_dp_x_vZr4ybNM1A9X3 … via @amazon
anichols32,02-04-2017,What does TOSA stand for? Guessing T is for technology
TheDilliMirror,02-04-2017,Top technology discussion topics globally - AI, machine learning , cognitive computing. In India - EVM tampering .
khairatgaurav10,02-04-2017,3D technology, printing of 3 dimension object is going to be a huge base pillar. This is an era of 'Internet of Thing pic.twitter.com/zw1LJjAx8x
CreativeAnto,02-04-2017,I liked a @YouTube video http://youtu.be/nbKc7uCB4VA?a  A professional technology learning platform in action | Pluralsight
brute_geek,02-04-2017,Why do developers who could work anywhere flock to the world’s most expensive cities? via /r/technology http://ift.tt/2nZpsZZ  #technology pic.twitter.com/lCifOKgjvk
TheRivetDaddy,02-04-2017,“The kids love it because it’s a story, but they also see this technology used in it.” http://snip.ly/fsnto 
blackweldermd,02-04-2017,It is so sad we live in a world what such incredible technology is critically needed. War is totally crazy! http://buff.ly/2olBj5b 
FutuReCybernize,02-04-2017,3 Reasons Why Veterans Make Great Entrepreneurs http://ift.tt/2nZweyY  #innovation #tech #future #technology #amazing
nashaaWEST,02-04-2017,Lyft customer: you got a charger Driver: iPhone? Customer: nah, I got alien technology, that's a child's toy pic.twitter.com/9MtM6P948o
News_Kat,02-04-2017,Silicon Valley is living in a bubble of technology that’s not accessible to the rest of the world https://www.recode.net/2017/3/29/15112820/tech-innovations-global-distribution-diversity-square-google?utm_campaign=www.recode.net&utm_content=entry&utm_medium=social&utm_source=twitter … via @Recode
GiveMechalleng,02-04-2017,#Technology#Tech#Technews 48 Days: A Migration Story, from Cuba to the USA by Lisette Poole http://ow.ly/NBem50aAChy 
GiveMechalleng,02-04-2017,#Technology#Tech#Technews THE DAMNED MAN´S SPEECH - Helmut Berger Documentary by Bettina Vordamme http://ow.ly/o8vb50aAChz 
chrisabutler,02-04-2017,The latest The chrisabutler Daily! http://paper.li/chrisabutler?edition_id=89621840-17bb-11e7-ab87-0cc47a0d1605 … Thanks to @GriffCloud #technology #google
pewalla,02-04-2017,Step up and take responsibility! Technology company? Publisher? The lines can no longer be blurred https://www.theguardian.com/media/2017/apr/02/facebook-google-youtube-inappropriate-advertising-fake-news?CMP=Share_iOSApp_Other …
JediEconomist,02-04-2017,2/3 ...technology gains will improve comms (driverless + internet/AR) + cut IR will be again + QE. The last chance this represents...
MissKatherineLK,02-04-2017,Why do developers who could work anywhere flock to the world’s most expensive cities? via /r/technology http://ift.tt/2nZpsZZ  #tech #new…
hiteshsangani,02-04-2017,Top story: Old Scientist: Future technology – when to believe the hype http://technewseurope.com/item/2665-old-scientist-future-technology-when-to-believe-the-hype …, see more http://tweetedtimes.com/hiteshsangani?s=tnp …
ThisWayGlobal,02-04-2017,Our far reaching machine-learning technology does the work by reaching out to valuable active & passive candid... http://buff.ly/2oxq07j pic.twitter.com/88JiskPoew
SkeletalMergoat,02-04-2017,i have aged a thousand years. technology is evil ubt also my only means of communication so help an old man learn
indianprivacy,02-04-2017,#Aadhaar Has Serious Flaws In The Areas Of #Technology, #Law, #CivilLiberties, #CyberSecurity, Cost, #Privacy Etc- https://twitter.com/Praveen_Dalal/status/847717197317251072 …pic.twitter.com/jMqBJHOHWV
MattHiefield,02-04-2017,Myth: #classroom #technology = #engagement. http://ln.is/georgecouros.ca/blog/5Txjh … Couros #education #edtech #edchat #teaching #edreform #edleadershippic.twitter.com/14BcpxYHAn
ianmballard,02-04-2017,"Abu Dhabi and Saudi Arabia to team up on energy technology and renewables | The National" Abu Dhabi and Saudi A… http://bit.ly/2n1A9vW 
app_scoop,02-04-2017,Senate blocks mandatory 'smart' gun technology - Arizona Daily Sun https://goo.gl/3a2OWv  #technology
VeeShostak,02-04-2017,The photography of Trump's presidency is a huge break from Obama's http://dlvr.it/NnMzdS  #Tech #Technology pic.twitter.com/kag2hXoDtX
IMJACKTG,02-04-2017,Tech Update from the BBC! #Tech #BBC #Technology Ikutaro Kakehashi: Roland founder and music pioneer dies aged ... http://ow.ly/KZpJ50aABPE 
jhagel,02-04-2017,Source of American economic sclerosis - without good institutions, an economy can’t translate technology into wealth https://bloom.bg/2oxdC7n 
SohanaResearchF,02-04-2017,This article focuses on cancer and HIV but the technology being used is quite extraordinary #GeneTherapyhttp://wallstreetpit.com/113070-breakthrough-approach-gene-therapy-can-potentially-revolutionize-fight-cancer-hiv/ …
Engerati,02-04-2017,what are the proof cases of #blockchain #technology for the #energy sector? Find out here: http://erati.me/2jwM0NN 
tech_critic,02-04-2017,Uh oh, an Uber executive accused of stealing driverless car technology from his former employers at Google. http://ow.ly/pPc330asq3S 
hashNetworK,02-04-2017,2016 is set to be the breakthrough year for #VirtualReality technology. Follow @hashVR for #VR News & Updates.pic.twitter.com/34jHWeirFd
jmancini77,02-04-2017,Looking forward to keynoting the #TX #Technology Symposium on May 3 - be there! -- http://hubs.ly/H06W1g_0  @mccinnovationspic.twitter.com/XXMkQ0yEew
kellyroosve,02-04-2017,Google Adwords: Learn the Most Effective Marketing Method Today... #Technology https://goo.gl/fb/jXr1oe  #technology
tmj_nhc_jobs,02-04-2017,We're #hiring! Read about our latest #job opening here: 2017 Technology Internship Program - http://bit.ly/2gsb4Xr  #Portsmouth, NHpic.twitter.com/qtka0G9WIU
Conventa2017,02-04-2017,During the extensive programme, which could be followed on-line, the attendees got familiar with technology innov... http://bit.ly/2op9J7x 
RandyWerth,02-04-2017,Quit making vehicles "safer"! It's obviously not working. Technology can't replace skill. Teach kids how to DRIVE. http://www.foxnews.com/us/2017/04/02/texas-church-bus-crash-witness-account-highlights-dangers-texting-while-driving.html …
innovateygk,02-04-2017,How Modern Day #Technology Is Both Maximizing And Destroying Our #Productivity And #Creative Thinking http://buff.ly/2oysJg5  via @Inc
TheDrugStores,02-04-2017,#prnewswire Research and Markets - Global Assisted Reproductive Technology Market to Grow https://goo.gl/jVfj8s 
MattBovell,02-04-2017,The Technology Part to Your Content #Marketing Plan via @razorsocial http://buff.ly/2owlqGB  #automation
arlensplace,02-04-2017,@HarvardHealth have you seen this wearable technology ? http://apc.helo.life pic.twitter.com/aOSXAhlvOh
NewsCASA,02-04-2017,Australia issues new statement of expectations for CASA - #Airport ... - #Airport Technology : http://fat.ly/26h31 
AlanDBush,02-04-2017,You are about to discover the newest, scariest, most powerful #realestate investing technology ever created. http://bit.ly/2i4lkWZ 
KING_DESPERADO_,02-04-2017,I refuse to let technology beat me everything is smart these days. Well guess what? I wanna be smarter!! pic.twitter.com/qE0zEmH1uL
Joanne1225,02-04-2017,Now that ISIS has airport security technology they can expand their bombs to anything & check for detection in advance.
b1Services,02-04-2017,Techno techno techno: how gig going in the future will be transformed by technology http://dlvr.it/NnMxSW pic.twitter.com/F7XHCIHgL1
jobar91468,02-04-2017,Time is LONG overdue for phone & auto industry cooperation on text disable technology while moving @NTSB @USDOT @Ford @GM @ATTCares
ac573UKC,02-04-2017,The future of technology still has a lot to improve upon, maybe getting the prototype working first is a good start @EerkeBoiten #Co643https://twitter.com/verge/status/848499760218689536 …
RichardLane666,02-04-2017,With today's technology, I just wait until the day after to watch it usually. But the Raw after Mania is always a good one!
Chuck_Moeller,02-04-2017,Top story: How IoT is disrupting the technology world around us http://readwrite.com/2017/04/01/iot-is-disrupting-the-world-around-us-dl1/ …, see more http://tweetedtimes.com/v/12085?s=tnp 
DeebbaAli,02-04-2017,. @thecorpcommguy AI at its best... technology transforming customer exp; impressive indeed @Olacabs #Olawheelshttps://twitter.com/thecorpcommguy/status/848050490906628096 …
itsforhome,02-04-2017,#RenewableEnergy: Abu Dhabi and Saudi Arabia to team up on energy technology and renewables ... https://goo.gl/sFPG9V 
sheena2804,02-04-2017,New Tech-scuses #technology #Hunorpic.twitter.com/siIxKzyLoQ
RibbonfishTeam,02-04-2017,Our very own @defossem lists what he loves and hates about @salesforce - http://buff.ly/2mKFgAv  | #technology #tech
