User handle,Date of tweet,Tweet Data
RecentCutbacks,03-04-2017,Got nothing but for City College of Technology and the Theatreworks Collaborate! residency. Great staff and wonderful students. TY! pic.twitter.com/zcNsjD3pow
charleshancom,03-04-2017,I this quote @rrhoover. I just replaced "technology" with "products".
pmakaram,03-04-2017,#Google co-founder favors nano technology http://usat.ly/28SjBuq  via @USATODAY maybe it's time to start another #nanotech #startup
ScottParksLU20,03-04-2017,All of These Companies Could Cash In on Apple and Ford Trying to Dominate the Future of Technology https://www.thestreet.com/story/14060363/1/here-are-the-biggest-winners-from-ford-and-apple-trying-to-dominate-the-future-of-technology.html … via @TheStreet
dougpete,03-04-2017,Is Technology Holding Students Back? | Edudemic http://ow.ly/UDR430auiqQ 
henesy43,03-04-2017,Had a great time at the Dekalb HS of Technology Career Expo! See freestyle footage below! #freestyle #realmusic https://www.facebook.com/TheRealREVOZMF/videos/763143720518037/ …pic.twitter.com/y3jEPKXp2O
ricardocarocom,03-04-2017,The next big leap in #cloud #technology will be serverless via @startupsco @ajoabraham http://bit.ly/2ooLNAX pic.twitter.com/jhOij5Vhdw
JohnFromCranber,03-04-2017,Why is Islamic Extremism Such a Threat to Western Civilization? Because We Let Them Use Our Technology, Generosity + Complacency Against us pic.twitter.com/icRT8C5wxy
BrettStolz,03-04-2017,When does it makes sense to duplicate work for people who refuse technology? Is that a reflection of the technology or the work that you do?
moueller1961,03-04-2017,#ISRAEL #GERMANY #TECHNOLOGY #BUSINESS: @Volkswagen's CEO #MatthiasMüller secretly visited Israel..R&D..OR..(hb)http://www.globes.co.il/news/article.aspx?did=1001183641 …pic.twitter.com/oJzObLaE7z
LennyManor,03-04-2017,Control this racing car without actually touching anything http://ift.tt/2nOA8ua  #innovation #technology pic.twitter.com/OhiuPbQMco
abrafashiondiva,03-04-2017,New iPhone 8 Details Reveal Impressive Advanced Technology http://a.msn.com/01/en-us/BBzbdwA?ocid=st …
MonteDutton,03-04-2017,Technology affects us all. Writers, for instance. More people write and less people read. Losing proposition.
lloydgprice,03-04-2017,This Silicon Valley school shuns technology - yet most of the students are children of tech execs & entrepreneurs http://uk.businessinsider.com/waldorf-silicon-valley-school-shuns-technology-2017-3?r=US&IR=T …
innova_scape,03-04-2017,RhondaEldridge: #FinTech #Innovation players. Who do you know? #Payments #Technology https://twitter.com/RhondaDEldridge/status/848592506661072897#labnol …
chriswrighttech,03-04-2017,Commission your own traffic and construction studies without ever leaving bed… https://goo.gl/fb/WLkpTn  #technology
BryceSpaceTech,03-04-2017,Rep. Bridenstine: If the policy isn't right, the technology doesn't matter. #SGFF2017 #SpaceSymposium
ScrambledEgg4,03-04-2017,© Scrambled Eggs Music Brazil : Scrambled Technology: Cubase 9 zu teuer ? Freeware... http://scrambledeggsmusic.blogspot.com/2017/04/scrambled-technology-cubase-9-zu-teuer.html?spref=tw …
LoebVernon,03-04-2017,Let's start using technology to stop wasting so much electricity. @cltomlinson http://www.houstonchronicle.com/business/columnists/tomlinson/article/More-efficient-electricity-use-will-force-new-11041006.php?t=aadbd53c7b438d9cbb&cmpid=twitter-premium … via @HoustonChron
Pillboxz,03-04-2017,Sorry that we have decided to go towards the bleeding edge of pizza technology. We live in the pizza future.
bikebrakelight,03-04-2017,Designed for the road-weary biker - LucidBRAKE a breakthrough technology in riding safety https://www.amazon.com/dp/B01FGVHPKA?m=A20ZMC10HTZ4ZW … #travel
dignorant,03-04-2017,why are food trucks in houston so goddamn loud? what advanced technology do austin food trucks have that hasn't made it here yet?
roboboogiePDX,03-04-2017,5 of the coolest things @DigitalTrends saw at the 2017 Luxury Technology Show http://www.digitaltrends.com/mobile/luxury-tech-show-2017/#ixzz4ckqks7X2 … #luxurytechnologyshow #tech
SocialFloMemory,03-04-2017,Trump's old Ferrari sells at auction for record $270000 - CNNMoney http://dlvr.it/NnQ4Zr  #Sci_Tech #google #technology #trends #tradeflopic.twitter.com/MbWTWnYfrL
UArkansas,03-04-2017,. @uawaltoncollege Information Technology Research Institute hosts IT Day for Northeast Arkansas high school students http://ow.ly/Ak8o30apZ39 
Matt_Kinson,03-04-2017,If I can somehow harness the technology that my washerdryer uses to make items get inside my duvet cover to work on duvets I WILL BE SO RICH
abc13houston,03-04-2017,Did you know #ABC13 has its own 'Batmobile'? @MarlaABC13 takes you inside this incredible technology: http://abc13.com/1830464/  #HouNewspic.twitter.com/kOOdSk5uZq
AnthonyCarter_5,03-04-2017,Modern technology has fortunately provided us with many tools and apps, which can be used to improve http://pinterest.com/pin/427771664593165534/ …
vusal,03-04-2017,Snapchat's those famous filters' technology developed in Ukraine and Snapchat just bought it :) and it's serious... http://fb.me/8RUlXIFba 
mashableng,03-04-2017,Archive: #Amazon Opens Up Alexa Voice #Technology http://rviv.ly/3FL1I  #alexavoice
WebkadLife,03-04-2017,http://Webkad.com  offers services for #Entrepreneurs #leadership #career #advancement #leadership #management #healthcare #technology pic.twitter.com/kX1SPbwGEV
shgarhen,03-04-2017,Any citizens on side of Deep State are brainwashed by MSM,don't read WL,& don't understand technology. Dumbed down pop
theBLASTERRR,03-04-2017,i rly dont wanna buy apple music lmao i hate technology
Ric9871Ric,03-04-2017,Hexhog Extreme All Terrain Wheelchair http://dld.bz/e7Y27  #wheelchair #innovation #tech #technology pic.twitter.com/hWBBz1HcfT
RightGlockMom,03-04-2017,This is watch-worthy technology Angle of fall, however, doesn't seem to be addressed? https://twitter.com/nypost/status/848592115667943424 …
sensors4you,03-04-2017,One of our current mobile applications for Android smartphones. #technology #sensors #smartphone #gadgets #androidpic.twitter.com/nbjnMQxdfA
AndreeaAslan,03-04-2017,How IoT is disrupting the world around us http://bit.ly/2nYRRzq  via @rww #technology #iot
BrancesL,03-04-2017,1907:"2017 we will colonize on the moon, technology will be so advanced we are unable to comprehend how advanced it will become" 2017: pic.twitter.com/GhcDLNspJm
PekkaPuhakka,03-04-2017,#New in Pinterest: Amazing Cars and Car Technology: Nouvelle Porsche 911 GT3. http://ift.tt/2nZZgP3  - Go and see!pic.twitter.com/wmljSdx6D3
emcpebryant,03-04-2017,@USArmy adopting #wearabletech http://tinyurl.com/n5cqrf3  #technology #fitness
DNPscience,03-04-2017,#Science and #everyday #life cannot and should not be separated! Rosalind Franklin #Science #chemistry #proverb #technology #innovationpic.twitter.com/WgyxcNdEL3
Tryapp_me,03-04-2017,POV!! International Women's day event in Komar University of Science and Technology by Zhiran Taha http://ift.tt/2o02Bh6  …
MalvinsCGP,03-04-2017,I ll be hosting a twitter session tomorrow. Topic: Information Technology: Pros and Cons. Time: 8:00pm #DigitizedBadagry
PinkTie_SEO,03-04-2017,Business Owner Marketing Tips from PinkTie Technology Group - http://eepurl.com/cJkPhL 
MombasaCGW,03-04-2017,Three UNIVERSITIES risk closure Kiriri Women’s University of Science and Technology, the East African University... http://fb.me/1hKjnja8d 
FontanaVenera,03-04-2017,If You Want To Know How Technology Will Affect Your Work, Look at These 3 Long-Term Trends http://crwd.fr/2lV5Qm1 pic.twitter.com/W3gHe6D07S
Wireframereally,03-04-2017,A variety of guns, technology, and potions with plenty of boons, but also a whooole slew of calories.
sonofanickle250,03-04-2017,"Your generation is too obsessed with technology".... says the grandma who just called me to say it is my turn on @WordsWFriends.
KuglerVision,03-04-2017,This new VR technology lets you explore the insides of your own eye. #VR #tech #eye http://buff.ly/2odPvxr pic.twitter.com/45qSej0vyR
alsadary,03-04-2017,Jack Ma's latest U.S. expansion plan threatened by Trump's agenda https://www.bloomberg.com/news/articles/2017-03-31/ma-s-moneygram-deal-threatened-as-lawmakers-cite-china-concerns … via @technology
EmereoBooks,03-04-2017,Information Technology: Competing With Information Technology #informationtechnology #FreeDownload #Free #Giveaway http://buff.ly/2nsC4GL pic.twitter.com/L6M2UI865M
cientounero,03-04-2017,light scatter technology paired with MALDI-TOF mass spectrometry for rapid diagnosis of urinary tract infections https://www.ncbi.nlm.nih.gov/pubmed/28356414?dopt=Abstract …
Mysticwolf1981,03-04-2017,Allow me: "OH OH! Scorpio's compatibility with Xbox One can limit how it's technology is utilized? MS already in trouble, plus more..."
SamuelGardner21,03-04-2017,Dallas Mavericks Owner Mark Cuban: Analytics Is Now Most Overrated Technology In Sports http://www.sporttechie.com/2017/03/30/sports/nba/dallas-mavericks-owner-mark-cuban-says-analytics-is-most-overrated-technology-in-sports/?utm_source=SportTechie+Updates&utm_campaign=3a2e7540b0-SportTechie_Weekly_News&utm_medium=email&utm_term=0_5d2e0c085b-3a2e7540b0-294357157 …
HMKLegalEmpLaw,03-04-2017,Technology means employees working #longerhours http://bit.ly/1IrSXax  #NEFollowers #ImUKBiz #tweetuk #BTRTGpic.twitter.com/ekc3pWv09O
eraser,03-04-2017,Education Revolution Through Technology and Big Data - http://klou.tt/97dm5yk566z8 
Acnam,03-04-2017,Dr Thomas Mensah, one of the early innovators in smart missle technology. 7 pioneering inventions awarded in 6 years. Ghana's very own son https://twitter.com/3fo_selormm/status/848449105529622528 …
jasonhartsoe,03-04-2017,This Company Will Pay You To Relocate Wherever You Want http://dlvr.it/NnQ288  #tech #technology
THEREAL2RED,03-04-2017,You wouldn't need a Passport or Money with Free Energy Devices and Technology
jasonhartsoe,03-04-2017,Here Are All The Video Games Coming Out In April 2017 http://dlvr.it/NnQ22M  #tech #technology
movenergy2,03-04-2017,Heated pavement technology tested at Des moines International AirportEngineers are testing heated pavement... http://fb.me/1MvxofVIR 
MGTCandidates,03-04-2017,Enterprise Architect - API Development - Technology (Senior Manager Technology) - London, GBR #jobs #London pls RT:… http://dlvr.it/NnQ1Yd 
vrai777,03-04-2017,Xbox Project Scorpio unveiling tipped with Forza 7, Red Dead Redemption 2 - SlashGear https://goo.gl/fb/z8tvQp  #technology
iTunesFollowUs,03-04-2017,HCT Phone App - Higher College of Technology http://bit.ly/2o07R4m  #Education #iTunes #Music #News
readersdigest,03-04-2017,10 magical photos of what childhood looked like before technology took over: http://spr.ly/60178bgjN pic.twitter.com/X7pL8LLp4q
1337K1t3R,03-04-2017,Same with drunk driving: Everyone's against it, yet it still happens all the time. People won't change. I think only technology can fix this
meadhuntcareers,03-04-2017,We are #hiring for a Technology Systems Specialist position in US-WI-Middleton! Apply at: http://meadhunt.com/careers/career-opportunities/ …https://social.icims.com/viewjob/pt14911561114965851e …
annamacmillan,03-04-2017,The latest The Digital Health Daily Report! http://paper.li/annamacmillan/1446526912?edition_id=71031a20-17ce-11e7-8f18-0cc47a0d164b … #healthtech #technology
FutuReCybernize,03-04-2017,Chinese mobile giant Huawei reports slowest annual growth since 2011 http://ift.tt/2ooxysU  #innovation #tech #future #technology #amazing
lilsnail19,03-04-2017,Will future technology undermine human accountability?
ikkilabs,03-04-2017,#News #Technology Commission your own traffic and construction studies without ever leaving bed using SpaceKnow http://ow.ly/NDqj50aAHtD 
jdbrown239,03-04-2017,#Business #Technology #SMB 5 Ways to Fertilize Your Online Gardenhttp://ow.ly/3wns50aAHsw 
jdbrown239,03-04-2017,#Business #Technology #SMB 6 Simple Ways to Revamp Your Small Business' Online Presencehttp://ow.ly/tHkJ50aAHsx 
saracharette,03-04-2017,Why with all the technology we have in the world can we not make the lines on the roads in Calgary visible when it's wet outside??
BaretrapsShoes,03-04-2017,This sandal is both super functional and cute, complete with Rebound Technology features and a vibrant design! http://bit.ly/BaretrapsTipper pic.twitter.com/wak7VfdrEA
OnTopBln,03-04-2017,The role #blockchain technology can play in accelerating #financialinclusion New #fintech http://ln.is/georgetown.edu/nbwaM … …pic.twitter.com/AG1FGvTjlV
MGTCandidates,03-04-2017,Full-Stack Developer (Manager Technology) - London, GBR #jobs #London pls RT: Welcome to SapientNitro, where ideas… http://dlvr.it/NnQ0TL 
MGTCandidates,03-04-2017,DevOps - (Manager Technology) - London, GBR #jobs #London pls RT: *Job Title:* DevOps - (Manager Technology)… http://dlvr.it/NnQ0R3 
jasonschumaker,03-04-2017,Are you using the best collaboration technology to meet the needs of your teams? Insight via @BetaNews: http://bit.ly/2ntSuNy pic.twitter.com/pMgSu1W3g4
StressFreeKids,03-04-2017,RT @melly_mn: How to get your #child to cut down on screen time. #healthykids #technology http://thestar.com/life/parent/20 …
motorlifestylee,03-04-2017,Please RT? #cars Tesla Upgrades Role of Radar in Autopilot Technology, Says This Version May Have... http://tinyurl.com/h7zmqq7 
GatewayAZChevy,03-04-2017,#TeenDriver in your house? Check out the #Chevy Teen Driver Technology. It helps keep your driver accountable. http://bit.ly/2grNY45 
uennews,03-04-2017,RT @Edudemic: 5 Biggest Barriers to Education Technology | Edudemic - http://www.edudemic.com/barriers-to-education-technology/ …pic.twitter.com/XljUNpWSh0
manojsirsa,03-04-2017,PM . @narendramodi at Allahabad High Court: More use of technology in judiciary crucial for new India http://rediff.ly/6fblq 
AmadeusITGroup,03-04-2017,Making European tourism smarter with technology http://ow.ly/FYeo30aiELI  #ConnectingEurope
BrightsideJake,03-04-2017,Got my headphones on listening to #LDSConference in the tour van on the way to Ft. Lauderdale. Thank you technology!!!
GeekyGirlSpeaks,03-04-2017,Episode 20 – Kids Growing Up With Technology @hotpink2016 http://bit.ly/2l7ZDlE  #momlife #podcast #kidsandtechpic.twitter.com/PDY3Mh8chq
romereports,03-04-2017,Where are Christian values in technology? http://www.romereports.com/2017/04/02/where-are-christian-values-in-technology …
Vesa_Pulp_Paper,03-04-2017,Biofuels Digest: ICM drops horsepower load 50% with Selective Milling Technology update http://ift.tt/2nLrcUF  #bioenergy
privacyfutures,03-04-2017,Delighted to announce the German edition of "Technology vs Humanity" ETA July2017 For now, 38x5* reviews in ENG! http://gerd.fm/2owXcfk pic.twitter.com/EXHZJyMCq5
JamaTem,03-04-2017,at 57 inventor lithium-ion battery; at 94 glass battery! John B. Goodenough #amazing #nolimits #technology http://www.rsc.org/news-events/articles/2017/mar/goodenough-battery/ …
WendyRijners,03-04-2017,Have a great weekend! #disrupt #technology #Weekend #OpeningDay #hr #ai #iot #plans #startup #Tips #brandingpic.twitter.com/rc30y6Mary
AttechAt,03-04-2017,Ampme App Review #ATTech #AT_Tech #AndrewT https://youtu.be/YxBYmzSKgEg  #Technology #Ampme #AmpmeApp #AppReview #App #ios #Android
buttscientist,03-04-2017,we are working on that technology !!
n_ashutosh,03-04-2017,Ray Kurzweil on How We’ll End Up Merging With Our #Technology - @nytimes http://buff.ly/2nmigYL  #AIpic.twitter.com/3sDPSsPxUp
TechGeekRebel,03-04-2017,The wonders of technology! #tech #science #bigdata #mobile #innovation #awesome #app #instapic.twitter.com/UTgp2rRwK7
GrossmannPat,03-04-2017,Welsh drinks cluster announced | Food and Drink Technology http://www.foodanddrinktechnology.com/16520/news/welsh-drinks-cluster-announced/#.WMr2HFzC1YU.twitter …
GrtxNl,03-04-2017,In 1916, a New Technology for Warfare: Tanks - https://www.scientificamerican.com/article/in-1916-a-new-technology-for-warfare-tanks/ … -Innovation and discovery as chronicled in Scientific ...
Cognizant,03-04-2017,We see #cybersecurity will biggest #technology impact on business over the next few years http://cogniz.at/2nx9YcT  #tech #TheWorkAheadpic.twitter.com/gH6QM1YPDZ
TimesinEurope,03-04-2017,Old Scientist: Future technology – when to believe the hype http://dlvr.it/NnPzk7 
WCGHFoundation,03-04-2017,AutoAlert, Canada’s first pendant style medical alert help button with integrated technology that calls for help... http://fb.me/4uIaKUkdI 
BitMedia1,03-04-2017,Two law firms in Singapore and Malaysia have launched fintech practices as the growth of the financial technology... http://fb.me/5UMC5GAkZ 
Infographicb2b,03-04-2017,Variabilization of Information Technology Infographic - @VContenting #growthhacking #inboundmarketing...http://bit.ly/1Ls48lj 
Allfreechips,03-04-2017,Banana Party slots from #Casino Technology free play. #slotreview #BananaParty http://www.allfreechips.com/slots/7248/banana-party.html …pic.twitter.com/qzxeWhXVyQ
ITSMCorporation,03-04-2017,How can companies fill the evolving business needs and their demands for #IT skills? http://hubs.ly/H06XtP-0  #technology #techpic.twitter.com/S1XRMl6TBg
Lynch39083,02-04-2017,7 Ways Technology Is Impacting Modern Education https://is.gd/RFFEB0  #edtech #steampic.twitter.com/La7HRamh67
TzvetaManolova,02-04-2017,The point of technology is to improve people's lives. Right now everyone works more than most people in antiquity. It's backwards
TVWeeklyNow,02-04-2017,Exposing the dark side of technology #DarkNet http://tinyurl.com/mesz78e pic.twitter.com/ccQHyaLTHQ
CEOatdesibazar,02-04-2017,New York Post's mobile news alerts fall victim to a hack http://dlvr.it/NnPzdf  #Tech #Technology pic.twitter.com/9VBVQDdyw5
VizWorld,02-04-2017,The latest Innovation & Technology News! http://ln.is/yCEET  #artificialintelligence by #vkozacek
flaninni87,02-04-2017,Visit us: http://digitalcameraspro.com  #gadget #electronics #technology #cool #crazy ...pic.twitter.com/fXPEbQGpyL
Domenclature,02-04-2017,Have a great weekend! #disrupt #technology #Weekend #OpeningDay #hr #ai #iot #plans #startup #Tips #brandingpic.twitter.com/003VOmgfdu
cactusbuns,02-04-2017,didnt think of that .i am not technology proficient rip
ARstralian,02-04-2017,The Impact of Technology on the Customer Experience http://upflow.co/l/pJSc pic.twitter.com/fnbT3wJ1ii
KBroberg,02-04-2017,4) Technology and Brands should be considered from development stage, not integrated later #mipformats2017
journojohn,02-04-2017,Still boggles my mind that we're able, through telescope technology, to look back billions of years into our past. #CarteBlanche
openomroep,02-04-2017,#Technology Science, Technology and Space Ministry reverts to original name - Jerusalem… https://goo.gl/fb/k1vcQf 
JobsTorranceCA,02-04-2017,Long Beach #CA #USA - Information Technology Specialist - ITx2FSoftware Development Locatio... http://twib.in/l/genprBeddMba  #TORRANCE #WORK #JOB
VisionExpo,02-04-2017,Check out @NIDEKinc's robotic technology at booth MS4833! #VisionExpopic.twitter.com/ru4Y2KXI2z
momentoftru,02-04-2017,Back in 2001 - Elementary Education. Now - Business Management Technology https://twitter.com/goldenspitt/status/848408313482145792 …
balistiksmusic,02-04-2017,@wearhausinc cutting edge audio sharing technology w/ "The Wearhaus Arc"! visit http://wearhaus.com  20% OFF promo code: BALISTIKpic.twitter.com/Yrd1rSGKRY
thatjayc,02-04-2017,How Information Technology Is Beneficial http://wp.me/p5kU3q-yd  #tech
Convergent,02-04-2017,77% of financial institutions will adjust their branch strategy by increasing their investment in technology http://hubs.ly/H06TlM90 pic.twitter.com/T4WO8mXXBJ
mikekelly1095,02-04-2017,The house can be of any shape, including the familiar square shape, because the additive technology has no... http://fb.me/QXiPYDOf 
hes_everything,02-04-2017,Why does technology hate me so much
swiftinvestor,02-04-2017,A simple exercise to help get any team unstuck #technology http://bit.ly/2mqWgHP 
scott_salzberg,02-04-2017,Please don't text while the car is moving. Install hands free technology. It cheaper and smarter to drive legally and not text while driving https://twitter.com/scott_salzberg/status/848594793433255936 …
lwhitey75,02-04-2017,Modern technology eh! Should have bought a gramophone instead.
bgardnerfanclub,02-04-2017,The app crashed, that's why we were stuck outside. God bless technology.
thunderbluex76,02-04-2017,The Galaxy S8's face unlock feature might not be as secure as you think - TrustedReviews http://ift.tt/2nOG3Q1  #technology
thunderbluex76,02-04-2017,Trump's old Ferrari sells at auction for record $270000 - CNNMoney http://ift.tt/2nu0DBv  #technology
MissKatherineLK,02-04-2017,Wikileaks releases code that could unmask CIA hacking operations via /r/technology http://ift.tt/2nLm03d  #tech #new #trends
MuhammadBey,02-04-2017,New post: Gold Dredge, New Technology catches ultra fine gold Dar es Salaam,Tanzania http://www.nafassinews.com/gold-dredge-new-technology-catches-ultra-fine-gold-dar-es-salaamtanzania/ …
raywolf3rd,02-04-2017,Lack of acknowledgement of science and technology is a train wreck waiting to happen. https://nyti.ms/2oBjfkh 
aireguru,02-04-2017,New: Final Report for WP-200123: Demonstration of Low Emissions Trapped Vortex Combustor Technology (Mr. Ken… http://www.environmentguru.com/pages/elements/element.aspx?utm_source=dlvr.it&utm_medium=twitter&id=4707804 …
Manopeli,02-04-2017,Recruitment firm makes two key appointments - TravelMole http://dlvr.it/NnPwSZ  #Travel #Technology
LeicMercJobs,02-04-2017,iOS Developer - Objective-C or Swift - £25,000 - Leicester - Leicester - Oscar Technology http://jobs.localworld.co.uk/job/505330922/ios-developer-objective-c-or-swift-25-000-leicester/?TrackID=257 …
unicornhuntio,02-04-2017,Ace. @ONECampaign are looking for a Digital Technology Director http://buff.ly/2ntn0YM 
FlyByKnite,02-04-2017,Oh definitely. They have all this technology and they're scared to use it.
MiniLatchy,02-04-2017,Yep my obsession of FaZe has made it into my school life revising for a technology exam and I need to draw a FaZe logo in the exam pic.twitter.com/s4MPMtEilY
SecurityCleared,02-04-2017,Information Technology Engineer (Level 3) - The Hague, Netherlands (NL) - The Boeing Company https://www.securityclearedjobs.com/job/801819598/information-technology-engineer-level-3-/?TrackID=4128 …
Kennedy1Robert,02-04-2017,The Galaxy S8's face unlock feature might not be as secure as you think - TrustedReviews http://ift.tt/2nOG3Q1  #technology
Kennedy1Robert,02-04-2017,Trump's old Ferrari sells at auction for record $270000 - CNNMoney http://ift.tt/2nu0DBv  #technology
itjobsorlando,02-04-2017,Carpenters all levels (40 applicants needed) - Sarasota, Florida - PeopleReady #technology#ITjobs #orlandojobshttps://www.greatjobspot.com/job/6232308/carpenters-all-levels-40-applicants-needed-/?TrackID=141346 …
bohihuloryju,02-04-2017,Today’s Internet Makes It Easy to Connect To The Congress of Future Science and Technology Leaders - http://tinyurl.com/jbsrlb2  #promo
AlarmDotCom,02-04-2017,Millions rely on our technology to protect their homes & families every day: http://www.alarm.com/blog  #SmarHome #SmartSecuritypic.twitter.com/L2QE9NvhtJ
lorne_rogers,02-04-2017,20+ year business & technology leader & consultant seeks new contract/employee role-select Canada and INT'L locations! Appreciate RT! pic.twitter.com/jLdSQUunek
valrich79,02-04-2017,Sad truth about unskilled jobs- technology & automation killed them not "outsourcing" or Mexicans. https://twitter.com/peterwsinger/status/848591361653710848 …
thiccjimin,02-04-2017,I love technology
VampirSexKttns,02-04-2017,Researchers Taught This AI the Same Way Your… http://dlvr.it/NnPw7H  #ArtificialIntelligence #artificialintelligence #technology #music pic.twitter.com/0f2ZQnXE50
kiragu_john,02-04-2017,The Rise of Technology in Education Education Marketing Agency Speed Agency http://ln.is/upflow.co/l/vjUV/201/12MCR …pic.twitter.com/UpuJiF4FmQ
kevincarterESPN,02-04-2017,#popculture plus #technology equals hilariousness!!! #FinalFour #Gonzaga #TarHeelNationhttps://twitter.com/sportingnews/status/848331473652514816 …
mamma_rach,02-04-2017,OMG @BuayDubz is making me switch iPads with him because he "just can't use old technology if there's a better option"
Technew3,02-04-2017,Project Hero: New Land Rover Discovery with drone technology - Muscat Daily http://dlvr.it/NnPvqR pic.twitter.com/WyrU8YwYWt
Exec88,02-04-2017,Why China's bid to sell high-speed rail technology overseas is losing steam… https://goo.gl/fb/nnMxpJ  #chinabusiness
DanielSaulsHI,02-04-2017,Every single time we get some cool technology given to the general public be it phones, BE, anything that engages... http://fb.me/1fXRjm6tZ 
NitaiPartners,02-04-2017,AI: Back to the Future #Nitaipartners #technology #MachineLearning #AI #bigdatahttp://buff.ly/2onSTml 
broganbuchanan1,02-04-2017,I feel like I need to go to one of those spiritual retreats with no technology and then come back to reality to finish school..
LuLuLocks,02-04-2017,I opened my twitter, and this reply was all cued up! What a great little quirk of technology https://twitter.com/luannerice/status/848362901060628482 …
SABCNetwork,02-04-2017,Actress Brenda Ngxoli ( @Ngxoli) told us what her favorite piece of technology is. #MyJuicer #SABCNews
IsraelAtlanta,02-04-2017,Check out #Israel's newest technology #StartupNationhttps://twitter.com/idfspokesperson/status/848535140036947968 …
VeeShostak,02-04-2017,iPhone puzzle game Kami 2 goes perfectly with your morning coffee http://dlvr.it/NnPtXD  #Tech #Technology pic.twitter.com/gxXaevG7O9
ProfHafizAbu,02-04-2017,The Deputy Governor of Kano State also Commissioner for Education, Science and Technology, His Excellency... http://fb.me/1eqVIvOSM 
