User handle,Date of tweet,Tweet Data
uMandlakazi,02-04-2017,Some of these people outchea have technology in their phone that could send a rocket into space and they still... http://fb.me/7Te02afvU 
vkozacek,02-04-2017,The latest Innovation & Technology News! http://news.innovationsquad.co.uk/?edition_id=0adfd590-17aa-11e7-ab87-0cc47a0d1605 … Thanks to @SamHendricks10 #ai #artificialintelligence
PNGNEWSTODAY,02-04-2017,Educators learn role of technology in teaching at USP http://dlvr.it/NnL4Cy pic.twitter.com/KbYktVNNRW
doulCiOffical,02-04-2017,The latest smartwatches of 2017 – Baselworld highlights http://dlvr.it/NnL3px  #baselworld #smartwatch #Technology #Wearable_technology pic.twitter.com/yZgYnH1VLW
Dudly01,02-04-2017,Watch Behind the Scenes Technology of a Working Gas Station http://fb.me/8EfpDplXy 
Debbas,02-04-2017,MassivBrand : New Innovative Home Technology http://tinyurl.com/k5d3292  #startup #entrepreneur #interview
chadiebu,02-04-2017,I have just been awarded the "You've posted ten messages!" trophy at Pinoy Internet and Technology Forums! https://www.phcorner.net/m/chadiebuu.832659/trophies …
greytreader,02-04-2017,Food, infrastructure ,energy, technology, education, livelihoods. Nepal is better than kashmir
GeneticAll_UK,02-04-2017,Discover what your genome is and how the technology behind whole genome sequencing works http://ow.ly/pIzS30aoUtu 
IBMPartners,02-04-2017,Join #IBM Power Business Partner Technical Exchange on April 25-27 & learn more about #cognitive #technology. http://ibm.biz/SystemsExchange 
DwntwnMillburn,02-04-2017,Downtown #MillburnNJ Uses Close.By Mobile Technology to Transform How Consumers Engage With Local Businesses: http://ow.ly/Vl1530arkqB 
jake_woodhouse,02-04-2017,What to Expect of #Clean #Technology 2017 @cuffairy20 - particularly like: @terravia @CambrianInno @looptworks http://buff.ly/2otK7Dt pic.twitter.com/qgXWkfYorG
millielikesthis,02-04-2017,6 New and Notable Educational iPad Apps ~ Educational Technology and Mobile Learning https://shar.es/1QcCAe  via @medkh9
The_HoodedClaw,02-04-2017,No. It basically means that technology keeps improving n new security measures keep getting added regularly.
Alchemo_Lozano,02-04-2017,@kershaw_martin Quantum technology is almost upon us. It will serve as our "meal ticket" in order to time travel. http://listverse.com/2017/04/01/10-incredible-implications-of-quantum-technology/ …
newscientist,02-04-2017,Old Scientist: Future technology – when to believe the hype http://newscienti.st/2nZjSqu pic.twitter.com/aOSqD1ZYaV
BarbWritesEdits,02-04-2017,Why Brick-and-Mortar Retail Technology Is One of the Best Industries for Starting a Business in 2017... http://www.inc.com/bartie-scott/best-industries-2017-brick-and-mortar-retail-technology.html … via @Inc
AI_Today,02-04-2017,#AI Chinese manufacturers should embrace internet technology and artificial intelligence to survive for the long… https://goo.gl/fb/oQie6A 
AI_Today,02-04-2017,#AI The latest technology now is artificial intelligence. The importance of this technology cannot be over… https://goo.gl/fb/vEdPQ9 
AckermanCRE,02-04-2017,#Atlanta slides in at No. 3 on Forbes' list of tomorrow's #Tech Meccas. #technology #ATL #Jobshttp://bit.ly/2nr284x 
yaabot,02-04-2017,Glassify: Israeli Startup Develops Smart Beer Glass - https://goo.gl/HfnpLt  #Technology
wendyphd,02-04-2017,This is long but it's a must-read for understanding how predictive technology was/is used to influence voting beha… http://ift.tt/2kYLcSo 
GaryWeston11,02-04-2017,Korea to spend W41b won on 3D printing technology - The Korea Herald http://ift.tt/2ntyeeT 
rams_infy,02-04-2017,Pan #industrial, diversified #manufacturing #strategy enabled by #digital #technology for competitive advantage http://sloanreview.mit.edu/article/the-end-of-focus-a-new-wave-of-manufacturers-will-choose-scope-over-scale/ …
AidNews,02-04-2017,The latest The Daily AidBulletin! http://paper.li/AidNews?edition_id=a660c0c0-17a9-11e7-ab87-0cc47a0d1605 … #ethiopia #technology
TechNewsRT,02-04-2017,Superyacht built for sharing quintessential experiences at world class events http://ift.tt/2nwzUVK  #technology
SaintPetersblog,02-04-2017,Inside the car-eat-car world of self-driving technology @mercnews h/t to @MikeAllen's #AxiosAM.http://www.mercurynews.com/2017/03/31/inside-car-eat-car-world-self-driving-technology/ …
powerofhumans,02-04-2017,AMAZING! Incredible Brain Technology Allows Paralyzed Man to Move Again https://powerofhumans.com/2017/03/amazing-incredible-brain-technology-allows-paralyzed-man-move/ … via @powerofhumans
pinsoftstudios,02-04-2017,Top story: Technology company? Publisher? The lines can no longer be blurred | … https://www.theguardian.com/media/2017/apr/02/facebook-google-youtube-inappropriate-advertising-fake-news …, see more http://tweetedtimes.com/pinsoftstudios?s=tnp …
MikeFreethinker,02-04-2017,Science is life. The technology it enables is responsible for virtually EVERYTHING we use and rely on every day. https://twitter.com/tribelaw/status/848358424249327617 …
nitin_gadkari,02-04-2017,Integrated tunnel control system puts India among the few nations to have implemented the latest technology in tunnel management (5/5)
Lehmanandlehman,02-04-2017,The latest Urban Sustainability! http://paper.li/Lehmanandlehman/1298583453?edition_id=f2133ba0-1787-11e7-bf65-0cc47a0d15fd … #technology
riskinfo,02-04-2017,#InvestmentNews - Kentucky Retirement Systems Insurance Trust Fund Invests $739,000 in Micron Technology, Inc. (MU) http://ift.tt/2opomrq 
emshore,02-04-2017,"Series F — The Future of Venture Capital" via @ProductHunt http://ift.tt/2opI2LQ  #tech #product #trending #technology
QueenThrifty,02-04-2017,President Trump has left science and technology jobs vacant. Critics are concerned. http://bit.ly/2nL0paY 
KdlAzUS,02-04-2017,New Releases in Biz Finance #7: Angel: How to Invest in Technology Start... by Jason Calacanis http://amzn.to/2opGktX  #Kindle
unlimited25,02-04-2017,The latest Home-Based Business - Coffee & More! http://paper.li/unlimited25/1336477045?edition_id=77fb28b0-17a9-11e7-bf65-0cc47a0d15fd … Thanks to @succeedinmlm #technology #google
jasonhartsoe,02-04-2017,The One Thing Nobody Has Told You About The Samsung Galaxy S8 http://dlvr.it/NnL1hW  #tech #technology
FFontanot,02-04-2017,#Insurers have increasingly made technology integral to their products & business models. Will that continue?… https://twitter.com/i/web/status/848528698235944960 …
communismisgay,02-04-2017,@rubblewoman we're getting all this NEW TECHNOLOGY and NOBODY BUT MAYBE 5 PEOPLE WILL BE ABLE TO AFFORD IT
wtvox,02-04-2017,Karl Lagerfeld On Fashion And Technology https://goo.gl/IF7fum  #FashionTech #Wearablespic.twitter.com/tPt7sotabH
jasonhartsoe,02-04-2017,Ben Heck's logic gate board game http://dlvr.it/NnKzvS  #tech #technology
marianosirena,02-04-2017,RT IoTRecruiting: Legislating the #IoT http://internetofthingsrecruiting.com/legislating-the-iot … #Fintech #BigData #IIoT #Technology…
coryhofstadRT,02-04-2017,Apple’s latest iPad is the tablet equivalent of the iPhone SE: The numbers for the iPad… https://revolutionarytechnology.net/item/9352-apples-latest-ipad-is-the-tablet-equivalent-of-the-iphone-se?utm_source=dlvr.it&utm_medium=twitter … #Business_Technology
QnixSSF,02-04-2017,Ms WeiDige said he spoke to Thomas Bell Cold School Theater technology in English, recalled a video to drop Supero' night.
lauriecburns,02-04-2017,Nice day to lay in bed forever but I'm hungry thus forcing me out of bed. I don't like technology that much but I want a breakfast robot.
coryhofstadRT,02-04-2017,A Google X employee collapsed on the job, and coworkers say corporate culture is to blame: On… https://revolutionarytechnology.net/item/9353-a-google-x-employee-collapsed-on-the-job-and-coworkers-say-corporate-culture-is-to-blame?utm_source=dlvr.it&utm_medium=twitter … #Business_Technology pic.twitter.com/OjyXvcnuVF
PulseBiz,02-04-2017,"Technology makes the world a new place." -- Shoshana Zuboff pic.twitter.com/t3M5wJyTqD
FamBanijudge29,02-04-2017,Technology in coffins also?? Good network.....Must be jio4g
trutherbotgreen,02-04-2017,4 things I think will significantly change the world: cryptocurrencies, 3d printing, space elevators and evacuated tube transport technology
VolvoManhattan,02-04-2017,The 2017 Volvo XC90 offers the technology, style, and space necessary to take you on any adventure life may... http://fb.me/6e8PheWTY 
KhalidHamdan0,02-04-2017,Future Technology We Can Look Forward http://www.trendintech.com/2017/04/01/future-technology-we-can-look-forward-to-in-the-next-25-years/ … #technology #Robotics #selfdrivingcarspic.twitter.com/n0VkfKGWfN
Accomable,02-04-2017,We do love tech that enables people! Assistive technology: 5 of the coolest gadgets via @DHorizonshttp://go.shr.lc/2aqLE6M 
mhsantosa,02-04-2017,Snapseed -  Free Powerful Photo Editor App for Teachers curated via Educators' Technology via @TDOttawa http://sco.lt/8M2S9Z 
ekesunvictor,02-04-2017,Tech is actually Technology even though some people in 9ja think because they're in IT, they're the only Tech guys around https://twitter.com/cchukudebelu/status/848337433376821249 …
HLautch,02-04-2017,the perks of sharing a bathroom and modern technology pic.twitter.com/5D0mf52h86
AvareaOy,02-04-2017,Great words Russ: less technology, more focus on bussiness problems Excact what our clients told us 2014: speak less tech more business w us
WatchlistN,02-04-2017,Kentucky Retirement Systems Insurance Trust Fund Invests $739,000 in Micron Technology, Inc. $MUhttp://zpr.io/P9MNC 
CHRISVOSSSHOW,02-04-2017,Griffin Technology Premium Braided Lightning Cable #Unboxing #Review @GriffinTech http://dld.bz/f6Vns 
ChrisVossBlog,02-04-2017,#Youtube Rules - All the cool technology toys for #iPhone, iPad, Mobile etc I #Review See Cool Stuff!http://dld.bz/f8CTV 
CrowdCBoost,02-04-2017,Check out this #technology campaign! 'Boost Your Energy: A Guided Meditation' https://www.kickstarter.com/projects/1429547941/boost-your-energy-a-guided-meditation …
nitin_gadkari,02-04-2017,Tunnel has been built with latest technology so as to facilitate all weather transit between Jammu and Srinagar (2/5)
EncapsulatdSoul,02-04-2017,3D technology, printing of 3 dimension object is going to be a huge base pillar. http://www.narendramodi.in/category/quotes pic.twitter.com/H2xdczNOgV
nqlh_,02-04-2017,Lots of essays to write, thank God theres technology. I dont see me that patient to use a typewriter
UKCrowdfundWeek,02-04-2017,UK #technology #crowdfund started - 'Spirit Grille Microphones'https://www.kickstarter.com/projects/1693462596/spirit-grille-microphones …
TheEditorNews,02-04-2017,#IESnT Next-generation DDR5 RAM promises to be twice as fast as DDR4 https://goo.gl/fb/MpI9FM  #technews #technology
TheEditorNews,02-04-2017,#IESnT Ford hires 400 BlackBerry employees for connected cars work https://goo.gl/fb/FbRGtP  #technews #technology
48Growth,02-04-2017,What is #Blockchain Technology? An Easy Guide To Read http://dld.bz/eW5DU pic.twitter.com/feZ7G2OECY
ionutgitan,02-04-2017,It is one of the wonders of art that it can refuse the march of technology while defining its own modernity. #KevinFrancisGray @PaceGallerypic.twitter.com/XRrPMxCfe7
power_primal,02-04-2017,Will Technology Replace Good, Old-Fashioned Exercise? http://ift.tt/2owZb3g  #fitness #workout #health #exercise #fit
JFlexRubber,02-04-2017,How best to stir a steel furnace, and beat corrosion (via Engineering Technology News - Engineering News, Tec... http://buff.ly/2ooYeNh 
IBMIBV,02-04-2017,#Insurers have increasingly made technology integral to their products & business models. Will that continue? http://ibm.biz/insurance2025 pic.twitter.com/ZQD2XjbmFf
EdTechNerd,02-04-2017,5 Important Truths About Education Technology http://edtechnerd.us/2ooSXBB  #edtech #edchat
FETFlagships,02-04-2017,@GrapheneCA is taking #graphene technology from the lab to the fab to make a difference for #EU industry. Watch how! http://youtu.be/0jXtLhLsyvI pic.twitter.com/0b6Ai0XiY4
MichaelShankman,02-04-2017,Brilliantly showcasing the most cutting edge in interior design and lighting technology. #luxury #realestate #vegas #penthouse 702-498-3383pic.twitter.com/VpjmGipGAO
DoubleDumas,02-04-2017,By that same argument we can claim human toddlers are not related to their parents because they can't use technology equally well. https://twitter.com/DubuissonPaul/status/848393481403867136 …
gulf_intel,02-04-2017,. @AdnocGroup @Masdar sign MoUs w/ @Saudi_Aramco on #oilandgas collaboration & #sustainableenergy #technology http://bit.ly/2n1m9T9 pic.twitter.com/a6dpxv5bWe
onepixelgeek,02-04-2017,Vintage Tech: #apple #mac #macintosh #geek #nerd #photo #photography #tech #technews #tecnologia #technology #ne… http://ift.tt/2nwp9ml pic.twitter.com/dMkfbblxWj
AjobsMalawi,02-04-2017,Kochi University of Technology Special Scholarship Program (SSP) for Japanese and International Students in Japan http://dlvr.it/NnKxYJ 
raquelsterczek,02-04-2017,Spring Themed Technology Activities For The Classroom http://www.thetechieteacher.net/2017/04/spring-themed-technology-activities-for.html …pic.twitter.com/YzgxmUOipi
brute_geek,02-04-2017,Kansas House votes to condemn porn via /r/technology http://ift.tt/2oMZ6Yr  #technology pic.twitter.com/G1qqdGVuT9
ambersinha07,02-04-2017,"you cannot fix using the law what you have broken using technology." — @sunil_abrahamhttp://m.thehindubusinessline.com/blink/cover/11-reasons-why-aadhaar-is-not-just-nonsmart-but-also-insecure/article9608225.ece …
hallgregoryrec,02-04-2017,Watch a Concrete House be Printed on Site in Less Than 24 Hours! http://buff.ly/2oxcrVz  #3DPrinting #Technology #D…pic.twitter.com/x35OIfgnZE
TulaneNews,02-04-2017,. @TeamGleason never avoids a challenge, not even #ALS. He now strives to find, develop technology to live life fully http://tulane.it/2nM6lCR pic.twitter.com/JXW9VZQvG1
rlfreedm,02-04-2017,An educator with passion for technology in education. I will work with @masscue board 2 articulate our core values @anitacellucci @jdbreslinpic.twitter.com/kTvxDRLhCn
WakeTechIntegra,02-04-2017,Wake Technology Achievements and Why should you bother? Vivek answers URL:https://goo.gl/lfMckO  02 02:31:50pic.twitter.com/7qzs1Bl7vW
LipscombTrey,02-04-2017,Time to get off that dirty technology that finances terrorists and autocrats.
ASISLongIsland,02-04-2017,EmergenZ Asset Secure immediately identifies and detects assets, and sends alerts. See this technology! http://fb.me/1Zl988klG 
HomesAtMetacoda,02-04-2017,Technology is a means to an end says @RussCobb1. Look at @SASsoftware to a solve the business problem. #analytics #SASpartners #SASGFpic.twitter.com/zgXZHD3G6F
PSD_Global,02-04-2017,DesignSpark PCB tool from RS Components racks up 100,000 users ... https://www.powersystemsdesign.com/articles/designspark-pcb-tool-from-rs-components-racks-up-100000-users-via-educational-network-licence/90/11383 … #Global_PSD #technology #RSComponentspic.twitter.com/8dj06wDt9X
ambersinha07,02-04-2017,Must Read: It’s the technology, stupid | @sunil_abraham on Aadhaar and biometricshttp://m.thehindubusinessline.com/blink/cover/11-reasons-why-aadhaar-is-not-just-nonsmart-but-also-insecure/article9608225.ece …
ISTESTEM,02-04-2017,WEBINAR: Learning First, Technology Second. Click the video for a description. @isteconnects @InclusiveLN @ISTEMLN @lkolb pic.twitter.com/LUhsui03R0
MatthewDeFede,02-04-2017,Join an office that is ahead of the technology curve! Become an Executive today call me at 862-228-0554 for more... http://fb.me/18FOSBpU8 
NebtixNG,02-04-2017,Why do developers who could work anywhere flock to the world’s most expensive cities? http://dlvr.it/NnKwrj  #Mobile #Technology
antiques_atlas,02-04-2017,From Roger Waldron, Early Science & Technology 19thc #French Steam Clock #Antiques @bransbylinks #frenchclock http://www.antiques-atlas.com/antique/19thc_french_steam_clock/as172a413 …pic.twitter.com/LeNpiDX5OZ
oschabenberger,02-04-2017,Great conversation with @randyguard at SAS Partner Forum. Enjoyed sharing what technology we are focusing on #SASGF
JackMcPike,02-04-2017,Can't wait to start my HND Architectural Technology course, gonna make the most out of it #newtoCOGC
toptechticker,02-04-2017,Samsung Galaxy S8 and DeX dock: Can it make the virtual desktop a core technology? | ZDNet http://www.zdnet.com/article/samsung-galaxy-s8-and-dex-dock-can-it-make-the-virtual-desktop-a-core-technology/ …
thekeyplay,02-04-2017,TECHNOLOGY HAS GONE TOO FAR.
ISTGroup_global,02-04-2017,Industry news: Applying Academic Research and Technology: Michigan Ross and Volute Create a New Peer Feedback Fra... http://bit.ly/2opEidE 
FutureMonger,02-04-2017,Techno techno techno: how gig going in the future will be transformed by technology http://ift.tt/2ox2W8E 
laeroeth,02-04-2017,Its true. To progress we will always lose jobs in areas that supply old technology and gain jobs in new technology. #switchboardoperators
WobbMY,02-04-2017,Is business technology is your cup of tea? Join Strella as an Applications Developer now! #WOBBtheJob athttp://ow.ly/TZNl30agCKN 
foundationrec,02-04-2017,#Blog Read all about how technology is changing the FM industry! http://www.foundationrecruitment.com/news/dont-be-technophobe/ …
galwayindo,02-04-2017,Are you afraid of driving in the dark? This new technology could take away your fear http://ow.ly/QJmT30ap4Uf pic.twitter.com/tKhyIEP38t
thehealthything,02-04-2017,Will Technology Replace Good, Old-Fashioned Exercise? #fitnesshttp://www.healthline.com/health-news/will-technology-replace-exercise …
TechGeekRebel,02-04-2017,The experience of the technology we use and create is the real magic! #tech #science #bigdata #mobile #innovation #awesome #startupspic.twitter.com/jGxJbmwyP4
technews_google,02-04-2017,AT&T, Comcast Fire Back At Criticism Over Internet Privacy Policies - Huffington Post http://dlvr.it/NnKvrf  #Technology
IoTRecruiting,02-04-2017,Legislating the #IoT http://internetofthingsrecruiting.com/legislating-the-iot … #AI #IoE #IIoT #BigData #BlockChain #Fintech #InternetOfThings #Technology #Business
haileyy_annnn,02-04-2017,I told my grandma my stomach has been violently hurting since Friday & she said you may have technology syndrome. lol. Good shit.
derblauweisse,02-04-2017,Richard Gutjahr NEWTop story: Technology company? Publisher? The lines can no l… https://www.theguardian.com/media/2017/apr/02/facebook-google-youtube-inappropriate-advertising-fake-news …, see more http://tweetedtimes.com/gutjahr?s=tnp 
randyguard,02-04-2017,Great to be on stage with @oschabenberger discussing technology trends and what they mean for our partners #SASGF
TheRivetDaddy,02-04-2017,Up to 5 thousand people die every year from the 110 million landmines worldwide. http://snip.ly/xilzi  #technology
snjy_rajguru,02-04-2017,Old Scientist: Future technology – when to believe the hype http://ln.is/www.newscientist.com/PHqaK …
BusinessDayNg,02-04-2017,‘We believe a technology-driven bank branch is the future’  – Babatunde Macaulay http://ln.is/com/ofoLK pic.twitter.com/oWCNP0BDtQ
ellllexo,02-04-2017,researched the most affordable place to buy alcohol & cigarettes between mpls-chicago because I have the technology and why not
LYF_In,02-04-2017,Full HD display & 5.5 inch screen, the new WATER 7S comes with technology to get you the ultimate output #MyLYFMyWay http://bit.ly/2mIrnPb pic.twitter.com/xHxEwqBpcD
daredoevil,02-04-2017,jackson é aquele meme 'durr hburr technology is bad fire is scary and thomas edison was a witch' https://twitter.com/igot7_markp/status/848456685853188096 …
CopelandTonyD,02-04-2017,Most Marketers "Miss Sales Due to Dated Marketing Technology": http://bit.ly/2mbQgU7  via @_netimperative_
CmsEcomJon,02-04-2017,4 Old-School (Non-Digital) Habits That Help You Be Productive: With all the technology at .. #smallbusiness #smb http://dld.bz/f9fJk 
Frostbite_UK,02-04-2017,New iOS 10 – 10.2 Jailbreak Tweaks: PowerCaller, PPTPFix, EnhancedSwitcherClose, More http://ift.tt/2nNYVyn  #technology
ellenowspeaks,02-04-2017,Making use of technology for our friendship hahahahaha @jlufromDblock @beajellepic.twitter.com/f0LSdIuS0e
thentixskin,02-04-2017,#HoneyBees recognize human faces by configular processing. This discovery may one day help scientists improve facial recognition technology. pic.twitter.com/fLigJDqMim
CitlyApp,02-04-2017,Citly is available from the AppStore - it's FREE! http://citlyapp.com/  #technology #internet #appspic.twitter.com/hXzMHsJWrb
Profitinterior,02-04-2017,Drivers for #trends at #Milandesignweek: Politics, technology, environment, recycled materials and ancient crafts https://www.dezeen.com/2017/03/31/eight-trends-look-out-prediction-milan-design-week-2017/ …
Next_Retail,02-04-2017,#WhatsNEXT This latest technology makes self-lighting pixels switch off completely to achieve Perfect Black for infinite contrast #NEXT
youcerto,02-04-2017,Spread the tech! https://www.wired.com/2017/04/techs-wealthy-enclaves-hurt-country-tech/ … @WIRED #SiliconValley #technology #coding #cocoon #spreadthewealth #ComeReadEngage #youcerto
SecretlyJaron,02-04-2017,We will not build walls We will build bridges We will build schools We will build hospitals We will build technology We will build society
geek_au,02-04-2017,#Australia #Tech Apple's Control Over Its Payment Technology Retained In Australia http://dlvr.it/NnKqj4 
geek_au,02-04-2017,#Australia #Tech Pushing boundaries: Technology streamlines crime-fighting for Australia’s Border Force http://dlvr.it/NnKqb1 
geek_au,02-04-2017,#Australia #Tech Australia’s gas industry to be strengthened by technology http://dlvr.it/NnKqYn 
gfherald,02-04-2017,The Smart Farm: Big ag uses technology to grow production and efficiency http://trib.al/AwhSRhl pic.twitter.com/4md6oGxv5f
PCResults,02-04-2017,Don’t wait to build your dreams! We help small businesses succeed through technology solutions. http://ow.ly/2MQQ302tcGY  #smallbusiness
MJ_Schuler,02-04-2017,And people think technology is a thing developed through the evolution of man #donteatthatapplepic.twitter.com/QpOB47UaVD
BrianHRDSS,02-04-2017,The Role Technology Can Play In Employee Experience: What you select is critical - The Human Resources... https://tmblr.co/Zgetok2KBlSo5 
wahibhaq,02-04-2017,The quality of Technology articles on @stratechery is just too good. Highly recommend to follow!
amer1canhero,02-04-2017,I liked a @YouTube video http://youtu.be/zIc6IcIm81M?a  DF Live at Rezzed 2017: The Future of Gaming Technology!
HomesAtMetacoda,02-04-2017,Lots of investment and planned on the @SASsoftware technology roadmaps for 9.4 AND #SASviya @oschabenberger #SASpartners Forum #SASGFpic.twitter.com/fbyb92KAtM
TechNewsRT,02-04-2017,Easily colorize your neutral background in Photoshop http://ift.tt/2opFz3S  #technology
TechNewsRT,02-04-2017,Organize your thoughts with this list of the 10 best mind-mapping tools http://ift.tt/1l5ZuNN  #technology
martinbentham,02-04-2017,Technology company? Publisher? The lines can no longer be blurred | Emily Bell https://www.theguardian.com/media/2017/apr/02/facebook-google-youtube-inappropriate-advertising-fake-news?CMP=share_btn_tw …
deviantglobal,02-04-2017,"Modern technology offers an endless field day to any deviant strains in our personalities." -JG Ballard, CONCRETE ISLAND
TAAForum,02-04-2017,Aircraft Top Amazing Stories of Airplane Technology – Aviation News TV. http://transaustralianairlines.com/index.php/2017/04/02/aircraft-top-amazing-stories-of-airplane-technology-aviation-news-tv/ …pic.twitter.com/iJ3PGPwzz2
Holuwafunmike4,02-04-2017,Nigerian scientist advances technology to convert urine into gas — News and World News – The Guardian Nigeria http://t.guardian.ng/news/nigerian-scientist-advances-technology-to-convert-urine-into-gas/?F … --
CarConcerns,02-04-2017,Car Concerns Radio USA Reporter! is out! http://paper.li/CarConcerns/1346541777?edition_id=6f816de0-17a7-11e7-8f18-0cc47a0d164b … #autos #technology
TrendsFM,02-04-2017,WeChat Is Extending China’s School Days Well into the Night - MIT Technology Re… https://www.technologyreview.com/s/600943/wechat-is-extending-chinas-school-days-well-into-the-night/ …, see more http://tweetedtimes.com/futuristwatcher/futurists?s=tnp …
CEOatdesibazar,02-04-2017,Aerial footage shows avalanche of mud in major Colombia floods http://dlvr.it/NnKmwV  #Tech #Technology pic.twitter.com/fg8QabBWcb
artofserviceIT,02-04-2017,SAP LO: National Institute Of Standards And Technology #saplo #FreeDownload #Free #Giveaway http://buff.ly/2nyyH2F pic.twitter.com/jH4kn7nF9L
PaddiiB,02-04-2017,#carsandcoffee #dundalk #dkit #coffee #cars @ Dundalk Institute of Technology https://www.instagram.com/p/BSYmyCXBj6K/ 
rautsan,02-04-2017,With #cognitivecomputing technology you can stop #insiderthreats before they happen. http://buff.ly/2omzODQ  RT @dreasoning
jacq_mccarthy,02-04-2017,I think we need to find ways to connect science, math, writing, reading, and technology more in the school day. #sunchat
robinsnewswire,02-04-2017," #Technology News: Why #Apple is redesigning the next iPhone, in 1 simple diagram" #News: http://www.robinspost.com/news/technology-news/daily-technology-news/503879-technology-news-why-apple-is-redesigning-the-next-iphone-in-1-simple-diagram.html …
robinsnewswire,02-04-2017," #Technology News: Samsung Galaxy S8 first to get rip-roaring wireless speeds" #News:http://www.robinspost.com/news/technology-news/daily-technology-news/503881-technology-news-samsung-galaxy-s8-first-to-get-rip-roaring-wireless-speeds.html …
