User handle,Date of tweet,Tweet Data
realsammyE,13-04-2017,Giveaway: Enter to win a trip to Disrupt NY 2017 https://techcrunch.com/2017/04/12/giveaway-enter-to-win-a-trip-to-disrupt-ny-2017/?ncid=rss … #technews #technology pic.twitter.com/qZPL1fMMVK
technology,13-04-2017,Bezos says artificial intelligence will fuel Amazon's success https://bloom.bg/2oAczpD pic.twitter.com/z8ij1063oE
rodbishop15,13-04-2017,Japanese population set to halve from 110 to 55m by 2065. Solving it by technology, not mass immigration. #AlternativeSolutions
timesofindia,13-04-2017,UK offers defence technology to India for making weapons http://toi.in/JaHrcZ40 pic.twitter.com/5Mu1qgcC5s
RafaelH117,13-04-2017,All four Champions League quarterfinal matches featured big officiating mistakes, technology has to be implemented as soon as possible.
rodbishop15,13-04-2017,If the technology experts are right & 40% of jobs will be lost to robots over next 20 years, why do we need to import 400000 people a year
CloudShep,13-04-2017,P.s If you have any questions IT, Cloud or Technology related this evening or in the next couple of days, just shout #MidlandsHour
iamcarljones,13-04-2017,Charlie Was So Brilliant! The Boondocks - Ed & Rummy On Stupid Technology https://www.youtube.com/watch?v=24CQJvzmWHI&feature=share …
IndigoLFC,13-04-2017,Video technology on big decisions won't kill the game, it'll save many
tjblfc,13-04-2017,#AtlLei For EUFA and FIFA to keep accepting poor officiating can only mean bribery is involved at the top levels. Technology exists use it.
MarshaCollier,13-04-2017,11 Female Inventors Who Helped Power The Information Age #technology http://bzfd.it/2p96WMT 
TheEconomist,13-04-2017,Could technology ease a looming labour shortage in the health-care industry? #factoftheday http://econ.st/2nYie56 pic.twitter.com/yiCv4wgnbI
TitusAya,13-04-2017,A1: Between technology reducing how often we practice manners, stress, and diversity without inclusion, it's no surprise #nextchat
PorathC,13-04-2017,1. #1 reason people say they’re uncivil is #stress. Technology, globalization, and generational differences also contribute. #nextchat
AnsonMcCade,12-04-2017,#Fintech Five ways technology has redefined finance #AI #bigdata #blockchain #DLT #digital #roboadvisor #tech http://buff.ly/2p6A7Dk pic.twitter.com/yohAlkspd2
MarshaCollier,12-04-2017,Microsoft finally says goodbye to #Windows Vista #technology http://bit.ly/2nD9wxy pic.twitter.com/7V6K0Puxp3
SmartCNation,12-04-2017,"We need real time data driven technology approaches to gauge the impact of financial literacy." - @tedgonder #FinLitSummit
Steemit,12-04-2017,Decentralization is only a means to an end, how can we protect human rights through #technology? @Steemit http://buff.ly/2p5sAoe pic.twitter.com/53fFd3wU7a
wef,12-04-2017,After replacing 90% of employees with robots, this company's productivity soared http://wef.ch/2nELsKM  #technology pic.twitter.com/fwKl1yJOlz
roe_devani,12-04-2017,Watching a live open heart surgery @ BTHS. Great opportunity through new technology. @EastGuernseypic.twitter.com/pj2DWh1w19
wef,12-04-2017,We're closer to robots than you think. Intelligence could be a product of a basic algorithm http://wef.ch/2oUUqQa  #technology pic.twitter.com/6Q4nR28g23
sfeldman0,12-04-2017,Cloud Technology in Home Security Is Not Just IoT | @CloudExpo #IoT #M2M #Cloud http://dlvr.it/NsrPdG pic.twitter.com/JYF9wW51dQ
hudsonhead,12-04-2017,Tell me @ATT with so much technology why do I have to tell my story over every time you transfer me? 3 times today #customerexperience
HoltChris,12-04-2017,Goal-line technology will be used in the Championship play-off semi-finals, the EFL have confirmed today
michellewoviedo,12-04-2017,The stack doesn't start with the technology you'll use, it starts with what you're trying to do with the customer. @gradconn #unenterprise
PhilHayYEP,12-04-2017,EFL will use goalline technology in this season's Championship play-off semi-finals. Due to be introduced across the league next season.
jonathanl50,12-04-2017,EFL announces goal-line technology will be used in this season's @SkyBetChamp play-off semi-finals #readingfc
NHSEngland,12-04-2017,£70 million #MentalHealth fund for digital access & care support. Remote, mobile & assistive technology. http://ow.ly/oZSu30aNG8I  #FutureNHSpic.twitter.com/pzUqnb9s3y
UASSWFIELD,12-04-2017,Technology has come a long way! Looking forward to learning new methods for our DL students! #SWDE2017 #socialwork @UA_SocialWorkpic.twitter.com/iltUsKhijQ
sprynmr,12-04-2017,also “our military technology is the best by a factor of five…” “our military is heavily depleted and in shambles.”
Steemit,12-04-2017,Using Graphene For Flexible OLED Displays @Steemit #Technology #Graphene http://buff.ly/2nE4C3H pic.twitter.com/0TEAjo2ZJC
ASUS,12-04-2017,#HarmanKardon technology sound on #ZenBook UX430 will amaze you!pic.twitter.com/0aaA8y8lHZ
OwnRules,12-04-2017,"Ben Carson" trapped by modern technology, explains his ordeal: "Elevators have buttons? Who knew!" said Dr Carson, utterly bewildered.
DeepLearn007,12-04-2017,#Fintech Five ways technology has redefined finance #AI #bigdata #blockchain #DLT #digital #roboadvisor #tech http://www.deccanchronicle.com/technology/in-other-news/120417/five-ways-technology-has-redefined-finance.html …pic.twitter.com/jBm8vAPhrR
AskAnshul,12-04-2017,Yes, Britain today offered technology transfer for co-production of military platforms & weapon systems. Credit goes to Modi's Make in India
ATEKAssetScan,12-04-2017,Business model innovation is key to delivering value, not just technology #BIF #SaulKaplan #BIF #innovation http://ow.ly/ZHMx30aLzPZ 
procom2017,12-04-2017,Techlogix provides technology development teams to assist companies through the product life cycle #VentureDiveProcom17 #MergingDimensions
procom2017,12-04-2017,TPS is the technology behind Telenor Pakistan #VentureDiveProcom17 #MergingDimensions
procom2017,12-04-2017,CEE Solutions provides solutions by digitizing your problems through information technology #VentureDiveProcom17 #MergingDimensions
techeblog,12-04-2017,AeroMobil unveils production flying car that will hit the skies and streets this year. http://www.techeblog.com/index.php/tech-gadget/aeromobil-unveils-production-flying-car-that-will-hit-the-skies-and-dealers-this-year … #gadgets #technology #carspic.twitter.com/K3S5Scuu44
procom2017,12-04-2017,PCWorld is an authoritative resource for technology-related entertainment, news and culture. #VentureDiveProcom17 #MergingDimensions
PyramidEU,12-04-2017,An in-depth overview of the use of Data #Analytics Technology in the Public Sector. http://okt.to/RMfAy2  #IoT #BigDatapic.twitter.com/k0iBmLrbuZ
IrfanPathan,12-04-2017,Fantastic to be associated with @PitchVision cricket technology that will help us groom upcoming cricketing talent #CAPatPortBlairpic.twitter.com/ojeekOIbtU
dez_blanchfield,12-04-2017,Understanding the Rapid Changes in Technology => http://buff.ly/2nDujRO pic.twitter.com/r6hO3bwwpk
TechGeekRebel,12-04-2017,How technology has become to entrenched in our society today it is as vital as air to our lungs! #tech #science #bigdata #mobile #innovationpic.twitter.com/vnbgDdHA9k
Forbes,12-04-2017,CenturyLinkVoice: How technology helps small accounting and financial firms http://on.forbes.com/60138jv2L pic.twitter.com/wIJEP0qL2u
MomsBlogg,12-04-2017,Children are currently spending more time with technology than they do in school or with their family pic.twitter.com/ti99TX8q8I
HSRC_CeSTII,12-04-2017,Minister of Science and Technology @NalediPandor giving a media briefing. #SAresearchmatters
drfazal,12-04-2017,What is #IP-backed #finance? via @metispartners #technology #patent #lien #startup #capital #funding #loan #security http://metispartners.com/ip-basics/what-is/ip-backed-finance/ …
procom2017,12-04-2017,@Cee_Solutions provides solutions by digitizing your problems through information technology. #VentureDiveProcom17 #MergingDimensions
lilidumitrache1,12-04-2017,How can cities leverage innovation & technology to help improve lives? http://tinyurl.com/n7c7fon pic.twitter.com/JY13Q8OMC2
_summerparreira,12-04-2017,wish I grew up before technology was to the point where everyone always knows where you are, who you're with, and what you're doing
SoftappTutorial,12-04-2017,#earn #paypal #Paytm #Cash #money #MoneyTips #tech #technology #papalcash #paytmcash • Earn PayPal Money in Android https://youtu.be/9o8bADex_1c pic.twitter.com/emzJiRavF9
IntEdToday,12-04-2017,Technology has provided tools for learning for centuries. http://buff.ly/2o0Xvh0  #edtechpic.twitter.com/tMcssnTZx8
soymlk_03,12-04-2017,My tongue technology will send you to Hong Kong pic.twitter.com/qkCFgWWk2X
seurrene,12-04-2017,irene and technology are not meant for each other lol pic.twitter.com/JMp0S5UhK0
Neomatrix02,12-04-2017,Russia wants India’s EVM technology for their 2018 presidential election.. What will AAP and... by #HinduRajyampic.twitter.com/BxD1sgTHAt
chennaistpi,12-04-2017,Director STPIC delivered keynote address on S/w Exports-Facilitation by STPI at RBI's FEMA event-Technology Initiatives through EDPMS/IDPMS. pic.twitter.com/3rcnijhuaq
techeblog,12-04-2017,#HTC Vive smartphone takes #VirtualReality and augmented reality experiences to the next level. http://www.techeblog.com/index.php/tech-gadget/htc-vive-smartphone-takes-mobile-virtual-reality-to-the-next-level … #gadgets #technology pic.twitter.com/2ZIuGCLmbI
craigbrownphd,12-04-2017,Middle East’s Uber-like service adopts facial recognition technology: Ride-hailing service is… https://goo.gl/zbgMPR  #EmergingMarkets#IoT
katherin_gon9,12-04-2017,Technology is killing romance
milesweb,12-04-2017,One of the great things about technology is that it makes the wasting of time so much easier. pic.twitter.com/UoZzR2i189
ValaAfshar,12-04-2017,10 years of technology consolidation pic.twitter.com/U7zPGsTM6i
kellyroosve,12-04-2017,Alone Together: Why We Expect More from Technology and Less from Each Other (Unabridged) - ... #Technology https://goo.gl/fb/DqDHRv 
IoTRecruiting,12-04-2017,Great #Quote #AI #IoT #IoE #IIoT #BigData #BlockChain #Fintech #InternetOfThings #Technology #Business #ArtificialIntelligence #DeepLearningpic.twitter.com/SNC8TCWnmq
emfvet1,12-04-2017,Technology changes maybe how we do things changes, but one thing remains constant. PATRIOTISM! pic.twitter.com/WaHdTk6RkP
mfczap,12-04-2017,Plenary panel starting now! Fingers crossed the technology gnomes smile on our enterprise… http://youtu.be/mXPyMQ9PEwo  #WSTC3pic.twitter.com/jXH9D7Cw39
trutherbotwhite,12-04-2017,Technology must be used to liberate the individual.
A_Fizzle_daTrue,12-04-2017,David: "I burnt off my whold hand.". Tamela: "So how'd you get your hand back?". David: "Technology.". Can't make this stuff up. #TheManns
Kramed3,12-04-2017,My daddy is the WORST with technology #TheManns
SnapMunk,12-04-2017,Animated VR Is Changing Family Television: The Technology Behind The Groundbreaking 'Raising A Rukus' https://snapm.uk/2owqHjR  @VRcompanypic.twitter.com/ZWxGUEpdBD
KNUST_Live,12-04-2017,David Dannah is the President-elect of Kwame Nkrumah University of Science and Technology #KNUSTLive #KNUSTDecidespic.twitter.com/qlgExQCW7m
MrLXC,12-04-2017,Technology, man. So much win! pic.twitter.com/bIbsdOxfzf
Forbes,12-04-2017,How Jessica Lin is helping build the next generation of enterprise technology startups with venture capital: http://on.forbes.com/60128jQZn pic.twitter.com/gsYQb13qB4
pijamasquad,12-04-2017,Fox Searchlight’s celebro una premier especial de GIFTED en el New York Institute of Technology. @FoxPuertoRico @GiftedtheMovie @ChrisEvanspic.twitter.com/kpuCyYo8Er
Manville54,12-04-2017,Do our border controls have the staff and technology to properly control and maintain migration figures
AswaniTed,12-04-2017,Social media is not about the exploitation of technology but service to community. #GainWithXtianDela
kiff_7,12-04-2017,THIS JUST IN: Otterbein University sues ultrasound technology for assuming the gender of billions of babies
GoldenWayMedia,12-04-2017,#digitalmarketing packages ideal for #ecommerce & #marketleaders http://golden-way-media.com/pricing/  #SEO #socialmediamarketing #technology pic.twitter.com/aTevuG1yzD
WordNerdG,12-04-2017,Mrs.G getting her game on @BuffettMagnet @TechTolliver #gamification #technology #FUNpic.twitter.com/m4dWTC7xQp
FanaNqayi,12-04-2017,Still the best soapie in S.A the level of technology on this soapie #GenerationsTheLegacy
technology,12-04-2017,Tesla passes GM to become America's top-valued carmaker https://bloom.bg/2p2cegk pic.twitter.com/bOebpjVdsq
lukew,12-04-2017,the job: make humans happy by empowering them w/ technology that you (not them) manage/wrangle/make work. pic.twitter.com/5oY49M5RFP
CT_Emz,12-04-2017,I can't believe they used a drone to find Nolwazi....i salute technology #GenerationsTheLegacy
RolandDickeyJR,12-04-2017,3 ways technology can lower food costs https://www.fastcasual.com/blogs/3-ways-technology-can-lower-food-costs/#.WO0b_3xgxpc.twitter …
IoTRecruiting,11-04-2017,Predictions for the IOT in 2017 https://www.linkedin.com/pulse/predictions-iot-2017-bill-mccabe … #AI #IoT #IoE #IIoT #BigData #BlockChain #Fintech #InternetOfThings #Technology #ARpic.twitter.com/uxPOHtUGGW
Sharpee2,11-04-2017,Got to witness robotic mowers today at @Vgclinks Hard to explain how cool this technology is. #gamechanger @TJayC17pic.twitter.com/qrCjODRXLH
webzuerich,11-04-2017,"Illustrations make the user feel at ease with the technology" - @simonraess @herrkranz @ginettateam #webzurich
wef,11-04-2017,This algorithm helps robots understand you when they're confused http://wef.ch/2p1Ubqc  #technology pic.twitter.com/ZqwVeq66nN
TXInstruments,11-04-2017,Head-up displays powered by @TI_DLP technology are coming to the new @LincolnMotorCo Continental. See it in action: http://ow.ly/SrwU30aLpb8 pic.twitter.com/sspLZOy10l
h12dvy,11-04-2017,Excellent day sharing technology ideas with Sheldon James and his team at Servest HQ in Johannesburg. pic.twitter.com/X6JryjzgZG
JohnFromCranber,11-04-2017,How Has Radical Islam Become Such a Threat to Western Civilization? Because They Use Our Technology, Generosity + Complacency Against us
lifeboathq,11-04-2017,Technology|Canada Tries to Turn Its A?I. Ideas Into Dollars http://lifeboat.com/blog/2017/04/technologycanada-tries-to-turn-its-a-i-ideas-into-dollars …pic.twitter.com/lKYDoy8zIh
MCarter_68,11-04-2017,RT to help someone win #Million #Dollar for solving #WOMEN’S #SAFETY #XPRIZE. #herox #challenge #technology #IoThttp://www.HeroX.com/safety 
jefderoode,11-04-2017,Technology is finally able to make me cool. pic.twitter.com/TCjuJInuqm
RakgadiKoolKat,11-04-2017,Jerr it's 2017 and dishes still can't wash themselves like c'mon technology c'mon pic.twitter.com/O5R2f4g8MZ
IoTRecruiting,11-04-2017,What is #BigData ? https://www.linkedin.com/pulse/what-big-data-bill-mccabe … #AI #IoT #IoE #IIoT #BlockChain #Fintech #InternetOfThings #Technology #Business #Cognitive #ARpic.twitter.com/fWIeQNxtbY
docmmiller,11-04-2017,Helping preemie #babies post asphyxia using tool from weather forecasting! Wavelet analysis #technology http://bit.ly/2ppP93F  @NolwennGerpic.twitter.com/a9ICxzBiX7
LeonardoDefence,11-04-2017,Here's a glimpse of #Leonardo's technology on board of the @Eurofighter_1 #Typhoon http://www.leonardocompany.com/en/-/500-eurofighter …pic.twitter.com/hoOfDpHikS
Cereals_Canada,11-04-2017,Jim Blome- people will wait in line for the latest smart phone, but are afraid of technology with food #sustainability #innovation #cgcs17pic.twitter.com/TpfjmwIuk1
marcus_franck,11-04-2017,Looking to feature businesses that have gone green and/or use renewable technology! Get in touch #journorequest #prrequest
KneWKeeD,11-04-2017,This ground breaking technology is just icewater that has travelled abroad and bagged 2 PhDs pic.twitter.com/aFTTuaCcYA
NIRPUmbrella,11-04-2017,Bentley used NASA technology to take a 53 billion pixel photo of one of their cars on the Golden Gate Bridge. pic.twitter.com/J9aCEquOP5
SenSanders,11-04-2017,In a competitive global economy, with rapid changes in technology, we must make public colleges and universities tuition-free.
UberFacts,11-04-2017,Steve Jobs did not let his kids use iPads and limited their use of technology to a minimum.
iMillerPR,11-04-2017,. @PlasmaAir technology installed @luckydogcasino improved the #IAQ and reduced customer complaints. http://ow.ly/cf2w30aLltm pic.twitter.com/tuDzi2jd9k
ladyermintrude,11-04-2017,'Your username or password is incorrect' FFS surely technology has moved on enough so you can tell me which one it is???!!!
melriley15,11-04-2017,Just using technology in class is not a 21st century skill. Tech should be used to enhance 21st century skills. @anjuliahooja #edutech17
TheMSUSpokesman,11-04-2017,OVO @justinalexanduh recalls the latest Presidential Speaker Series on technology and our roles in. Watch & read! http://www.themsuspokesman.com/2017/04/10/the-future-of-tech-and-your-role-in-it/ …pic.twitter.com/zlx1RaD0nd
tracyrosen,11-04-2017,Bridge between child and curriculum is technology? No. It's teachers! Technology can amplify this relationship. Sometimes #edtech #EduTech17
Janus_Token,11-04-2017,We use have used #blockchain technology to boost traditional business efficiency for years. #Janus $NXT $ARDR https://www.nxtfoundation.io/janus-nxt-foundation-supporter/ …pic.twitter.com/Eo4hk9D9dh
IoTRecruiting,11-04-2017,What is #Cognitive #Computing & What Can it Do for Us? https://www.linkedin.com/pulse/what-cognitive-computing-can-do-us-bill-mccabe … #AI #IoT #IoE #IIoT #BigData #BlockChain #Fintech #Technology pic.twitter.com/caI0hRtirj
_CatherineAllen,11-04-2017,Wow, Disney have filed a patent for drone technology that'll be able 2 use light 2 make 3D,moving objects in the sky https://www.patentyogi.com/latest-patents/disney/disney-drone-technology-episode-1/ …pic.twitter.com/9U3RAGW2Mq
StarbaseCo,11-04-2017,By using Starbase platform, you can find a marketing person, technology specialist, moreover, translator, and so on. #blockchain #startup
jodidetjen,11-04-2017,Apple CEO Cook says 'US will lose its leadership in technology' unless more women are hired #womenintech http://buff.ly/2ojK6UK pic.twitter.com/GTXMhiZyUu
GavinDHFT,11-04-2017,Delighted to be hosting the #scan4safety networking day @DerbyHospitals Bar-coding technology to keep patients safe. pic.twitter.com/qze7ET7ozW
SLucasGroup,11-04-2017,We are proud to be a technology partner with @McLarenF1. What a privilege! #F1pic.twitter.com/CQq9R6pX3y
pmln_org,11-04-2017,Under PM Laptop Scheme, HEC and Overseas Technology signed an MOU and for the first time in Pak for online courses across Pak @leilakhanpic.twitter.com/sAzSPN7qNz
wef,11-04-2017,The robotics revolution is coming. Should economists be worried? http://wef.ch/2oQp0KV  #technology pic.twitter.com/Pfdbcl6iCk
estimeo,11-04-2017,@DJ44, First US Chief Data Scientist appointed by @BarackObama "how to make #data technology work for us and not against us" #LeadersParispic.twitter.com/63bwYdu0ya
BourseetTrading,11-04-2017,"4 billion years of #technology in one infographic" http://www.businessinsider.com/4-billion-years-of-technology-in-one-infographic-2017-2?utm_content=buffer05a45&utm_medium=social&utm_source=twitter.com&utm_campaign=buffer … #AI #ML #IoT #BigData #defstar5 #makeyourownlane #Mpgvippic.twitter.com/GBos3PWP5J
Sanemavcil,11-04-2017,Other Worlds #VirtualReality Arcade Opens in London #VR #Cool #Technology #AR #AugmentedReality #Gif: @sanemavcil http://thenerdstash.com/first-virtual-reality-arcade-london/ …pic.twitter.com/zr71cWJRvY
craigbrownphd,11-04-2017,Reality Check: The 5G impact on mobile operators and enterprises: 5G technology is set to… https://goo.gl/F2jV7J  #5G #IoT #5GWorldpic.twitter.com/vCHsCfeR2q
aureljared,11-04-2017,don't you DARE school me that i don't need technology to survive school because YOU didn't have to make VIDEOS and code APPS in high school
Imported_Fun,11-04-2017,Technology to wipe out truth is now available. Not everybody can afford it but when the cost comes down, look out! »Bob Dylan @bobdylanpic.twitter.com/ea2yWcRlr9
gritika123,11-04-2017,#Marketing #marketingtips # business #makeyourownlane #defstar5 #GrowthHacking #technology pic.twitter.com/uvLQmJGbe8
kindofwater,11-04-2017,This just in: maybe the left can talk about technology without the work of an overheated space cadet turned racist from the late 90s?
Schoolzine,11-04-2017,“Technology won't replace great teachers but technology in the hands of great teachers can be transformational.” George Couros #Schoolzine
scciindia,11-04-2017,Komatsu genuine coolant is formulated for use in KOMATSU Vehicles. used technology in advanced ethylene glycol-based https://goo.gl/lFuH7c pic.twitter.com/mLtIvKzurN
RChilli,11-04-2017,It’s technology’s world and we’re just living in it. #Technology #HRsoftware #Innovation #Automationpic.twitter.com/h8In6x9MHT
craigbrownphd,11-04-2017,Qualcomm countersuit claims Apple ‘refuses to acknowledge’ the value of its technology https://goo.gl/d6J6GY  #5G #IoT #mobilepic.twitter.com/QIjhLIgAuE
XenusLuv,11-04-2017,Sometimes I wish I was in the CIA so I could know top secret things like latest surveillance technology or if the Drake vocals came in yet.
IoTRecruiting,11-04-2017,What’s Coming in 2016 #IoT Devices? http://internetofthingsrecruiting.com/whats-coming-in-2016-iot … #AI #IOT #IoE #IIoT #BigData #BlockChain #Fintech #InternetOfThings #Technology pic.twitter.com/dPDdevRsjo
ideaasgandhii,11-04-2017,Modern technology has made killing so easy that millions of innocent people can be murdered in seconds.
valuablequotees,11-04-2017,For a successful technology, reality must take precedence over public relations. - Richard Feynman
spotthereedus,11-04-2017,Norman Reedus goes undercover in 1952 to try out the latest in dirt-busting technology. @wwwbigbaldheadpic.twitter.com/3YKmxtV10w
Mr343alex,11-04-2017,Look up to the sky active technology
NBharuka,11-04-2017," INNOVATIVE IDEAS , AMAZING TECHNOLOGY " pic.twitter.com/S0GJTOvJNN
cmacckjr,11-04-2017,Happy to announce that I have decided to attend Rose-Hulman Institute of Technology to continue my academic and athletic career @rhitsportspic.twitter.com/QjMqVDCwfM
UltimateUploads,11-04-2017,#youtube #android #Androidgames #tech #technology #video • Best 5 Puzzle Games for Android https://youtu.be/FX4XSzadrrE pic.twitter.com/pX0e0b18UF
nateidk,11-04-2017,it's crazy how Earth looks exactly like Google Earth... technology is amazing pic.twitter.com/DlB5plrXus
IoTRecruiting,11-04-2017,The History of #IoT http://internetofthingsrecruiting.com/the-history-of-iot … #AI #IoE #IIoT #BigData #BlockChain #Fintech #InternetOfThings #Technology #Businesspic.twitter.com/wDgre9eqHv
Forever_Lucid,11-04-2017,Anti-white speech should be punishable by the revocation of all modern technology in possession of the offender invented by the white man.
shanice_poitra,11-04-2017,Technology is awesome, but it ruins a lot when it comes to "dating" in today's day and age. pic.twitter.com/LKxpdwrbPz
blogparser,11-04-2017,Popular Pays raises $3.1M in new funding to connect marketers and creators #Technology https://www.blogparser.com/popular-pays-raises-3-1m-in-new-funding-to-connect-marketers-and-creators/ … pic.twitter.com/KNGikD42ZB
MomsBlogss,11-04-2017,Children are currently spending more time with technology than they do in school or with their family pic.twitter.com/u6vT9yFxDg
technology,11-04-2017,Tesla passes GM to become America's top-valued carmaker https://bloom.bg/2okJYmc pic.twitter.com/ngDCGrwy9W
IoTRecruiting,11-04-2017,What is the #InternetOfThings Being Used for Today? http://internetofthingsrecruiting.com/55  #AI #IOT #IoE #IIoT #BigData #BlockChain #Fintech #Technology pic.twitter.com/4rnhSLOtTo
LisaDaleyVO,11-04-2017,Control your home with Jedi mind tricks http://cnet.co/2nrl3zW  #tech #gadgets #technology #voiceover #freelancingpic.twitter.com/XtNswlu6v4
mtacomputingltd,11-04-2017,If only there was some technology they could use to stop cheating scum like Townsend.
ahencyclopedia,11-04-2017,How Nasa #technology uncovered the 'megacity' of #Angkor. https://www.theguardian.com/cities/2016/aug/16/lost-cities-6-angkor-wat-nasa-technology-khmer-megacity … #Cambodiapic.twitter.com/O8bmcv3LgS
IoTRecruiting,11-04-2017,#InternetOfThings is No Longer A Futuristic Concept http://internetofthingsrecruiting.com/the-internet-of-things-is-no-longer-a-futuristic-concept … #AI #IOT #IoE #IIoT #BigData #BlockChain #Fintech #Technology pic.twitter.com/AnB1yQArJm
iambeckyg,11-04-2017,Beautiful day today. A break from technology really does you good. I feel great.
AdsOuttaContext,11-04-2017,With gender equality achieved in the science and technology sectors, feminist educators set their sights on the lawnmower gap pic.twitter.com/br3MtltMhH
joe_pelech,11-04-2017,Gazprom is too BIG to have Syria AND Crimea. Support Ukraine's Crimea, trade Syria, and protect Eastern Europe. OPEN H2O technology. pic.twitter.com/GNCpYW54da
IoTRecruiting,11-04-2017,Wearables – Continuous Growth in the #InternetOfThings http://internetofthingsrecruiting.com/wearables-continuous-growth-in-the-internet-of-things … #AI #IOT #IoE #IIoT #BigData #BlockChain #Fintech #Technology pic.twitter.com/O1VNFdirUg
narendramodi,11-04-2017,Issues ranging from economic ties, education, science, technology, maritime sector & energy came up for discussion with PM @TurnbullMalcolm.
NPR,11-04-2017,A power plant in Texas makes a play for the "clean coal" market, using carbon-capture technology — and natural gas http://n.pr/2ors1nZ pic.twitter.com/BH2xBiZ6i9
PNNLNatSec,10-04-2017,“Women are changing the world with their careers in science and technology” Nicole Nichols #womenintech #womeninSTEM http://youtu.be/1QPBn4yCd4Q pic.twitter.com/B1sfHe8y1L
