User handle,Date of tweet,Tweet Data
lmfaolerner,03-04-2017,Here l am minding my own business and trying not to die from the flu and Jon just hands me Grayson and tells me he's had him all night so
Baruch_Labunski,10-04-2017,WOW @JohnMu @methode https://www.youtube.com/watch?v=CqdIUy5JF-E … you have to correct the false information. Google is not putting anyone out of business. @cnn
DrugsMedia,08-04-2017,She clearly trusted you and you go put her business out on twitter, you fake af. https://twitter.com/killer_kye/status/850317450738577409 …
aek440,03-04-2017,http://www.cloaklinks.com/join/alexcampain … Top 5 Small Business Ideas for Women
beatzzzzzzzzz,03-04-2017,They don't need to know all of my business
_chloemorton,04-04-2017,At this age you would think people would wise up and mind their own business. What the fuck is wrong with people talking shit nowadays
business,09-04-2017,After its worst peacetime attack, Sweden strikes a defiant tone https://bloom.bg/2od0bLC pic.twitter.com/j48utEvfmL
RadioMy,03-04-2017,Advice for growing chocolate business? via /r/Entrepreneur http://ift.tt/2n1yu9G 
business,10-04-2017,In less than a month, this currency has gone from being the best in the world to the worst https://bloom.bg/2oXUcsF pic.twitter.com/GECjs7Cn15
drboycewatkins1,04-04-2017,Choose life and business partners who make you better, not people who cause you to carry an unbearable load
HSBCUKBusiness,05-04-2017,We asked top entrepreneurs for the advice they wish they'd been given when starting out in business. #BritishEntrepreneurspic.twitter.com/OGsrw8YnpY
RacketOfficial,12-04-2017,#Vivegam area wise business to start in next few days.. Theatre owners,Distributors & Guest Appearance - @RamCinemaspic.twitter.com/3jCAFPjcbZ
Seb_Kos,11-04-2017,#OscarMunoz just resign if you can't properly handle business @united. #BoycottUnitedAirlines.
Lolabunnnz_,04-04-2017,S/o to the people who mind their own business daily, and work towards their goals.
IoTRecruiting,06-04-2017,Developing #Business Models for #IoT #Startups https://www.linkedin.com/pulse/developing-business-models-iot-startups-bill-mccabe … #AI #IoE #IIoT #BigData #BlockChain #Fintech #InternetOfThings #ARpic.twitter.com/AeGbkolTc3
CherylSnapp,10-04-2017,By @DavidKWilliams - I agree!https://www.forbes.com/sites/davidkwilliams/2017/04/10/why-we-need-both-introverts-and-extroverts-in-business/#43d6ba2e3ac6 …
Cc77255381,07-04-2017,Alternatives to Abortion Minding your dam business! Men should worry about themselves! Let women deal with their own bodies!
AllKeralaSFC,03-04-2017,#Ayan Kerala Business Rights - 80Lakhs Gross - 4.35cr Share - 1.75cr #BlockBuster #8YearsOfAyanpic.twitter.com/VIRbElGrZH
MissRBaller,11-04-2017,I'm always voting on twitter polls that I have no business being apart of. I just wanna see what the majority of people are voting for
IoTRecruiting,11-04-2017,How to Nail your #InternetOfThings Interview https://www.linkedin.com/pulse/how-nail-your-internet-things-interview-bill-mccabe … #AI #IoT #IoE #IIoT #BigData #BlockChain #Fintech #Cognitive #Business pic.twitter.com/1JRzQb5bTe
MBLNetwork,03-04-2017,MBL Live! Broadcast TONIGHT 630PM EST | Week 4 Jaguars vs Chiefs | Play by Play! #FranchiseNation #Madden17 "The Best In The Business" pic.twitter.com/g8VsdKe3Bq
KeelinMcafee,03-04-2017,I wish everyone would stay in their own business and not assume things by looks people are crazy
damyantiwrites,03-04-2017,The business of writing in a globalized world that is mostly local... #asmsg #amwriting #finance http://goo.gl/IZJFZa  via @Hans_Hirschi
HackneyAbbott,11-04-2017,Late payments problem for small business. Small firms wait 72 days to be paid. Big corporations wait 48 days. Labour will act #latepayments
somalijawn,04-04-2017,tell that cashier to stop holding up the line and mind their business. https://twitter.com/cnn/status/849071779519901696 …
_Badassiee,11-04-2017,Drink lemon water, and mind your business
investfcowards,03-04-2017,Ok cool thank you if you ever need help building your personal or business brand. Message me! #the30ygrindhttps://twitter.com/thomaslvaughn/status/848614835181031426 …
petterkamau,08-04-2017,Drinking beer while talking business BEERSHARA
saulkayebusines,03-04-2017,THX for following @RubenOrozcoHere's some free video training to get 100 affiliates in your business http://bit.ly/2bAVEgE 
emmieisfat,08-04-2017,You could wake up everyday and mind your own business, but ppl will still try to find a way to include you in their bullshit. I am tired.
officialyunglo,03-04-2017,So I'm having a hard time deciding on how I wanna design my 2017 summer business card .... I do graphics... http://fb.me/Fo7EJhQ1 
quinnnn_,05-04-2017,if i wanna put every last feeling on my twitter that's my business , get over it or stay off my page.
tonyarena,03-04-2017,Your #business might be profitable but have no value #smeukhttp://ow.ly/dz2230atTO6 
quuootteessss,12-04-2017,Punctuality is one of the cardinal business virtues. Always insist on it in your subordinates. - Don Marquis
rileywheelers,03-04-2017,Actress and actors get replaced??? It's how show business works???
caryssadr,12-04-2017,Barbara, I just met a real life biological Russian woman with a head for business and a bod for sin !!! pic.twitter.com/58UPdtnO1x
JeffBarnhartCMA,04-04-2017,3 Reasons Your Employees Are Miserable at Work ( and What to Do About It) http://dlvr.it/Np7DPc  #business #leadershippic.twitter.com/h8vb4Xbm8V
business,12-04-2017,These industries are potentially the most vulnerable to post-Brexit changes on EU migrants https://bloom.bg/2oztx7H pic.twitter.com/T6mTksx4VO
48andBeyond,03-04-2017,business pass on the increased Labour costs to its local markets. Competing ext. dies!
O_M_Cheese,03-04-2017,support local business.
IoTRecruiting,08-04-2017,What is #BigData ? https://www.linkedin.com/pulse/what-big-data-bill-mccabe … #AI #IoT #IoE #IIoT #BlockChain #Fintech #InternetOfThings #Technology #Business #Cognitive #ARpic.twitter.com/dKAwpoPmww
freelancer,03-04-2017,What's so great about being a Freelancer user? http://buff.ly/2o8B9yG  #freelancing #business pic.twitter.com/bMhcrfgq1j
tontopat,12-04-2017,I picked up a city Alalyst who advises private equity Banks were to invest their money.It would appear that UBER is now a Toxic Business Mod
drmoonlight9,03-04-2017,For US security, appoint an independent investigation of Trump's Russian business and election ties. #ATN #RussiaGate #TrumpPutin
e_thingsocial,03-04-2017,This business model has grown in popularity since TOMS & now replicated across numerous categories http://buff.ly/2ogQs7X  @CassandraReportpic.twitter.com/prB1Rp7bSK
tonysama,03-04-2017,I liked a video How to market your Le-Vel Business Online Thrive Time http://fb.me/1T43RYvrN 
roryt3506,12-04-2017,#UnitedAirlinesMottos Pepsi: we made the worst business decision possible and no one can top it UA: Give me 10 minutes
AJBentleyUK,09-04-2017,Are these guys just the fricken BEST or what????!! A cracking show from the best in the business!! #AnEveningWithTakeThatpic.twitter.com/IP9LxQ17HS
slidefirst32,03-04-2017,Small Business #SEO in 2017: A Survey via @clutch_co http://buff.ly/2ovZon4 pic.twitter.com/zXGgoZRpQJ
a_martin1212,05-04-2017,People will tweet every aspect of their life and be like "why are you in my business" lol
SicilianInHeels,03-04-2017,Lmaoooo RT @big_business_: Chantel Jeffries is just a pretty culture vulture. Funny to ya boy.pic.twitter.com/b4OSxXBZib
paulocoelho,06-04-2017,What other people think of you is none of your business
ASHA7777,03-04-2017,The only thing I've gathered from Tyrese rant and Kendrick lyrics is men have to mind men business.
ESH_Softball,07-04-2017,Great job of not looking ahead and taking care of business tonight. Cards win 12-1 over South Stokes! BIG GAME tomorrow vs North Stokes!!!!!
JVCrum,03-04-2017,30 Day Money Formula for Business Listen http://ow.ly/l9Hu309RopF  #entrepreneur #entrepreneurship #richardbransonpic.twitter.com/lpjaPJngCS
Richtay__,06-04-2017,I hate messy ass females that's always worried about the next mf like MIND YOUR BUSINESS BITCH
Steven_Clan,03-04-2017,we've been shite all season so this isn't shitting the bed it's business as usual.
HeyPariss,06-04-2017,Too many fake woke, always offended,never minding their own business, love to argue people of twitter.. wasn't like this a few years ago
JWall__2,03-04-2017,own a business
RepJayapal,06-04-2017,Neil Gorsuch has such an affinity for big business that he ruled corporations should get the same constitutional protections as people. pic.twitter.com/VURI5bhyV0
DaisyDream293,07-04-2017,At this point I don't even wanna hear negative shit about other people; That's their business, not mine.
ViralTweetMedia,11-04-2017,Contact us if you need social media advertising for your small business, we can get you seen by thousands of people each day!
warren__terra,03-04-2017,Also: Roger Stone. Page Carter. Jared Kushner. Trump's own weird denials of his own otherwise uncontroversial business ties with Russia.
ComedyWorIdStar,12-04-2017,Dude got straight to business pic.twitter.com/bxdmuwNkpl
Moneygirlapee,10-04-2017,Bitches ain't yo friend they just wanna kno yo business & talk down on ya ass later ..
SinsweetyEscort,03-04-2017,8 Reasons Online Dating Sites Are a Business Dead End - AlleyWatch http://ift.tt/2nLuOGs  http://ift.tt/2aM5wUL 
BizWorksCenter,03-04-2017,Entrepreneur Info 6 Simple Ways to Revamp Your Small Business' Online Presence http://ow.ly/hLwz50aAKHP 
BourseetTrading,03-04-2017,25 Features Every #Business #Website Must Have in 2017 ( #Infographic) #fintech #defstar5 #makeyourownlane #Mpgvip https://www.entrepreneur.com/article/291093 pic.twitter.com/yVzYcSuxFD
sedlacekkaren,03-04-2017,Is this what they mean by running the gov like a business? To whose benefit? Billionaires and their agendas to acquire more wealth. Shame! https://twitter.com/ezlusztig/status/848504128343035910 …
2pacShakir,06-04-2017,Very very private with my business now
BiggJohn5,06-04-2017,Thugger gave us RichGang Tour, Barter 6, SS, I'm up, SS2, SS3 and Jeffery in the span of 2 years... excuse me but what the fuck is a MMLP2?
VC_watcher,03-04-2017,How to profit from the blockchain tech stack | VentureBeat | Business | by Jere… https://venturebeat.com/2017/04/02/how-to-profit-from-the-blockchain-tech-stack/ …, see more http://tweetedtimes.com/v/1163?s=tnp 
TreMelvin,03-04-2017,like is it really that hard to mind your own business lmao like girl
ModernLifeTimes,03-04-2017,The Secrets Of Turning Your #People From Staff Into A Team - ModernLifeTimes http://bit.ly/2ae0cVz  #Business #company
CostSavingM,03-04-2017,One page website - £100 + VAT! Get a professionally looking landing page or a small business website. #sme #websitedesign #webdesignpic.twitter.com/PUIEJ7qVSU
Samuel_Nosa1,09-04-2017,Our Naija pipu no dey carry last, everything na Business.. #BBFinalepic.twitter.com/vuCiGp10jG
WoodArtsUniv,04-04-2017,Upto 65% off globe pen stand w/ business card holder will add a touch of elegance to office. https://goo.gl/7Oe8E4  @CorpoBienestarpic.twitter.com/5eu4O1V3zC
ipfconline1,03-04-2017,Choosing The Right #SocialMedia Platform for Your #Business [infographic] #Marketing #SEO #GrowthHacking #SMM #SMO #Growth @BadeRajasekharpic.twitter.com/ufhEDAtZuY
BurrellAndria,07-04-2017,Drink water and mind ya business pic.twitter.com/LiPYeeTezJ
NoirMJ,10-04-2017,If a business cannot afford to pay its workers a genuine living wage then it's not a business, it's a racket....
TheChadUknow,03-04-2017,What goes on in the firmament is God's business. Man has exploited your ignorance with mumbo-jumbo.
trabajo_rapido,03-04-2017,AVP, Member Business Ventures en Wyoming WY http://dlvr.it/NnR3v0 
poemsandthongs,04-04-2017,ALWAYS MINDING MY BUSINESS AND BEING LOWKEY WITH MY SEXY ASS
ArieeMonaee,05-04-2017,Ain't nothing like staying lowkey and minding ya business Positive Vibes baby
CjayyTaughtHer,04-04-2017,Karlie will tell her business to anybody. #LHHATL
joreag,03-04-2017,ework.de: SAP-Analyst SAP BI / Inhouse Consulting / Applikationsmanagement Business Intelligence... http://ow.ly/Fi8C50aALCF 
mybettingnews,03-04-2017,RACING BUSINESS Arc's 16 racecourses join Rewards4Racing programme: Arena Racing Company courses such as Doncaster… http://dlvr.it/NnQwzM pic.twitter.com/fqVUCpOgBR
AngrySalmond,04-04-2017,Theresa May won't condemn a refugee ban and does business with the Saudis...but rebranding Easter is a step too far?
jenniferrrrg1,10-04-2017,minding my business. protecting my peace
HereBeProof,03-04-2017,Is 'Russia' a red-herring - actually an attempted big business coup, involving 'oligarchs' in US/Russia/UK/etc with Putin the smokescreen? https://twitter.com/AdamsFlaFan/status/848601859635937288 …
AFWhope,03-04-2017,Founders:The owners of @ClifBar share business advice that could have saved them about $70 million http://read.bi/2opv11W  via @bi_strategy
Pogofilm,13-04-2017,If you see us around be sure to grab one of our business cards! #MalvernHillsHour #midlandshourpic.twitter.com/obL0kl32jH
marianosirena,03-04-2017,7 Case Studies on the Importance of #Branding in #Business http://bit.ly/2e6hsni  via logodesignteam
ThomasSmale,03-04-2017,Learn how to market your SaaS business and set yourself up for success https://www.entrepreneur.com/article/277821 
chainbear,04-04-2017,"Private businesses should be allowed to refuse to bake cakes for gays" BUT ALSO "Private business MUST acknowledge Easter"
brianleroux,03-04-2017,Don't remember a business model ...
Jaquandor,03-04-2017,I never do business with Collectives. Always full of themselves and trying to use the law to get out of paying. #storycrafter
SandraCM55,12-04-2017,If passed could result in mass exodus of all educated, talented, useful real humans & business leaving NC to TrumpWorld's knuckdraggers
All_IreSummit,06-04-2017,Getting inspired and engaged at the All-Ireland Business summit #pitch4progress pic.twitter.com/rG6kCBRPTx
Ruubbenss,03-04-2017,Small Business Expert Advice: When to Close Down Your Business http://dlvr.it/NnQtPL 
press_aware,03-04-2017,Following Tuesday’s rally, stocks will ‘grind higher’ into 2018, analyst says http://pressaware.com/?p=21487  #business pic.twitter.com/IsWFUNm4U6
rileyybeckk,11-04-2017,you can literally just be minding your business and doing you 24/7 and people STILL gon talk
Forbes,08-04-2017,What do the most successful people in business have in common? They're always learning http://on.forbes.com/60158jpfP pic.twitter.com/m4TbCu994C
SaskStartups,05-04-2017,Bet you didn?t know that the Canadian government gives billions to business owners in #governmentgrants
SelfEmployDKing,03-04-2017,How to drive sales on #Twitter for your #Business: http://bit.ly/TMTSChallenge  Join the 14 Day #TMTSChallengepic.twitter.com/DeMBaWD8Xg
NikitaSumoHolic,03-04-2017,Yoga Class & Tiens Business Invitation Seminar Bandung [HD] #Highlights https://www.youtube.com/watch?v=2x3cEFWOiEA&feature=youtu.be … @nikifyinglifepic.twitter.com/mJj9DS0o7y
Nn84Naganatha,12-04-2017,#Vivegam area wise business to start in next few days..
GicAriana,03-04-2017,"The Canadian govt should be actively warning Canadian firms & investors about the risks of doing business in #Russia & w Russian firms"https://twitter.com/GicAriana/status/848610925993185282 …
SonyaTeclai,09-04-2017,Pray, work out, talk to loved ones, drink water, eat fruit and vegetables, read books, make your passion your career, & mind your business.
1BusinessTown,03-04-2017,Build your entire business plan, do #marketresearch, and #network without breaking the bank with @forpoly http://bit.ly/2jvwzHF pic.twitter.com/53nn9fNUTr
therealsmoothc1,10-04-2017,If it ant about business or money dont hit my dm pls .
ninaandtito,03-04-2017,remember, Hope Hicks said they paid Sproul's firm for "door knocks." http://fortune.com/2016/11/05/trump-rnc-voter-fraud/ …pic.twitter.com/AsZ85hQVEp
bumblevei,05-04-2017,BUMBLE IS NATIONAL BUSINESS PLAN CHAMPIONS!!!
EqualityPH_,11-04-2017,I'm pro choice and pro gay marriage. Simply because it is none of my damn business how others choose to live their lives.
GossSgafc,12-04-2017,THE REAL TENDERPRENEURS= KPMG, ABSA, SANLAM, MURRAY & ROBERTS, DIMENSION DATA(TOGETHER THEY TAKE ABOUT 93% OF GOVERNMENT BUSINESS!)
business,12-04-2017,Follow our live coverage of the news conference between Rex Tillerson and Sergei Lavrov https://bloom.bg/2p8HLdk pic.twitter.com/9MSeVNi6xY
BoltsJolts,03-04-2017,Welp. TB just needs to worry about their own business and let the chips fall where they may. Sure would be nice for ANY team to help. Sigh.
ChaabanRabih,04-04-2017,Social care for the elderly and disabled is in crisis –while the super-rich & big business get giveaways worth £73bn http://press.labour.org.uk/post/159185350479/jeremy-corbyn-speech-to-launch-labours-local …pic.twitter.com/XgJsrUzJPS
2CivilityEK,03-04-2017,Top 5 reasons why #business #leaders don't communicate when they should. http://www.instituteforpr.org/top-five-reasons-leaders-dont-communicate/ … #PR #publicrelations #leadership
Canada_Startups,04-04-2017,Biggest Small Business Mistakes https://www.canadastartups.org/biggest-small-business-mistakes/ …pic.twitter.com/lc34bFPNXT
jacksonmaurer,03-04-2017,People need to learn to mind their own damn business...
imagerycreative,07-04-2017,The Top 10 #DigitalMarketing Trends #MakeYourOwnLane #GrowthHacking #Marketing #Business #Defstar5 #SocialMedia #SMM #SEOpic.twitter.com/3YLBQVQyDU
milkteu,04-04-2017,sehun looks like a dad who just came back from a long business trip and is excited to see his daughter pic.twitter.com/XZYrgyBd4T
ProsperityIM,03-04-2017,Prosperity Update: Sir Richard Branson vows to have Virgin Galactic... https://uk.finance.yahoo.com/news/sir-richard-branson-vows-virgin-180646321.html … #business #economypic.twitter.com/Riuu7ikqZT
RemyBlack1,03-04-2017,Alexa and Siri Are Invading Your Hotel Room...And Other Small Business Tech News This Week via @forbeshttp://www.forbes.com/sites/quickerbettertech/2017/04/02/alexa-and-siri-are-invading-your-hotel-room-and-other-small-business-tech-news-this-week/#b99ea4379df7 …
_Sagittarius17,04-04-2017,Stop Telling Everybody Your Business.
Karnythia,05-04-2017,Or that you are not an employee of whatever business & they keep trying to tell you what they want. Literally happens all the time
nashatton,12-04-2017,If any of you need any of these things promoted, message me -Soundcloud -Mix tapes -Youtube -Business -Twitter -Instagram -Snapchat
Tumie_Daniels,06-04-2017,Tomorrow better be "business as usual" just as Habib said when we were getting shot down during FMF
NatCounterPunch,11-04-2017,The idea of running government like a business is to screw labor. To pay labor is little as possible. http://www.counterpunch.org/2017/04/10/running-government-like-a-business-is-bad-for-citizens/ …pic.twitter.com/lWrqYCtHfm
Criticalanglez,03-04-2017,Trump's EPA chief says the Paris climate agreement is a 'bad deal' - Business Insider https://apple.news/AT5lEmk0rTf2VHJ3eItdOoA …
stats_warriors,03-04-2017,Mind your own business, kagaw your own galis! Pero galis ni Leni forever na! #KawawangLENI aleast sa galis may forever! Lol
varinformatics,11-04-2017,Varinformatics stands first at providing best #digitalmarketingservices which helps with the growth of business https://www.varinformatics.com/digital-marketing/ …pic.twitter.com/UK6QunXYjG
Bob_Staffford,03-04-2017,Do you have a #DREAM? Do you want your own #business to #WorkAtHome as a #successful #entrepreneur? http://ow.ly/YMUTJ 
Defend_Trump,03-04-2017,President Trump Bringing Business Sense to White House http://buff.ly/2nf28En 
WeedenKim,03-04-2017,As universities become more corporate, leadership less aware of internal talent, defaults to quasi-academic consultants who speak business.
SwingPathGolf,05-04-2017,Great news to announce that @SwingPathGolf have joined the @introbiz network #networking#business pic.twitter.com/Hmsf0P3mKw
akaiyukiii,03-04-2017,Like it's none of your damn business, so stfu
stevenhutt,03-04-2017,Storynomics: Hollywood Guru Opens for Business https://www.mhb.io/e/31mfl/57  #contentmarketing via @Skyword
viafalyn,03-04-2017,@kkstyle can we come up with a business plan to pitch to lyft for that "don't talk to me" option
AmourLaNoire,03-04-2017,Absolutely. No one wants to do that bc they'd lose money. Corrections is a money making business. https://twitter.com/the_realc4/status/848616101013590017 …
Tpainw98A,07-04-2017,#BBNaija if you like, let efe play poverty card or national identity card or business card, E no concern me all i know is vote Efe to 32052
EricODaily,07-04-2017,Me minding my business but also paying attention pic.twitter.com/tMpw7LFarE
thiccasaurus,06-04-2017,"Excuse me?" Character Change! Storyline based RP! She's voluptuous, yet serious! Detailed and Literate! Business Owner! pic.twitter.com/SJ4cwrZ9Kf
lendistry,03-04-2017,ICYMI: A Melting Pot of Business Advice: Learning from America’s Most Entrepreneurial Communities | Lendistry http://ow.ly/hEv830aq6ta 
lottspace,03-04-2017,Cut Business Costs with the Cloud. http://bit.ly/1VQmBfk  #salesblogpic.twitter.com/qn1jhRdVoa
I804jackboy,04-04-2017,At this point I don't even wanna hear negative shit about other people; That's their business, not mine
ABC,06-04-2017,Feds raid Calif. business suspected of cheating government visa program to obtain green cards for wealthy investors. http://abcn.ws/2p3xui6 pic.twitter.com/vjotZyEStp
serge_poznanski,03-04-2017,business: Drowning in paper? This company thinks it has the answer https://www.bloomberg.com/news/articles/2017-03-23/ripcord-removes-the-pain-of-paper-cuts-with-robot-digital-filers …pic.twitter.com/FPCJmMRgmS
simple_btdanger,08-04-2017,The hardest part of a business, is minding your own. #MAYWARDFlyHigh
TshepoTsala,10-04-2017,I have so much respect for people who are able to pick themselves up & try again, lose investments, business fails etc yet they try again
cityt0city,07-04-2017,focused on my self growth, booty growth & business growth
A2GFX,03-04-2017,Need Business Cards? GET 1,000 CARDS FOR $125 / 16PT. UV COAT ON BOTH SIDES (includes design, logo & printing) Sent To You ...GET BRANDED NO
lexxiisweets,12-04-2017,4 ways to survive out here 1. Mind 2. Your 3. Fuckin 4. Business
KennethHitchner,03-04-2017,What Are The Copyright Rules On Using Images Online? http://dlvr.it/NnQtlD  #business #marketingpic.twitter.com/Y8u4BMadjj
Engage_BM,06-04-2017,Need a weekend plan or simply traveling into Nairobi for business? Enjoy a colorful stay at @ParkInnNrbWestl #Parkinnpic.twitter.com/HEcE6BiXf5
AshLakayla,09-04-2017,Did I mention I own my own business at 16 pic.twitter.com/Kie25sSOyh
_KevinSosa_,11-04-2017,I like minding my business
press_aware,03-04-2017,Macron meets member of Fillon’s party, sets tongues wagging – France – RFI http://pressaware.com/?p=25282  #business pic.twitter.com/CLue2IRvyd
business,03-04-2017,Drowning in paper? This company thinks it has the answer https://www.bloomberg.com/news/articles/2017-03-23/ripcord-removes-the-pain-of-paper-cuts-with-robot-digital-filers …pic.twitter.com/v2HOYHQJpO
Crystalplazanj,03-04-2017,Crystal Plaza Group was honored by Governor Chris Christie for celebrating 100 years of business!! Read about it... http://fb.me/3UDOoRX8R 
contentmrktrapp,03-04-2017,#GrowthHacks - 5 steps to boosting growth in your business http://buff.ly/2owDpN8  by @Londoncoachinggpic.twitter.com/KmrxMiZ3To
TheQuietPsycho,11-04-2017,Liven up that boring conference call within a business meeting by yelling "Help! Call the police! They're killing me"...then disconnecting
Ragsblr,03-04-2017,#Katamarayudu Karnataka 10 days share 5.29 Cr. Business will be closed more or less in the coming weekend.
mymixtapez,04-04-2017,mind ya business pic.twitter.com/24yFyhw39Q
ekirchdoerfer,03-04-2017,What impact will you have? 6 Reasons To Start Your Own Home Based Business https://shar.es/1DprwB  #success #entrepreneaurlife
ITRemoteNow,12-04-2017,AppTech Corp (OTC: $APCX) offers secure remote support & managed IT for business with RemoteNow. http://bit.ly/2lnovdo  #tuesdaymotivationpic.twitter.com/WNN9QyhTCA
IFFB_Kenya,03-04-2017,Family Business Continuity – Dealers & Distributors side - Institute For Family Business (IFFB) http://shar.es/1QcwT0 pic.twitter.com/xnYQKRqLAw
business,10-04-2017,A $60 billion shock awaits the global shipping industry https://bloom.bg/2okkbus pic.twitter.com/vXNIM1buFQ
kia_soto,03-04-2017,She replied well you were in your car, I replied yes finishing a business transaction and I called myself being polite letting you go ahead
BrianDEvans,12-04-2017,Thinking of starting a business? I'm here to help. What do you want to know?
Hyvast,06-04-2017,Small business owners support Sturgeon's plans for another referendum - the guardian https://apple.news/Awk1l32_fSMSW3M3ISnq3-g …
MaryBernstein14,06-04-2017,US STATE DEPARTMENT TRAVEL WARNINGS FOR BUSINESS AND LEISURE TRAVELERS TO NIGERIA AND CAMEROON HUMAN RIGHTS ABUSES
business,08-04-2017,Here are the rules you need to know for a job interview in Japan https://bloom.bg/2nPJJkq pic.twitter.com/55eKifQ6oA
BasicREH,03-04-2017,It's cute when dirt old men try to act intellectually superior with their middle line business degree from 20 years ago. Eat shit, Robert.
beatzlady,03-04-2017,Favorited "PURE http://BREAKPIRATES.COM  JUNGLISM - 24/3/17 - GRAVEYARD BUSINESS" https://www.mixcloud.com/THERINSEMAN/pure-rinseman-junglism-24317-graveyard-business/ … by THERINSEMAN
business,09-04-2017,Why India could be the winner of a US-China trade war https://bloom.bg/2nsZQ93 pic.twitter.com/IfMjhLCOny
business,04-04-2017,EU leaders step up efforts to deal with a pile of bad debt worth more than $1.1 trillion https://bloom.bg/2nSwlKz pic.twitter.com/T8LnxI4nTm
