User handle,Date of tweet,Tweet Data
AvaPaigeMusic,03-04-2017,This guy "Chris" from London is in town for business and came inside to eat after he heard me singing. So sweet ! Nashville pic.twitter.com/FAFobAIAX8
vigilanzcorp,03-04-2017,Uncover critical insights that EMRs simply cannot find using VigiLanz Business Intelligence. MORE: http://ow.ly/wWX230aoS8V 
JemiahMB,05-04-2017,I never speak on someone else's life. I don't know what they're going through and what God is doing in their life. It's not my business.
LifeOfSamyell,11-04-2017,what's the meaning of MYB?? #MIND YOUR BUSINESS @ELrepGH x @AmgMedikal Dope track Good Morning
Democrat_4Trump,07-04-2017,No matter what happens I support Trump. This may just be a warning shot to China, Russia & Korea...and the Democrats. Trump means business.
hey_alyx,10-04-2017,The nicest thing about getting older is how easily I outvolve myself from things that are literally none of my business.
CowlesDoug,03-04-2017,Great job Don, Tina and Carol!!! Thank you for driving the business and filling that pipeline!!! Enjoy! @rex_hartley @sours25 @bigbrut74https://twitter.com/JimWeber16/status/848614606239141889 …
dentglobal,03-04-2017,. @LaingCallum ponders on #entrepreneurship in excerpt fr his book 'Progressive Partnerships: The Future of Business' http://bit.ly/29AWXtC 
rellamakrisha,11-04-2017,Mind your own business please. It's my awesome life, not yours.
DabneyCogdell,03-04-2017,Start your own home based Business with a Shopify Store, Following Step by Step of free training. Take 90-Day... http://bit.ly/2o8BYaL pic.twitter.com/fvnfa9Dsft
Far_Right_Watch,12-04-2017,Anywhere we see this sign, we buy extra stuff. News Vendors: It makes business sense ! pic.twitter.com/l4ULQNlbfJ
flwrpwr1969,05-04-2017,Mar-A-Lagoa cash cow 4 #CorrupTrump & Family, a free pleasure den 4GOP, a business conference hall, diplomat haven pic.twitter.com/NccJCE7zrS
xxxcaitlynxx,03-04-2017,no better feeling when no one knows your business
JXD_16,11-04-2017,TPD Ossie says "lets get #TongueOutTuesday back in business!!" pic.twitter.com/T8sxTzp6YU
paulokrobath,03-04-2017,Good afternoon everyone! PAULO ROBERTO KROBATH | Consultor Independente Herbalife | Business Opportunity Home https://www.visiteherbalife.com/paulokrobath/pt-BR/Page/4561 …
biz_works,03-04-2017,The latest The businessworks Daily! http://paper.li/biz_works?edition_id=c7562aa0-17b2-11e7-803f-002590a5ba2d … #business
PBR,13-04-2017,. @Triplett_Matt is taking care of business. #PBRpic.twitter.com/s5qGtpTVgl
DancesWithTamis,05-04-2017,It would have been a better business move for Pepsi to take all the money they spent on that commercial and bought a million cans of Pepsi
EdwardOakden,03-04-2017,Honoured to welcome our Prime Minster Theresa May to Jordan. Important visit at critical time.Much pressing business to discuss @UKinJordanpic.twitter.com/3lmfwpTZJV
LuneyyConcours,12-04-2017,#CONCOURS Gagne ton F-S Monkey Business FT #RT + #Follow @LuneyyConcours @Baguette_Rekt @PimousseTv TAS 01/05 pic.twitter.com/mzsTYeIvEl
Biz_Promo_Video,03-04-2017,Let us tell a story about your business in 1 minute with a great Promo Video - http://bit.ly/1RDli1z 
ScottVAnderson3,05-04-2017,I love it when Trump doesn't say what he's doing its none of the MSM's damn business what he's gonna do finally a leader we can trust HANDLE
business,11-04-2017,"A multicultural society is a multiconflict society," Marine Le Pen says https://bloom.bg/2okx6wf pic.twitter.com/cERJ8wbC5v
ICCAAfrica,06-04-2017,Happy Global Meetings Industry Day. Meetings Mean Business #GMID17 #ICCAworldpic.twitter.com/rbfxaHo3Ju
alarooney10,03-04-2017,[Quick Tip] The first step to #SocialMedia #analytics success is to outline your business objectives or goals. pic.twitter.com/NegXnD3i4q
business,05-04-2017,Robots enlist humans to win the warehouse war Amazon started https://bloom.bg/2p0MH35 pic.twitter.com/98gUfBvHn3
6Lurk6Moar6,07-04-2017,Daily Reminder Jared Kushner has over $250 million (at least) in business ventures w/ George Soros. I voted #Trump, not #Kushner #NoSyriaWarpic.twitter.com/JnMIbN11zL
PlugTalent,03-04-2017,#DigitalMarketing #makeyourownlane #defstar5 #ceo Flaws You Make While Doing Facebook Marketing for Your Business http://buff.ly/2oiagaU pic.twitter.com/nMBCBliqwV
sapphicsmizzy,07-04-2017,and now it's back to business Creds:lightwoodzero on ig pic.twitter.com/jrFgcRLHS4
business,12-04-2017,A group of investors is pressing Tesla to add 2 board directors who don’t have ties to Musk https://bloom.bg/2p4aMtG pic.twitter.com/Odp951UIrQ
CarlowLEO,08-04-2017,Why Carlow? It's the business for talent of course! Especially from @itcarlow ! Take a look! http://buff.ly/2oKKz3F pic.twitter.com/769rXBCFGX
iceyB103,04-04-2017,Pay ya bills & mind ya business, it's simple
GLOCKENHOF_ZH,05-04-2017,Discover #Zurich https://goo.gl/acw6pW  #hotel #business #travelpic.twitter.com/AovfjdhL6M
thatssokalyn,05-04-2017,when your boyfriend makes you wait 3-5 business days for your food
nengopasionn,03-04-2017,1,800 soldiers looking like 60 soldiers tho.. Anyway its non of my business https://twitter.com/nbstv/status/848596483310051328 …
khalilwhite12,05-04-2017,When nobody in yo business everything run smoother
press_aware,03-04-2017,From Ivanka Trump-Jared Kushner to Steve Bannon, Donald Trump employees disclose their finances http://pressaware.com/?p=24486  #business pic.twitter.com/duOYADN5Qs
banushameem079,03-04-2017,Perhaps they thought it would help their business. I hope Burlington Coat stores have not thrown out her beautiful clothing!
Salthorse1,03-04-2017,He's not hurting Corporate Agri-Business so much as it's hurting what few small farmers that are still hanging on. https://twitter.com/NBrougher/status/848607025319874560 …
Acute_Aphrodite,03-04-2017,Furthermore, why do people think you owe them a conversation when you're just minding your own business?
press_aware,03-04-2017,DeMarcus Cousins prepares to face Kings with ‘Loyalty’ on his mind http://pressaware.com/?p=24217  #business pic.twitter.com/RZMohuG7TR
lemonlightmedia,03-04-2017,6 Simple Ways to Revamp Your Small Business' Online Presence https://www.entrepreneur.com/article/292160 pic.twitter.com/sOQ2wMpZ1o
IoTRecruiting,12-04-2017,Great #Quote #AI #IoT #IoE #IIoT #BigData #BlockChain #Fintech #InternetOfThings #Technology #Business #ArtificialIntelligence #DeepLearningpic.twitter.com/5sK1GbUn6i
IBProfitLab,03-04-2017,What social media platforms should you be on when you first start your business http://bit.ly/1DTm7h1  #Business #Success
mycrowdz,03-04-2017,” The term has been around since 1980’s apparently and appeared first in Harvard Business Review. #supplychainhttp://bit.ly/2nJ5jY7 
readbuk48,03-04-2017,Republican's,more and more, are the party of small business,restoration of Main St. matters more than abortion, deal with it
danielhall,03-04-2017,"These 3 online business tools can help you be more productive & help with your marketing as well" @cornerstoneva https://goo.gl/ZcblwC pic.twitter.com/W7nf8fbgIA
vrai777,03-04-2017,Donald Trump's exchange rate bogey - Hindu Business Line $V #vrai777 #Global $FOREX #BreakingNews ? $BNewshttp://news.google.com/news/url?sa=t&fd=R&ct2=us&usg=AFQjCNFg8xqSH2Rr3-12unmCK38KYRGSjw&clid=c3a7d30bb8a4878e06b80cf16b898331&cid=52779438789925&ei=PU7hWOj4BM_P3QHBpYDIAQ&url=http://www.thehindubusinessline.com/opinion/columns/c-p-chandrasekhar/exposing-donald-trumps-exchange-rate-allegations/article9603243.ece …
business,10-04-2017,Here are the signs that a civilization is about to collapse https://bloom.bg/2nuY9YD pic.twitter.com/4iU13NtRn6
TJMPartners,05-04-2017,Latest Research: Is Mickey about to change how we watch sports? http://ow.ly/WXyE30aA391  Capital at risk #business #markets #disneypic.twitter.com/MraVIGVEbl
KatHeartwell,03-04-2017,Marriage wasn't made in the name of love. It was about ownership. Marriage and it's documentation is a business arrangement.
Simply_Kye_15,05-04-2017,It's business Wednesday so some of y'all gone be looking like some snacks tomorrow #Central_RYS17
ipfconline1,03-04-2017,Driving the Success of #DataScience Solutions : Skills, Roles and Responsabilities [Infographic] #BigData #Analytics #Business pic.twitter.com/l0sCMBqAUh
KentBusinesses,03-04-2017,Kent Business News: JAGUAR LAND ROVER CHOOSES WATERBROOK PARK AS ITS NEW ASHFORD HOME http://bit.ly/2nloOH4  #KentBusiness, #Kent
OkGiselleee,06-04-2017,Even my puppy sees shit that don't make sense but he still minds his business. Take notes y'all pic.twitter.com/YY3VQ4Je5L
FenkellPayroll,11-04-2017,Feed yo Family Mind Yo Business
geoffwnjwilson,03-04-2017,We have created several exciting partnership programmes @netballni - If your business is interested get in touch! https://lnkd.in/ggiSKdD 
alyssagregory,03-04-2017,Fire up your #smallbusiness. Join the Small Business Bonfire (free community for #smallbiz): http://ow.ly/IrMd30ahLgT 
business,12-04-2017,Is the euro doomed? We ask if the world's most ambitious financial experiment can survive https://bloom.bg/2p6qe5D pic.twitter.com/kTRxjl7lid
dpveuu,05-04-2017,Pk - Ideology MB - Business Tactics NTR - Legacy of Sr NTR AA - Dance Skills RC - Sensible Producer PB - Cutout pic.twitter.com/zEnxGqxobW
WaMphuthi,03-04-2017,So in summary, #Hlaudi unconventional business management did not work. #SABC must go back to the basics ...https://twitter.com/City_Press/status/848473851239563265 …
immarygracee,09-04-2017,Amanda who's a daughter of Francis Zamora, one of DJ's business partners for District 8 Manila, met KathNiel earlier. pic.twitter.com/VjmXH5cdBB
ImKhweziN,04-04-2017,Khanyi Dhlomo stays slaying and minds her business. An inspirational woman.
ThaboDLedimo,03-04-2017,An entitlement mentality in business you won't make it. Learn to work even if you won't see the results now! #leadership #Entrepreneurship
SethAbramson,11-04-2017,(PS3) No one knows (yet) the truth of #Russiagate. All we know—and this is one example—is that _none_ of this is normal course of business.
successwsuzie,03-04-2017,Terrible at sponsoring new reps into your business? You won't be after this. http://bit.ly/1N3goLJ pic.twitter.com/k3Ddgn6xdv
mblazoned,03-04-2017,I can't like anything by a traitor. Or a business person who doesn't practice what he preaches and takes manufacturing to other countries.
Ultrviol,03-04-2017,TV Remote Control Holder, mobile phone holder, business card holder, pen holder, holder, box-shaped.. https://www.etsy.com/listing/274883182/tv-remote-control-holder-mobile-phone?utm_source=around.io&utm_medium=twitter&utm_campaign=around.io … #keybox #box
PembValleyLodge,03-04-2017,Travelling on business? Take advantage of our newly remodelled Executive Meeting room for your next gathering! #Pemberton #Business pic.twitter.com/tiYNrUy5RR
make5calls,04-04-2017,Did you know staffers review and tally voicemails daily just like live-answered calls? No need to limit your calls to business hours!
Moreno,06-04-2017,The main rule for you to understand when starting a business is that 99% of your supporters won't be your friends or even from your hood
business,10-04-2017,Trump's visa crackdown has Indian students considering Canada and Ireland https://bloom.bg/2nvKwZh pic.twitter.com/XM2qG66HFK
friesxo,12-04-2017,drink your water, slay these hoes and mind your business. simple.
King_Bolarinwa,03-04-2017,Good morning guys. @ElGrande_NG is my business, Interior Design/Gifts & Souvenirs is what we do. Pls FF and RT, our clients are on your TL. pic.twitter.com/0JYdKveavM
kissthegroundCA,03-04-2017,Are all businesses destructive and degenerative? Regenerative business relates to a regenerative form of agricu… http://ift.tt/2n1QSzb pic.twitter.com/rvJUt6Hn9J
OneTroopArmy,03-04-2017,Don't let ya friends know ya business when ya fall off you exposed
business,13-04-2017,Bezos says artificial intelligence will fuel Amazon's success https://bloom.bg/2p9cR4C pic.twitter.com/0Jq5fn6zCT
Fadeandswish,06-04-2017,All i do is listen to music and mind my own dang business
business,03-04-2017,Inside the world's newest mega-skyscraper https://bloom.bg/2o23l59 pic.twitter.com/z1z8G9uX4U
realssullivan,06-04-2017,Business has narrow scope of profit and loss. Don't let that be the sole purpose of our great country. #Generouspic.twitter.com/dfJyjfiVg9
JoelBowerReal,03-04-2017,Hey #Entrepreneurs, do you love what you do? How has it helped your #business? http://bit.ly/2cdkndr  #entrepreneurlife #passion #success
DBJKezar,03-04-2017,After a century of doing business in Texas, the state is still a key market for @jcpenney.http://bizj.us/1p483i 
MsRaborife,07-04-2017,#SAUnites Heywood says he hopes this won't be just for today. SAcans must continue to fight for their rights. Business also part of problem
RobesonGroup,06-04-2017,Romanieo Jr. meets @jimmyfallon -the best host in the business! He had such a great time with the @FallonTonight team. Thanks everyone!!pic.twitter.com/fci0oEvtFZ
mahajansagrika,11-04-2017,#????_?????_???????? @PMOIndia @myogiadityanath @pksbjp @ndtv schools r becoming business pls stop them otherwise our kid's future in dark
stevekrohn,03-04-2017,5 Ways to Get Your Small Business Booming in New International Markets https://www.entrepreneur.com/article/283598 pic.twitter.com/EDjHjYDvaL
Active_Telecoms,03-04-2017,Singtel, Optus and Globe partner for initiative to boost business through technology http://ow.ly/vReb30atW73  #FutureMakers #Innovation
withlove_eb,06-04-2017,Me minding my business, but also paying attention... pic.twitter.com/T37mWDypXu
_Sec2No1,03-04-2017,I will never tell nobody my business anymore bcc mfs always running they mouth
fgalvaredo,03-04-2017,Trump's aggressiveness toward Mexico could be good for everyone but the US http://ift.tt/2nHdyUe  #pymes #business #negocios
marshawright,11-04-2017,The anatomy of an #entrepreneur Being a #business owner #founder or #ceo is a #lifestyle not just a job #startuppic.twitter.com/YmFccTngLO
TerraTennille,03-04-2017,Follow these 4 tips to ensure that meetings aren't getting in the way of running a #business @startupsco http://buff.ly/2oowJU9 pic.twitter.com/NZXLxK2VlB
UPClondon,03-04-2017,How to Avoid Procrastination in Your Small Business http://crwd.fr/2nGlweB pic.twitter.com/pLItlfHWSr
ShenaeCurry,03-04-2017,I know I can cook tho so mi nuh business.
Baz4peace,05-04-2017,Massive #Australians Queue in #Melbourne CBD on #freeconeday Protesting #BenandJerrys business ties with illegal #settlements in #Palestinepic.twitter.com/jABoFxE4yc
lenasluthxr,05-04-2017,lena: i like your pants kara: thanks i got them 50% off lena: i'd like them 100% off kara: that's not a good way to run a business :/ lena: pic.twitter.com/hmJpkvMCxg
coach2coachguy,03-04-2017,So What Can The Texas Two Step Teach Savvy Small Business Owners About Marketing? http://www.youcanmarketonlinenow.com/?p=18814 
ChrisSmalling,09-04-2017,Job well done boys and shoutout my man @MarcusRashford back with a goal and handling business as always #MUFCpic.twitter.com/4n3mQihbsZ
ImpeachTheNazi,09-04-2017,Does it make any sense to anyone that a leader under criminal investigation by the FBI for Treason is allowed to conduct business as usual? pic.twitter.com/YP1PZFaKBY
bootvful,05-04-2017,Tom Watson needs to go. If your deputy doesn't support you in business. They need to go. Otherwise you will achieve nothing. #tomwatson
ukbusinessnet,03-04-2017,Visit our website http://www.firstmailing.co.uk/about-us/  We are always #happy to help grow your business @firstmailing #marketingpic.twitter.com/CNJvQx0Oht
KervinMarketing,03-04-2017,Tyra Banks Removes Age Limits For 'America's Next Top Model': Will this change overall percept.. #business #newshttp://dld.bz/f9hPG 
teamshawnie,07-04-2017,Our business is Our business
DailyPamphlet,03-04-2017,Ivanka is well educated, articulate, smart and has business acumen and experience and is working for YOU for free. #Idiocy #MAGAhttps://twitter.com/BetteMidler/status/848296118328979456 …
EmzeeMaze,03-04-2017,I should be able to turn my songs in as homework since it shows I'm handling business and dropping Grade A
ChefKamiRedd,03-04-2017,For motivation & tips to run, grow and #brand your small #business? Follow me. (ChefKamiRedd):... http://fb.me/660xRV8GN 
BassProShops,03-04-2017,Good afternoon, catalogs usually take 10 to 14 business days to arrive. Thanks! –MB
EntrepreneurQ,10-04-2017,People want to do business with you because you help them get what they want. They don’t do business with you to help you get what you want.
business,05-04-2017,Africa's biggest hydropower dam will supply electricity to Sudan https://bloom.bg/2p0bQLD pic.twitter.com/liXdqFY8Pi
TakingFiveHQ,11-04-2017,Dude got straight to business pic.twitter.com/EqU3iicCEz
James4Labour,11-04-2017,. @jeremycorbyn clearly says he is "happy to do an interview" re. #Syria after talking business. You look stupid & desperate, @SkyNews!https://twitter.com/skynews/status/851742140115726336 …
marcorobinson7,06-04-2017,NKD$ cryptocurrency blockchain powers the new rich LIST & helps fund and accelerate your business! #startup #entrepreneur @LondonLovesBizpic.twitter.com/50tlGNyEzJ
EdmistonTammy,05-04-2017,Make beauty your business with @AvonInsider. Contact me for info on how to become an #AvonRep! http://avon4.me/2n98V6A pic.twitter.com/LfzzMnKlmi
stunnninqbeauty,11-04-2017,damn, it seem like people worry about me more than I worry about myself stay tf out my business.
Vancity,03-04-2017,From marketing to business development, farmers market lunch and learn will cover topics that'll help grow your business! RSVP today. pic.twitter.com/gO4namVxvE
boymejo,04-04-2017,In firing his own two friends, Pres Digong shows he really means business, and not simply mouthing anti-corruption as what Noynoy did.
noctilin,05-04-2017,business card done!!! i love akihiko so much oh my god pic.twitter.com/1Baof0YQ96
SolarPowerb2b,03-04-2017,$110K Donation from Reliant Supports Solar Installation for No-Kill Animal Shelter in Houston - Business Wire (pre… http://bit.ly/2nOHz4D 
business,10-04-2017,Why old-school phones are making a comeback https://bloom.bg/2ok3TSf pic.twitter.com/NwGyeMGx3w
Greyhound2man,03-04-2017,Mind your own business My position is nothing to do with anyone but me. Cheeky cow.
gdoctor,03-04-2017,football has been a business for years.. you can't blame Chelsea and city for spending money.. that's how it is now days.. https://twitter.com/anthonycleaver/status/848605907265179648 …
TheRealDrMartin,09-04-2017,Hay Guys I'm Starting a Business Network For Entrepreneurs Who A Into - Corporate - Industrials - Manufacturing Please RT For Awareness pic.twitter.com/mOQLDoJNF2
toeic_etc,03-04-2017,Edward T. MacIntyre __________ Professor of Finance at Cauldwell School of Business since 1993. 1.?will be 2.?was 3.?is 4.?has been
business,05-04-2017,Video gaming becomes a scholarship sport at University of Utah https://bloom.bg/2oClqI6 pic.twitter.com/ICiCNv19lv
VanityFair,03-04-2017,Does a financially disappointing #GhostintheShell prove once and for all that whitewashing is bad for business? http://vntyfr.com/jtPBMjW  pic.twitter.com/AheNyHb8YQ
ptoafc83,03-04-2017,That's the beauty of boxing. It's business. Not personal. 4 wars yet 4 friends afterwards. Respect to all of you
PeterJeffries3,03-04-2017,Town centre redevelopments are plenty, new Business improvement district, long-term strategy's being developed & lots more.......
SocialeBusiness,03-04-2017,Understanding Your Marketing Metrics: What Matters When It Comes to ... - Business 2 Community https://goo.gl/fb/YVJkvh  #socialbusiness
Mark_Peabod1,03-04-2017,Location: "none ya damn business" LMAO pic.twitter.com/28alqS0jaA
stclubfootball,10-04-2017,Business as usual. pic.twitter.com/twI2xmsQO2
Dame_BBC,12-04-2017,Minding your own business is the best thing you can do
pantelischio,03-04-2017,The Small Business Guide on How to Create Simple Branded Videos via @CrazyEgg http://stfi.re/apzvazp  [ #marketing]pic.twitter.com/GWqJT0k1Ik
AaronFarrellUK,08-04-2017,Need to remember you're running 2 businesses.. the business you're in AND the business you're becoming
jim3love,04-04-2017,#NnamdiKanu/ #IPOB is formidable, resolute, unshakeable & relentless. We re here for business which is #Biafra restoration. #FreeBiafra.
business,12-04-2017,Wal-Mart will discount more than a million online items picked up in stores to take on Amazon https://bloom.bg/2p3YnpJ pic.twitter.com/IybuewWQgV
Blavity,10-04-2017,Digital platform offers multicultural women a chance to win $25,000 in small business funding http://buff.ly/2oi3Gk7 pic.twitter.com/zj1brx01ZJ
HenriPicker,03-04-2017,The left is in the business of moral relativism. Absolute truths are what they say they are. #RussiaGate
MobileAPPtelli,11-04-2017,Hire Top Mobile App Programmers for business or enterprise mobile app development – http://MobileAPPtelligence.com  http://dlvr.it/NsDtm7 pic.twitter.com/UwDcoTlOJp
pereira_one,03-04-2017,How To Use Facebook Chatbots to Market Your Business http://bit.ly/2oqA5pE  #SocialMedia #mentor2success
TytbonesCEO,03-04-2017,Big Brother's business is moving fast......make I reason my own sharply https://twitter.com/don_berba_jay/status/848615047790297089 …
alekkarlovic,05-04-2017,Hey @djkhaled it would be a honor for my marketing class in Portland Oregon to have you as a guest speaker and talk to us about business &
Slauts1,12-04-2017,You'll be minding your business trying to be the best trash you can be and a genuine girl will come into your life and mess up your plans.
alexandracapps_,06-04-2017,why do people not know how to mind their own business
kemontegut3,03-04-2017,24. Keep your business off of social media and away from your "friends".
societyofleader,03-04-2017,5 Ways to Get Your Small Business Booming in New International Markets http://ift.tt/2oNOmJB  Entrepreneur
zaaive,05-04-2017,STOP HATING ON GIRLS WHO PUT IN WORK INTO HOW THEY LOOK !!! ITS NONE OF UR BUSINESS WHAT SHE LOOKS LIKE WITHOUT MAKEUP
himani_kankaria,11-04-2017,Black Hat SEO Vs. White Hat #SEO #makeyourownlane #growthhacking #DigitalMarketing #defstar5 #startups #Marketing #business #tipspic.twitter.com/A5nopvPl9w
BikoFoundation,07-04-2017,"White liberals must leave Blacks to take care of their own business" - Steve Biko
himani_kankaria,12-04-2017,Choose the Right #socialmedia Platform for Your #business #DigitalMarketing #makeyourownlane #startups #growthhacking #defstar5 #marketingpic.twitter.com/apfP7AdlmU
KaivanShroff,11-04-2017,United' shares have plummeted almost $1 billion in a single day. Turns out, it's bad business to have your passengers beaten up by police.
Penaddy1,04-04-2017,I am so tired of Juan. Nice man, but all this Russia business is b.s. Nunes said that the docs he saw had NOTHING TO DO WITH RUSSIA!
dazzawhit3,03-04-2017,Rachel. Utterly iconic. The greatest movie of all time. "I'm not in the business. I am the business." #bladerunnerpic.twitter.com/1l2VucqodN
hpotterquotes,11-04-2017,The consequences of our actions are always so complicated, so diverse, that predicting the future is a very difficult business in deed...
Dallas_Mom,06-04-2017,MY life. MY choices. MY mistakes. MY lessons. MY business. Mind YOURS.
IngenicoNA,03-04-2017,WEBINAR: #Ingenico experts talk about how Pay-at-the-Table can benefit your business: http://hubs.ly/H06WQX20  #payments
_Udanyi,10-04-2017,Oya where is Sai Baba? Back to serious business. What is the state of our union? pic.twitter.com/c8QPT0UCYa
SAVEREUX1,03-04-2017,Congrats @Disney_Business & @mi_forums for the whole hard work you did this week. It was fab! #MIFDisneylandParis #eventprofs #BizinFrancepic.twitter.com/C6MatiQY6y
business,05-04-2017,NYC is poised to ban companies from asking job candidates about prior compensation https://bloom.bg/2p1yWkL pic.twitter.com/kLUSod4Jq7
_chulani,03-04-2017,business always becomes personal because people are too emotional
Names_Are_H4rd,03-04-2017,I thought there was evidence of him doing business with Russian spies? Shouldn't that get him impeached?
keshmalOii,08-04-2017,IM NOT TELLING NO BITCH BUSINESS AFTER WE FALL OUT I'LL DEFINITELY TALK MY SHIT BUT YO SECRETS IS SAFE WITH ME PERIOD
MariaCabildo,03-04-2017,Aside from owning a home, having your own business is also part of the American Dream. Watch VIDEO! http://bit.ly/2nLsIq4  #Maria4Congress
EdwardJWHunter,04-04-2017,. @wef : "Sweden now ranks number 1 on the Forbes’ annual list of the Best Countries for Business. Compare that to the US, which ranks 23rd"
snsuits,03-04-2017,MT @sdv92: Why is Fed. Govt. NOT doing the 1 job granted to it? Instead of being in the States business. #ReinInDCpic.twitter.com/qhVgyXTYtm
business,05-04-2017,New H-1B visa guidelines crack down on computer programmer jobs https://bloom.bg/2o6Prz3 pic.twitter.com/25VWn54J8v
24_7RT,03-04-2017,How to start a #business with no money - @StartaHQ http://buff.ly/2ooLSVs   #startups
KingHSUpdates,08-04-2017,“‘Sign of the Times’ is a bold, brilliant, and fresh take on how to be a recovering boy-band boy wonder.” - Business Insider
AllstateMidwest,03-04-2017,Want to run your own business? Become a Personal Financial Representative with @Allstate http://a.ll.st/JkjZo3 
creativemindsan,03-04-2017,New 'Licence Resale' section on our website with a part-time business for sale in South West London. http://bit.ly/2nI5KBV  #artists #art
press_aware,03-04-2017,Lady Gaga Holds Hands With Boyfriend Christian Carino at Star-Studded 31st Birthday Party http://pressaware.com/?p=21648  #business pic.twitter.com/PM0raIpS4M
ndmyv,03-04-2017,Oh I forgot it's only business days I've only hit 20, thank you for replying!
LMathe_,08-04-2017,I'd rather talk to someone in person. All of this texting/calling business is so dead to me man
